stage,status,source,title,reason,url,feed_url,published_sgt
3_KEYWORD_FILTER,REJECTED,Cybersec,Bank Trojan 'Casbaneiro' Worms Through Latin America,KEYWORD_FILTER: no automotive+cybersec keyword overlap,https://www.darkreading.com/cyberattacks-data-breaches/bank-trojan-casbaneiro-worms-latin-america,https://www.darkreading.com/rss.xml,
3_KEYWORD_FILTER,REJECTED,Cybersec,Hackers Are Posting the Claude Code Leak With Bonus Malware,KEYWORD_FILTER: no automotive+cybersec keyword overlap,https://www.wired.com/story/security-news-this-week-hackers-are-posting-the-claude-code-leak-with-bonus-malware/,https://www.wired.com/feed/category/security/latest/rss,
3_KEYWORD_FILTER,REJECTED,Cybersec,Meta Pauses Work With Mercor After Data Breach Puts AI Industry Secrets at Risk,KEYWORD_FILTER: no automotive+cybersec keyword overlap,https://www.wired.com/story/meta-pauses-work-with-mercor-after-data-breach-puts-ai-industry-secrets-at-risk/,https://www.wired.com/feed/category/security/latest/rss,
3_KEYWORD_FILTER,REJECTED,Cybersec,CBP Facility Codes Sure Seem to Have Leaked Via Online Flashcards,KEYWORD_FILTER: no automotive+cybersec keyword overlap,https://www.wired.com/story/cbp-facility-codes-sure-seem-to-have-leaked-via-online-flashcards/,https://www.wired.com/feed/category/security/latest/rss,
3_KEYWORD_FILTER,REJECTED,Cybersec,What Happens When a Nuclear Site Is Hit?,KEYWORD_FILTER: no automotive+cybersec keyword overlap,https://www.wired.com/story/heres-what-can-happen-when-the-us-bombs-irans-nuclear-sites/,https://www.wired.com/feed/category/security/latest/rss,
3_KEYWORD_FILTER,REJECTED,Cybersec,Unmasking the Paramilitary Agents Behind Trump’s Violent Immigration Crackdown,KEYWORD_FILTER: no automotive+cybersec keyword overlap,https://www.wired.com/story/border-patrol-bortac-borstar-use-of-force-midway-blitz/,https://www.wired.com/feed/category/security/latest/rss,
3_KEYWORD_FILTER,REJECTED,Cybersec,Trump’s FY2027 budget again targets CISA,KEYWORD_FILTER: no automotive+cybersec keyword overlap,https://www.cybersecuritydive.com/news/cisa-white-house-budget-fy27/816615/,https://www.cybersecuritydive.com/feeds/news/,
3_KEYWORD_FILTER,REJECTED,Cybersec,Researchers warn of critical flaws in Progress ShareFile,KEYWORD_FILTER: no automotive+cybersec keyword overlap,https://www.cybersecuritydive.com/news/researchers-critical-flaws-progress-sharefile/816599/,https://www.cybersecuritydive.com/feeds/news/,
3_KEYWORD_FILTER,REJECTED,Cybersec,Government agencies see cyber threats as major barrier to tech improvements,KEYWORD_FILTER: no automotive+cybersec keyword overlap,https://www.cybersecuritydive.com/news/cybersecurity-modernization-ai-ey-survey/816590/,https://www.cybersecuritydive.com/feeds/news/,
3_KEYWORD_FILTER,REJECTED,Cybersec,Critical flaw in F5 BIG-IP faces wide exploitation risk,KEYWORD_FILTER: no automotive+cybersec keyword overlap,https://www.cybersecuritydive.com/news/critical-flaw-in-f5-big-ip-faces-wide-exploitation-risk/816475/,https://www.cybersecuritydive.com/feeds/news/,
3_KEYWORD_FILTER,REJECTED,Cybersec,"Retail and hospitality CISOs expect budget growth, new AI headaches and opportunities",KEYWORD_FILTER: no automotive+cybersec keyword overlap,https://www.cybersecuritydive.com/news/retail-hospitality-ai-cybersecurity-cisos-survey/816460/,https://www.cybersecuritydive.com/feeds/news/,
3_KEYWORD_FILTER,REJECTED,Cybersec,Vietnam-Linked PXA Stealer Campaign Exploits LinkedIn to Target Professionals Globally,KEYWORD_FILTER: no automotive+cybersec keyword overlap,https://thecyberexpress.com/pxa-stealer-vietnam-linked-actors-linkedin/,https://thecyberexpress.com/feed,
3_KEYWORD_FILTER,REJECTED,Cybersec,FBI Warns of Data Security Risks in Foreign-Developed Mobile Apps,KEYWORD_FILTER: no automotive+cybersec keyword overlap,https://thecyberexpress.com/data-security-risks-in-foreign-mobile-apps/,https://thecyberexpress.com/feed,
3_KEYWORD_FILTER,REJECTED,Cybersec,FBI Warns of AVrecon Malware Targeting Network Devices Across 163 Countries,KEYWORD_FILTER: no automotive+cybersec keyword overlap,https://thecyberexpress.com/fbi-warns-of-avrecon-malware/,https://thecyberexpress.com/feed,
3_KEYWORD_FILTER,REJECTED,Cybersec,"Intesa Sanpaolo Missed Unauthorized Access for 2 Years, Regulator Reveals",KEYWORD_FILTER: no automotive+cybersec keyword overlap,https://thecyberexpress.com/intesa-sanpaolo-data-breach-missed-for-2-years/,https://thecyberexpress.com/feed,
3_KEYWORD_FILTER,REJECTED,Cybersec,Hasbro Discloses Cyberattack After Unauthorized Network Access Detected,KEYWORD_FILTER: no automotive+cybersec keyword overlap,https://thecyberexpress.com/hasbro-cyberattack/,https://thecyberexpress.com/feed,
3_KEYWORD_FILTER,REJECTED,Cybersec,Nigerian romance scammer jailed after being caught out by fellow fraudster,KEYWORD_FILTER: no automotive+cybersec keyword overlap,https://www.bitdefender.com/en-us/blog/hotforsecurity/nigerian-romance-scammer-jailed,https://www.grahamcluley.com/feed,
3_KEYWORD_FILTER,REJECTED,Cybersec,"The Week in Vulnerabilities: AI Frameworks, VMware, and Critical ICS Exposure",KEYWORD_FILTER: no automotive+cybersec keyword overlap,https://cyble.com/blog/cyble-weekly-vulnerabilities-report-apr-01/,https://cyble.com/feed,
3_KEYWORD_FILTER,REJECTED,Cybersec,"UNC1069 Targets Node.js Maintainers via Fake LinkedIn, Slack Profiles",KEYWORD_FILTER: no automotive+cybersec keyword overlap,https://hackread.com/unc1069-node-js-maintainer-fake-linkedin-slack-profile/,https://hackread.com/feed,
3_KEYWORD_FILTER,REJECTED,Cybersec,Fake ChatGPT Ad Blocker Chrome Extension Caught Spying on Users,KEYWORD_FILTER: no automotive+cybersec keyword overlap,https://hackread.com/fake-chatgpt-ad-blocker-chrome-extension-spy-users/,https://hackread.com/feed,
3_KEYWORD_FILTER,REJECTED,Cybersec,North Korean Hackers Abuse GitHub to Spy on South Korean Firms,KEYWORD_FILTER: no automotive+cybersec keyword overlap,https://hackread.com/north-korean-hackers-github-spy-south-korean-firms/,https://hackread.com/feed,
3_KEYWORD_FILTER,REJECTED,Cybersec,AI Firm Mercor Confirms Breach as Hackers Claim 4TB of Stolen Data,KEYWORD_FILTER: no automotive+cybersec keyword overlap,https://hackread.com/ai-firm-mercor-breach-hackers-4tb-data/,https://hackread.com/feed,
3_KEYWORD_FILTER,REJECTED,Cybersec,"ShinyHunters Hackers Claim Theft of 3M+ Cisco Records, Threaten Public Leak",KEYWORD_FILTER: no automotive+cybersec keyword overlap,https://hackread.com/shinyhunters-hackers-cisco-records-data-leak/,https://hackread.com/feed,
3_KEYWORD_FILTER,REJECTED,Cybersec,Microsoft Warns of WhatsApp Attachments Spreading Backdoor on Windows PCs,KEYWORD_FILTER: no automotive+cybersec keyword overlap,https://hackread.com/microsoft-whatsapp-attachments-backdoor-windows-pcs/,https://hackread.com/feed,
3_KEYWORD_FILTER,REJECTED,Cybersec,"Yurei Ransomware Uses Common Tools, Adds Stranger Things References",KEYWORD_FILTER: no automotive+cybersec keyword overlap,https://hackread.com/yurei-ransomware-tools-stranger-things-references/,https://hackread.com/feed,
3_KEYWORD_FILTER,REJECTED,Cybersec,"Storm Infostealer Sold as Service, Targets Browsers, Wallets and Accounts",KEYWORD_FILTER: no automotive+cybersec keyword overlap,https://hackread.com/storm-infostealer-sold-as-service-browsers-wallets/,https://hackread.com/feed,
3_KEYWORD_FILTER,REJECTED,Cybersec,Why GitHub Developers Are Targeted by Token Giveaway Scams,KEYWORD_FILTER: no automotive+cybersec keyword overlap,https://hackread.com/github-developers-targettoken-giveaway-scams/,https://hackread.com/feed,
3_KEYWORD_FILTER,REJECTED,Cybersec,Friday Squid Blogging: Jurassic Fish Chokes on Squid,KEYWORD_FILTER: no automotive+cybersec keyword overlap,https://www.schneier.com/blog/archives/2026/04/friday-squid-blogging-jurassic-fish-chokes-on-squid.html,https://www.schneier.com/feed/atom,
3_KEYWORD_FILTER,REJECTED,Cybersec,Company that Secretly Records and Publishes Zoom Meetings,KEYWORD_FILTER: no automotive+cybersec keyword overlap,https://www.schneier.com/blog/archives/2026/04/company-that-secretly-records-and-publishes-zoom-meetings.html,https://www.schneier.com/feed/atom,
3_KEYWORD_FILTER,REJECTED,Cybersec,US Bans All Foreign-Made Consumer Routers,KEYWORD_FILTER: no automotive+cybersec keyword overlap,https://www.schneier.com/blog/archives/2026/04/us-bans-all-foreign-made-consumer-routers.html,https://www.schneier.com/feed/atom,
3_KEYWORD_FILTER,REJECTED,Cybersec,Possible US Government iPhone Hacking Tool Leaked,KEYWORD_FILTER: no automotive+cybersec keyword overlap,https://www.schneier.com/blog/archives/2026/04/possible-us-government-iphone-hacking-tool-leaked.html,https://www.schneier.com/feed/atom,
3_KEYWORD_FILTER,REJECTED,Cybersec,"TeamPCP Supply Chain Campaign: Update 006 - CERT-EU Confirms European Commission Cloud Breach, Sportradar Details Emerge, and Mandiant Quantifies Campaign at 1,000&#x2b; SaaS Environments, (Fri, Apr 3rd)",KEYWORD_FILTER: no automotive+cybersec keyword overlap,https://isc.sans.edu/diary/rss/32864,https://isc.sans.edu/rssfeed_full.xml,
3_KEYWORD_FILTER,REJECTED,Cybersec,"ISC Stormcast For Friday, April 3rd, 2026 https://isc.sans.edu/podcastdetail/9878, (Fri, Apr 3rd)",KEYWORD_FILTER: no automotive+cybersec keyword overlap,https://isc.sans.edu/diary/rss/32862,https://isc.sans.edu/rssfeed_full.xml,
3_KEYWORD_FILTER,REJECTED,Cybersec,"Attempts to Exploit Exposed ""Vite"" Installs (CVE-2025-30208), (Thu, Apr 2nd)",KEYWORD_FILTER: no automotive+cybersec keyword overlap,https://isc.sans.edu/diary/rss/32860,https://isc.sans.edu/rssfeed_full.xml,
3_KEYWORD_FILTER,REJECTED,Cybersec,"ISC Stormcast For Thursday, April 2nd, 2026 https://isc.sans.edu/podcastdetail/9876, (Thu, Apr 2nd)",KEYWORD_FILTER: no automotive+cybersec keyword overlap,https://isc.sans.edu/diary/rss/32858,https://isc.sans.edu/rssfeed_full.xml,
3_KEYWORD_FILTER,REJECTED,Cybersec,Critical Fortinet FortiClient EMS 0-Day Vulnerability Actively Exploited in the Wild,KEYWORD_FILTER: no automotive+cybersec keyword overlap,https://cybersecuritynews.com/fortinet-forticlient-ems-0-day/,https://cybersecuritynews.com/feed/,
3_KEYWORD_FILTER,REJECTED,Cybersec,New Progress ShareFile Bugs Let Attackers Take Over Servers Without Logging In,KEYWORD_FILTER: no automotive+cybersec keyword overlap,https://cybersecuritynews.com/progress-sharefile-vulnerability/,https://cybersecuritynews.com/feed/,
3_KEYWORD_FILTER,REJECTED,Cybersec,Hackers Weaponize Claude Code Leak to Spread Vidar and GhostSocks Malware,KEYWORD_FILTER: no automotive+cybersec keyword overlap,https://cybersecuritynews.com/claude-code-leak-to-spread-vidar-and-ghostsocks-malware/,https://cybersecuritynews.com/feed/,
3_KEYWORD_FILTER,REJECTED,Cybersec,Top Node.js Maintainers Targeted in Sophisticated Social Engineering Scheme,KEYWORD_FILTER: no automotive+cybersec keyword overlap,https://cybersecuritynews.com/top-node-js-maintainers-targeted-social-engineering-scheme/,https://cybersecuritynews.com/feed/,
3_KEYWORD_FILTER,REJECTED,Cybersec,Top 10 Best User Access Management Tools in 2026,KEYWORD_FILTER: no automotive+cybersec keyword overlap,https://cybersecuritynews.com/user-access-management-tools/,https://cybersecuritynews.com/feed/,
3_KEYWORD_FILTER,REJECTED,Cybersec,Top 10 Best VPN For Chrome in 2026,KEYWORD_FILTER: no automotive+cybersec keyword overlap,https://cybersecuritynews.com/best-vpn-for-chrome/,https://cybersecuritynews.com/feed/,
3_KEYWORD_FILTER,REJECTED,Cybersec,LinkedIn Hidden Code Secretly Searches Your Browser for Installed Extensions,KEYWORD_FILTER: no automotive+cybersec keyword overlap,https://cybersecuritynews.com/linkedin-code-collects-data/,https://cybersecuritynews.com/feed/,
3_KEYWORD_FILTER,REJECTED,Cybersec,Anthropic Officially Ends Claude Subscriptions for Third-Party Tools Like OpenClaw,KEYWORD_FILTER: no automotive+cybersec keyword overlap,https://cybersecuritynews.com/claude-ends-openclaw-subscriptions/,https://cybersecuritynews.com/feed/,
3_KEYWORD_FILTER,REJECTED,Cybersec,"14,000+ F5 BIG-IP APM Devices Exposed Online Amid Active RCE Vulnerability Exploits",KEYWORD_FILTER: no automotive+cybersec keyword overlap,https://cybersecuritynews.com/14000-f5-big-ip-apm-exposed-online/,https://cybersecuritynews.com/feed/,
3_KEYWORD_FILTER,REJECTED,Cybersec,Kimsuky Deploys Malicious LNK Files to Deliver Python-Based Backdoor in Multi-Stage Attack,KEYWORD_FILTER: no automotive+cybersec keyword overlap,https://cybersecuritynews.com/kimsuky-deploys-malicious-lnk-files/,https://cybersecuritynews.com/feed/,
3_KEYWORD_FILTER,REJECTED,Cybersec,Hackers Launch Social Engineering Offensive Against Key Node.js Maintainers,KEYWORD_FILTER: no automotive+cybersec keyword overlap,https://gbhackers.com/hackers-launch-social-engineering-offensive-against-key-node-js/,https://gbhackers.com/feed/,
3_KEYWORD_FILTER,REJECTED,Cybersec,Top 10 Best Privileged Access Management (PAM) Solutions 2026,KEYWORD_FILTER: no automotive+cybersec keyword overlap,https://gbhackers.com/privileged-access-management/,https://gbhackers.com/feed/,
3_KEYWORD_FILTER,REJECTED,Cybersec,Top 10 Best Identity And Access Management (IAM) Companies 2026,KEYWORD_FILTER: no automotive+cybersec keyword overlap,https://gbhackers.com/best-iam-companies/,https://gbhackers.com/feed/,
3_KEYWORD_FILTER,REJECTED,Cybersec,LinkedIn Hidden Code Secretly Scans Users’ Computers for Installed Software,KEYWORD_FILTER: no automotive+cybersec keyword overlap,https://gbhackers.com/linkedin-hidden-code-secretly-scans-users-computers/,https://gbhackers.com/feed/,
3_KEYWORD_FILTER,REJECTED,Cybersec,Anthropic Ends Claude Subscription Access for Third-Party Tools Like OpenClaw,KEYWORD_FILTER: no automotive+cybersec keyword overlap,https://gbhackers.com/anthropic-ends-claude-subscription-access-for-openclaw/,https://gbhackers.com/feed/,
3_KEYWORD_FILTER,REJECTED,Cybersec,New Progress ShareFile Flaws Expose Servers to Unauthorized Remote Takeover,KEYWORD_FILTER: no automotive+cybersec keyword overlap,https://gbhackers.com/new-progress-sharefile-flaws-expose-servers/,https://gbhackers.com/feed/,
3_KEYWORD_FILTER,REJECTED,Cybersec,Microsoft Forces Unmanaged Windows 11 Devices to Upgrade to Version 24H2,KEYWORD_FILTER: no automotive+cybersec keyword overlap,https://gbhackers.com/microsoft-forces-unmanaged-windows-11-devices-to-upgrade/,https://gbhackers.com/feed/,
3_KEYWORD_FILTER,REJECTED,Cybersec,Infrastructure Engineer Pleads Guilty to Locking 254 Windows Servers at Former Employer,KEYWORD_FILTER: no automotive+cybersec keyword overlap,https://gbhackers.com/infrastructure-engineer-pleads-guilty-to-locking-254-windows-servers/,https://gbhackers.com/feed/,
3_KEYWORD_FILTER,REJECTED,Cybersec,Kimsuky Uses Malicious LNK Files to Drop Python Backdoor,KEYWORD_FILTER: no automotive+cybersec keyword overlap,https://gbhackers.com/kimsuky-uses-lnk-files/,https://gbhackers.com/feed/,
3_KEYWORD_FILTER,REJECTED,Cybersec,CISA Includes TrueConf Security Flaw in KEV Catalog After Exploitation in the Wild,KEYWORD_FILTER: no automotive+cybersec keyword overlap,https://gbhackers.com/cisa-includes-trueconf-security-flaw-in-kev-catalog/,https://gbhackers.com/feed/,
3_KEYWORD_FILTER,REJECTED,SG-News,"She transferred almost $20,000 to ‘police’ under threat of being detained",KEYWORD_FILTER: no automotive+cybersec keyword overlap,https://www.straitstimes.com/singapore/she-transferred-almost-20000-to-police-under-threat-of-being-detained,https://www.straitstimes.com/news/singapore/rss.xml,
3_KEYWORD_FILTER,REJECTED,SG-News,"Pilot initiative to be expanded to keep seniors active, socially connected to their communities",KEYWORD_FILTER: no automotive+cybersec keyword overlap,https://www.straitstimes.com/singapore/pilot-initiative-to-be-expanded-to-keep-seniors-active-socially-connected-to-their-communities,https://www.straitstimes.com/news/singapore/rss.xml,
3_KEYWORD_FILTER,REJECTED,SG-News,"ST PSLE Prep Forum: PSLE tests application of concepts, not regurgitation of facts",KEYWORD_FILTER: no automotive+cybersec keyword overlap,https://www.straitstimes.com/singapore/parenting-education/st-psle-prep-forum-psle-tests-application-of-concepts-not-regurgitation-of-facts,https://www.straitstimes.com/news/singapore/rss.xml,
3_KEYWORD_FILTER,REJECTED,SG-News,"4 taken to hospital, over 50 evacuated after fire in Buangkok condo unit",KEYWORD_FILTER: no automotive+cybersec keyword overlap,https://www.straitstimes.com/singapore/4-taken-to-hospital-over-50-evacuated-after-fire-in-buangkok-condo-unit,https://www.straitstimes.com/news/singapore/rss.xml,
3_KEYWORD_FILTER,REJECTED,SG-News,Car dealers race to secure $68m to renew lease for S’pore’s largest used-car hub,KEYWORD_FILTER: no automotive+cybersec keyword overlap,https://www.straitstimes.com/singapore/transport/car-dealers-race-to-secure-68m-to-renew-lease-for-automobile-megamart-spores-largest-used-car-hub,https://www.straitstimes.com/news/singapore/rss.xml,
3_KEYWORD_FILTER,REJECTED,SG-News,"3 arrested for causing hurt, robbery after 1.5-hour stand-off at Jurong HDB flat",KEYWORD_FILTER: no automotive+cybersec keyword overlap,https://www.straitstimes.com/singapore/3-arrested-for-causing-hurt-robbery-after-1-5-hour-stand-off-at-jurong-hdb-flat,https://www.straitstimes.com/news/singapore/rss.xml,
3_KEYWORD_FILTER,REJECTED,SG-News,"Ministerial committee to deal with supply shocks, price increases from Mid-East conflict: Shanmugam",KEYWORD_FILTER: no automotive+cybersec keyword overlap,https://www.straitstimes.com/singapore/politics/spore-has-not-yet-curbed-fuel-and-energy-use-in-managing-impact-of-middle-east-conflict-shanmugam,https://www.straitstimes.com/news/singapore/rss.xml,
3_KEYWORD_FILTER,REJECTED,SG-News,Doctors adopt aerospace technology for shoulder replacements to improve outcomes for patients,KEYWORD_FILTER: no automotive+cybersec keyword overlap,https://www.straitstimes.com/singapore/health/doctors-adopt-aerospace-technology-for-shoulder-replacements-to-improve-outcomes-for-patients,https://www.straitstimes.com/news/singapore/rss.xml,
3_KEYWORD_FILTER,REJECTED,SG-News,"Passenger, 82, dies after car accident at Airport Boulevard; 3 others injured",KEYWORD_FILTER: no automotive+cybersec keyword overlap,https://www.straitstimes.com/singapore/passenger-82-dies-after-car-accident-at-airport-boulevard-3-others-injured,https://www.straitstimes.com/news/singapore/rss.xml,
3_KEYWORD_FILTER,REJECTED,SG-News,"With energy prices rising, Taman Jurong pilots lighting system that can reap savings of over 70%",KEYWORD_FILTER: no automotive+cybersec keyword overlap,https://www.straitstimes.com/singapore/environment/with-energy-prices-rising-taman-jurong-pilots-lighting-system-that-can-reap-savings-of-over-70,https://www.straitstimes.com/news/singapore/rss.xml,
3_KEYWORD_FILTER,REJECTED,SG-News,They met once and got engaged two weeks later: Inside an arranged marriage in Singapore,KEYWORD_FILTER: no automotive+cybersec keyword overlap,https://www.straitstimes.com/singapore/they-met-once-and-got-engaged-two-weeks-later-inside-an-arranged-marriage-in-singapore,https://www.straitstimes.com/news/singapore/rss.xml,
3_KEYWORD_FILTER,REJECTED,SG-News,Jogger rushed to hospital after ‘super rare’ allergic reaction triggered by exercise,KEYWORD_FILTER: no automotive+cybersec keyword overlap,https://www.straitstimes.com/singapore/health/she-is-allergic-to-exercise-and-carries-two-epipens-as-precaution-when-she-travels,https://www.straitstimes.com/news/singapore/rss.xml,
3_KEYWORD_FILTER,REJECTED,SG-News,"Fewer matchmade marriages in Singapore, but tradition endures in Indian community",KEYWORD_FILTER: no automotive+cybersec keyword overlap,https://www.straitstimes.com/singapore/fewer-match-made-marriages-in-spore-but-tradition-endures-in-indian-community,https://www.straitstimes.com/news/singapore/rss.xml,
3_KEYWORD_FILTER,REJECTED,SG-News,WP disciplinary panel completes  investigations into party chief Pritam Singh,KEYWORD_FILTER: no automotive+cybersec keyword overlap,https://www.straitstimes.com/singapore/politics/wp-disciplinary-panel-completes-investigations-into-party-chief-pritam-singh,https://www.straitstimes.com/news/singapore/rss.xml,
3_KEYWORD_FILTER,REJECTED,SG-News,Help pours in for family of boy who drowned in Kallang River while fishing,KEYWORD_FILTER: no automotive+cybersec keyword overlap,https://www.straitstimes.com/singapore/help-pours-in-for-family-of-boy-who-drowned-in-kallang-river-while-fishing,https://www.straitstimes.com/news/singapore/rss.xml,
3_KEYWORD_FILTER,REJECTED,SG-News,More kids sexually assaulted in 2025; attacks by family members against them also up: Police,KEYWORD_FILTER: no automotive+cybersec keyword overlap,https://www.straitstimes.com/singapore/courts-crime/more-kids-sexually-assaulted-in-2025-attacks-by-family-members-against-them-also-up-police,https://www.straitstimes.com/news/singapore/rss.xml,
3_KEYWORD_FILTER,REJECTED,SG-News,Who pays for a climate-ready Singapore? Navigating the multi-billion bill for adaptation efforts,KEYWORD_FILTER: no automotive+cybersec keyword overlap,https://www.straitstimes.com/singapore/environment/who-pays-for-a-climate-ready-singapore-navigating-the-multi-billion-bill-for-adaptation-efforts,https://www.straitstimes.com/news/singapore/rss.xml,
3_KEYWORD_FILTER,REJECTED,SG-News,Police appeal for information on missing 68-year-old man last seen in Bukit Batok,KEYWORD_FILTER: no automotive+cybersec keyword overlap,https://www.straitstimes.com/singapore/police-appeal-for-information-on-missing-68-year-old-man-last-seen-in-bukit-batok,https://www.straitstimes.com/news/singapore/rss.xml,
3_KEYWORD_FILTER,REJECTED,SG-News,Orange marmalade product recalled due to potential presence of glass shards: SFA,KEYWORD_FILTER: no automotive+cybersec keyword overlap,https://www.straitstimes.com/singapore/orange-marmalade-product-recalled-due-to-potential-presence-of-glass-sfa,https://www.straitstimes.com/news/singapore/rss.xml,
3_KEYWORD_FILTER,REJECTED,SG-News,"HSA’s 3-week dash to design system tracking thousands of vape cases, from fines to rehab progress",KEYWORD_FILTER: no automotive+cybersec keyword overlap,https://www.straitstimes.com/singapore/courts-crime/hsas-3-week-dash-to-design-system-tracking-thousands-of-vape-cases-from-fines-to-rehab-progress,https://www.straitstimes.com/news/singapore/rss.xml,
3_KEYWORD_FILTER,REJECTED,SG-News,How does heat affect the way we walk? New HTX tool tracks policemen’s gait to prevent heat illness,KEYWORD_FILTER: no automotive+cybersec keyword overlap,https://www.straitstimes.com/singapore/environment/how-does-heat-affect-the-way-we-walk-new-htx-tool-tracks-policemens-gait-to-prevent-heat-injury,https://www.straitstimes.com/news/singapore/rss.xml,
3_KEYWORD_FILTER,REJECTED,SG-News,Car driver arrested after hit-and-run accident injuring motorcyclist in Serangoon,KEYWORD_FILTER: no automotive+cybersec keyword overlap,https://www.straitstimes.com/singapore/car-driver-arrested-after-hit-and-run-accident-injuring-motorcyclist-in-serangoon,https://www.straitstimes.com/news/singapore/rss.xml,
3_KEYWORD_FILTER,REJECTED,SG-News,S’pore has not yet curbed fuel and energy use in managing impact of Middle East conflict: Shanmugam,KEYWORD_FILTER: no automotive+cybersec keyword overlap,https://www.businesstimes.com.sg/singapore/spore-has-not-yet-curbed-fuel-and-energy-use-managing-impact-middle-east-conflict-shanmugam,https://www.businesstimes.com.sg/rss/singapore,
3_KEYWORD_FILTER,REJECTED,SG-News,Vietnam growth slows as rising energy costs feed uncertainty,KEYWORD_FILTER: no automotive+cybersec keyword overlap,https://www.businesstimes.com.sg/international/vietnam-growth-slows-rising-energy-costs-feed-uncertainty,https://www.businesstimes.com.sg/rss/singapore,
3_KEYWORD_FILTER,REJECTED,SG-News,WP disciplinary panel completes investigations into party chief Pritam Singh,KEYWORD_FILTER: no automotive+cybersec keyword overlap,https://www.businesstimes.com.sg/singapore/wp-disciplinary-panel-completes-investigations-party-chief-pritam-singh,https://www.businesstimes.com.sg/rss/singapore,
3_KEYWORD_FILTER,REJECTED,SG-News,"How discounts, deals are helping petrol players counter Cnergy’s low pump prices",KEYWORD_FILTER: no automotive+cybersec keyword overlap,https://www.businesstimes.com.sg/companies-markets/energy-commodities/how-discounts-deals-are-helping-petrol-players-counter-cnergys-low-pump-prices,https://www.businesstimes.com.sg/rss/singapore,
3_KEYWORD_FILTER,REJECTED,SG-News,Singapore’s FoodXervices – long-time supplier to F&B sector – calls it a day after 92 years,KEYWORD_FILTER: no automotive+cybersec keyword overlap,https://www.businesstimes.com.sg/singapore/singapores-foodxervices-long-time-supplier-fb-sector-calls-it-day-after-92-years,https://www.businesstimes.com.sg/rss/singapore,
3_KEYWORD_FILTER,REJECTED,SG-News,A sip of heritage at Canning Bar & Lounge,KEYWORD_FILTER: no automotive+cybersec keyword overlap,https://www.businesstimes.com.sg/lifestyle/sip-heritage-canning-bar-lounge,https://www.businesstimes.com.sg/rss/singapore,
3_KEYWORD_FILTER,REJECTED,SG-News,"Singapore PMI edges down to 50.5 in March, as early signs of disruption from Gulf conflict emerge",KEYWORD_FILTER: no automotive+cybersec keyword overlap,https://www.businesstimes.com.sg/singapore/economy-policy/singapore-pmi-edges-down-50-5-march-early-signs-disruption-gulf-conflict-emerge,https://www.businesstimes.com.sg/rss/singapore,
3_KEYWORD_FILTER,REJECTED,SG-News,Singapore fuel oil inventories ease to four-week lows,KEYWORD_FILTER: no automotive+cybersec keyword overlap,https://www.businesstimes.com.sg/singapore/singapore-fuel-oil-inventories-ease-four-week-lows,https://www.businesstimes.com.sg/rss/singapore,
