stage,status,source,title,reason,url,feed_url
1_SCRAPER_DATE,REJECTED,Cybersec,#StopRansomware: Medusa Ransomware,TOO_OLD: published before 72h cutoff,https://www.cisa.gov/news-events/cybersecurity-advisories/aa25-071a,https://www.cisa.gov/uscert/ncas/alerts.xml
1_SCRAPER_DATE,REJECTED,Cybersec,Volvo rolling out its largest OTA software update in history,TOO_OLD: published before 72h cutoff,https://www.wardsauto.com/news/volvo-biggest-ota-update-software-comapny-history-google-maps-android-automotive-os/813588/,https://www.automotivedive.com/feeds/news/
1_SCRAPER_DATE,REJECTED,Cybersec,Mazda North America CEO looks to boost US sales with new CX-5,TOO_OLD: published before 72h cutoff,https://www.wardsauto.com/news/mazda-ceo-tom-donnelly-redesigned-cx5-sales-popular-consumers-dealers/813314/,https://www.automotivedive.com/feeds/news/
1_SCRAPER_DATE,REJECTED,Cybersec,Sonic Automotive has big plans to revitalize used-car unit,TOO_OLD: published before 72h cutoff,https://www.wardsauto.com/news/sonic-automotive-has-big-plans-to-revitalize-used-car-unit/813572/,https://www.automotivedive.com/feeds/news/
1_SCRAPER_DATE,REJECTED,Cybersec,AI doubled auto industry cyberattacks: Upstream,TOO_OLD: published before 72h cutoff,https://www.wardsauto.com/news/ai-doubles-automotive-cyber-attacks-sdvs-updtream/813455/,https://www.automotivedive.com/feeds/news/
1_SCRAPER_DATE,REJECTED,Cybersec,Manipulating AI Summarization Features,TOO_OLD: published before 72h cutoff,https://www.schneier.com/blog/archives/2026/03/manipulating-ai-summarization-features.html,https://www.schneier.com/feed/atom
1_SCRAPER_DATE,REJECTED,Cybersec,On Moltbook,TOO_OLD: published before 72h cutoff,https://www.schneier.com/blog/archives/2026/03/on-moltbook.html,https://www.schneier.com/feed/atom
1_SCRAPER_DATE,REJECTED,Cybersec,LLM-Assisted Deanonymization,TOO_OLD: published before 72h cutoff,https://www.schneier.com/blog/archives/2026/03/llm-assisted-deanonymization.html,https://www.schneier.com/feed/atom
1_SCRAPER_DATE,REJECTED,Cybersec,Friday Squid Blogging: Squid Fishing in Peru,TOO_OLD: published before 72h cutoff,https://www.schneier.com/blog/archives/2026/02/friday-squid-blogging-squid-fishing-in-peru.html,https://www.schneier.com/feed/atom
1_SCRAPER_DATE,REJECTED,Cybersec,Why Tehran’s Two-Tiered Internet Is So Dangerous,TOO_OLD: published before 72h cutoff,https://www.schneier.com/blog/archives/2026/02/why-tehrans-two-tiered-internet-is-so-dangerous.html,https://www.schneier.com/feed/atom
1_SCRAPER_DATE,REJECTED,Cybersec,Phishing Attacks Against People Seeking Programming Jobs,TOO_OLD: published before 72h cutoff,https://www.schneier.com/blog/archives/2026/02/phishing-attacks-against-people-seeking-programming-jobs.html,https://www.schneier.com/feed/atom
1_SCRAPER_DATE,REJECTED,Cybersec,LLMs Generate Predictable Passwords,TOO_OLD: published before 72h cutoff,https://www.schneier.com/blog/archives/2026/02/llms-generate-predictable-passwords.html,https://www.schneier.com/feed/atom
1_SCRAPER_DATE,REJECTED,Cybersec,Who is the Kimwolf Botmaster “Dort”?,TOO_OLD: published before 72h cutoff,https://krebsonsecurity.com/2026/02/who-is-the-kimwolf-botmaster-dort/,https://krebsonsecurity.com/feed/
1_SCRAPER_DATE,REJECTED,Cybersec,"‘Starkiller’ Phishing Service Proxies Real Login Pages, MFA",TOO_OLD: published before 72h cutoff,https://krebsonsecurity.com/2026/02/starkiller-phishing-service-proxies-real-login-pages-mfa/,https://krebsonsecurity.com/feed/
1_SCRAPER_DATE,REJECTED,Cybersec,Kimwolf Botnet Swamps Anonymity Network I2P,TOO_OLD: published before 72h cutoff,https://krebsonsecurity.com/2026/02/kimwolf-botnet-swamps-anonymity-network-i2p/,https://krebsonsecurity.com/feed/
1_SCRAPER_DATE,REJECTED,Cybersec,"Patch Tuesday, February 2026 Edition",TOO_OLD: published before 72h cutoff,https://krebsonsecurity.com/2026/02/patch-tuesday-february-2026-edition/,https://krebsonsecurity.com/feed/
1_SCRAPER_DATE,REJECTED,Cybersec,Please Don’t Feed the Scattered Lapsus ShinyHunters,TOO_OLD: published before 72h cutoff,https://krebsonsecurity.com/2026/02/please-dont-feed-the-scattered-lapsus-shiny-hunters/,https://krebsonsecurity.com/feed/
1_SCRAPER_DATE,REJECTED,Cybersec,Who Operates the Badbox 2.0 Botnet?,TOO_OLD: published before 72h cutoff,https://krebsonsecurity.com/2026/01/who-operates-the-badbox-2-0-botnet/,https://krebsonsecurity.com/feed/
1_SCRAPER_DATE,REJECTED,Cybersec,"Kimwolf Botnet Lurking in Corporate, Govt. Networks",TOO_OLD: published before 72h cutoff,https://krebsonsecurity.com/2026/01/kimwolf-botnet-lurking-in-corporate-govt-networks/,https://krebsonsecurity.com/feed/
1_SCRAPER_DATE,REJECTED,Cybersec,"Patch Tuesday, January 2026 Edition",TOO_OLD: published before 72h cutoff,https://krebsonsecurity.com/2026/01/patch-tuesday-january-2026-edition/,https://krebsonsecurity.com/feed/
1_SCRAPER_DATE,REJECTED,Cybersec,Who Benefited from the Aisuru and Kimwolf Botnets?,TOO_OLD: published before 72h cutoff,https://krebsonsecurity.com/2026/01/who-benefited-from-the-aisuru-and-kimwolf-botnets/,https://krebsonsecurity.com/feed/
1_SCRAPER_DATE,REJECTED,Cybersec,The Kimwolf Botnet is Stalking Your Local Network,TOO_OLD: published before 72h cutoff,https://krebsonsecurity.com/2026/01/the-kimwolf-botnet-is-stalking-your-local-network/,https://krebsonsecurity.com/feed/
1_SCRAPER_DATE,REJECTED,Cybersec,Stellantis exhibits at Fleet Europe Days event,TOO_OLD: published before 72h cutoff,https://www.automotiveworld.com/news-releases/stellantis-exhibits-at-fleet-europe-days-event/,https://www.automotiveworld.com/news-releases/feed
1_SCRAPER_DATE,REJECTED,Cybersec,Daimler Buses delivers 50 Citaro articulated buses to SEV,TOO_OLD: published before 72h cutoff,https://www.automotiveworld.com/news-releases/daimler-buses-delivers-50-citaro-articulated-buses-to-sev/,https://www.automotiveworld.com/news-releases/feed
1_SCRAPER_DATE,REJECTED,Cybersec,TriLite launches Trixel 3 Cube display engine,TOO_OLD: published before 72h cutoff,https://www.automotiveworld.com/news-releases/trilite-launches-trixel-3-cube-display-engine/,https://www.automotiveworld.com/news-releases/feed
1_SCRAPER_DATE,REJECTED,Cybersec,OPES Solar Mobility opens vehicle solar panel factory in Germany,TOO_OLD: published before 72h cutoff,https://www.automotiveworld.com/news-releases/opes-solar-mobility-opens-vehicle-solar-panel-factory-in-germany/,https://www.automotiveworld.com/news-releases/feed
1_SCRAPER_DATE,REJECTED,Cybersec,Volkswagen AG’s Supervisory Board appoints Oliver Blume as CEO until the end of 2030,TOO_OLD: published before 72h cutoff,https://www.automotiveworld.com/news-releases/volkswagen-ags-supervisory-board-appoints-oliver-blume-as-ceo-until-the-end-of-2030/,https://www.automotiveworld.com/news-releases/feed
1_SCRAPER_DATE,REJECTED,Cybersec,Pirelli: Cyber Tyre awarded as the most innovative tyre technology at the AutoTech Breakthrough Awards 2025,TOO_OLD: published before 72h cutoff,https://www.automotiveworld.com/news-releases/pirelli-cyber-tyre-awarded-as-the-most-innovative-tyre-technology-at-the-autotech-breakthrough-awards-2025/,https://www.automotiveworld.com/news-releases/feed
1_SCRAPER_DATE,REJECTED,Cybersec,SEAT S.A. reinforces its commitment to young talent with the opening of the new headquarters of the Apprentice School in Martorell,TOO_OLD: published before 72h cutoff,https://www.automotiveworld.com/news-releases/seat-s-a-reinforces-its-commitment-to-young-talent-with-the-opening-of-the-new-headquarters-of-the-apprentice-school-in-martorell/,https://www.automotiveworld.com/news-releases/feed
1_SCRAPER_DATE,REJECTED,Cybersec,Stellantis and Pony.ai partner to advance robotaxi development in Europe,TOO_OLD: published before 72h cutoff,https://www.automotiveworld.com/news-releases/stellantis-and-pony-ai-partner-to-advance-robotaxi-development-in-europe/,https://www.automotiveworld.com/news-releases/feed
1_SCRAPER_DATE,REJECTED,Cybersec,Volvo Group – the third quarter 2025,TOO_OLD: published before 72h cutoff,https://www.automotiveworld.com/news-releases/volvo-group-the-third-quarter-2025/,https://www.automotiveworld.com/news-releases/feed
1_SCRAPER_DATE,REJECTED,Cybersec,Niron Magnetics and Stellantis partner to pioneer rare-earth-free electric motor innovation,TOO_OLD: published before 72h cutoff,https://www.automotiveworld.com/news-releases/niron-magnetics-and-stellantis-partner-to-pioneer-rare-earth-free-electric-motor-innovation/,https://www.automotiveworld.com/news-releases/feed
1_SCRAPER_DATE,REJECTED,Cybersec,Harman recognized as “Connected Car Solution Provider of The Year” by 2025 AutoTech Breakthrough Awards,TOO_OLD: published before 72h cutoff,https://www.automotiveworld.com/news-releases/harman-recognized-as-connected-car-solution-provider-of-the-year-by-2025-autotech-breakthrough-awards/,https://www.automotiveworld.com/news-releases/feed
1_SCRAPER_DATE,REJECTED,Cybersec,DoorDash and Waymo launch autonomous delivery service and introduce limited-time Waymo promotion for DashPass members,TOO_OLD: published before 72h cutoff,https://www.automotiveworld.com/news-releases/doordash-and-waymo-launch-autonomous-delivery-service-and-introduce-limited-time-waymo-promotion-for-dashpass-members/,https://www.automotiveworld.com/news-releases/feed
1_SCRAPER_DATE,REJECTED,Cybersec,Aston Martin unveils new configurator that sets the standard for automotive digital products,TOO_OLD: published before 72h cutoff,https://www.automotiveworld.com/news-releases/aston-martin-unveils-new-configurator-that-sets-the-standard-for-automotive-digital-products/,https://www.automotiveworld.com/news-releases/feed
1_SCRAPER_DATE,REJECTED,Cybersec,Nexteer recognized with 2025 AutoTech Breakthrough Award for “Automotive Software Solution of the Year”,TOO_OLD: published before 72h cutoff,https://www.automotiveworld.com/news-releases/nexteer-recognized-with-2025-autotech-breakthrough-award-for-automotive-software-solution-of-the-year/,https://www.automotiveworld.com/news-releases/feed
1_SCRAPER_DATE,REJECTED,Cybersec,GZM Metropolis in Poland orders 42 electric Solaris buses,TOO_OLD: published before 72h cutoff,https://www.automotiveworld.com/news-releases/gzm-metropolis-in-poland-orders-42-electric-solaris-buses/,https://www.automotiveworld.com/news-releases/feed
1_SCRAPER_DATE,REJECTED,Cybersec,Volkswagen: Current Touareg generation ends with a “FINAL EDITION”,TOO_OLD: published before 72h cutoff,https://www.automotiveworld.com/news-releases/volkswagen-current-touareg-generation-ends-with-a-final-edition/,https://www.automotiveworld.com/news-releases/feed
1_SCRAPER_DATE,REJECTED,Cybersec,Kodiak’s self-driving trucks achieve top score in Nauto driver safety evaluation,TOO_OLD: published before 72h cutoff,https://www.automotiveworld.com/news-releases/kodiaks-self-driving-trucks-achieve-top-score-in-nauto-driver-safety-evaluation/,https://www.automotiveworld.com/news-releases/feed
1_SCRAPER_DATE,REJECTED,Cybersec,"DHL Express U.S. launches first Mercedes-Benz eSprinter vans in the United States, expanding electric fleet",TOO_OLD: published before 72h cutoff,https://www.automotiveworld.com/news-releases/dhl-express-u-s-launches-first-mercedes-benz-esprinter-vans-in-the-united-states-expanding-electric-fleet/,https://www.automotiveworld.com/news-releases/feed
1_SCRAPER_DATE,REJECTED,Cybersec,"TraXtion to exhibit full suite of automotive intelligence solutions, highlighting GrooveSpec, GrooveSpecX, DamageSpeX, and WheelSpec at SEMA Show 2025",TOO_OLD: published before 72h cutoff,https://www.automotiveworld.com/news-releases/traxtion-to-exhibit-full-suite-of-automotive-intelligence-solutions-highlighting-groovespec-groovespecx-damagespex-and-wheelspec-at-sema-show-2025/,https://www.automotiveworld.com/news-releases/feed
1_SCRAPER_DATE,REJECTED,Cybersec,Setra Thor – A powerful tribute to 50 years,TOO_OLD: published before 72h cutoff,https://www.automotiveworld.com/news-releases/setra-thor-a-powerful-tribute-to-50-years/,https://www.automotiveworld.com/news-releases/feed
1_SCRAPER_DATE,REJECTED,SG-News,Daily Debrief: What Happened Today (Mar 4),TOO_OLD: published before 72h cutoff,https://www.businesstimes.com.sg/singapore/daily-debrief-what-happened-today-mar-42,https://www.businesstimes.com.sg/rss/singapore
1_SCRAPER_DATE,REJECTED,SG-News,Boutique wellness player Trapeze Rec Club to close after five years; owner says ‘not sustainable’ to carry on,TOO_OLD: published before 72h cutoff,https://www.businesstimes.com.sg/singapore/smes/boutique-wellness-player-trapeze-rec-club-close-after-five-years-owner-says-not-sustainable-carry,https://www.businesstimes.com.sg/rss/singapore
1_SCRAPER_DATE,REJECTED,SG-News,Singapore announces maritime sector master plan to chart industry’s long-term progress,TOO_OLD: published before 72h cutoff,https://www.businesstimes.com.sg/singapore/singapore-announces-maritime-sector-master-plan-chart-industrys-long-term-progress,https://www.businesstimes.com.sg/rss/singapore
1_SCRAPER_DATE,REJECTED,SG-News,Singapore to review COE categories for cars: Jeffrey Siow,TOO_OLD: published before 72h cutoff,https://www.businesstimes.com.sg/singapore/singapore-review-coe-categories-cars-jeffrey-siow,https://www.businesstimes.com.sg/rss/singapore
1_SCRAPER_DATE,REJECTED,SG-News,Every HDB town to get EV fast-charging hub by end-2027; autonomous shuttles open to public from April,TOO_OLD: published before 72h cutoff,https://www.businesstimes.com.sg/singapore/every-hdb-town-get-ev-fast-charging-hub-end-2027-autonomous-shuttles-open-public-april,https://www.businesstimes.com.sg/rss/singapore
1_SCRAPER_DATE,REJECTED,SG-News,Jurong Region Line’s first stage completion delayed by six months to mid-2028,TOO_OLD: published before 72h cutoff,https://www.businesstimes.com.sg/singapore/jurong-region-lines-first-stage-completion-delayed-six-months-mid-2028,https://www.businesstimes.com.sg/rss/singapore
1_SCRAPER_DATE,REJECTED,SG-News,"Emirates, Etihad Airways flights from UAE to Singapore available from Mar 4 amid Middle East conflict",TOO_OLD: published before 72h cutoff,https://www.businesstimes.com.sg/singapore/emirates-etihad-airways-flights-uae-singapore-available-mar-4-amid-middle-east-conflict,https://www.businesstimes.com.sg/rss/singapore
1_SCRAPER_DATE,REJECTED,SG-News,"Premiums for all COE categories rise; big cars lead with S$9,000 jump, beating mainstream cars",TOO_OLD: published before 72h cutoff,https://www.businesstimes.com.sg/singapore/premiums-all-coe-categories-rise-big-cars-lead-s9000-jump-beating-mainstream-cars,https://www.businesstimes.com.sg/rss/singapore
1_SCRAPER_DATE,REJECTED,SG-News,Budget 2026: How should Singapore decide which jobs are to be filled by foreign workers?,TOO_OLD: published before 72h cutoff,https://www.businesstimes.com.sg/opinion-features/budget-2026-how-should-singapore-decide-which-jobs-are-be-filled-foreign-workers,https://www.businesstimes.com.sg/rss/singapore
1_SCRAPER_DATE,REJECTED,SG-News,Singapore energy regulator cautions Gulf conflict could hike electricity prices; market players on alert,TOO_OLD: published before 72h cutoff,https://www.businesstimes.com.sg/singapore/singapore-energy-regulator-cautions-gulf-conflict-could-hike-electricity-prices-market-players-alert,https://www.businesstimes.com.sg/rss/singapore
1_SCRAPER_DATE,REJECTED,SG-News,70 years of curry puffs and counting: Old Chang Kee banks on secret recipe to stay ahead of competitors,TOO_OLD: published before 72h cutoff,https://www.businesstimes.com.sg/singapore/smes/70-years-curry-puffs-and-counting-old-chang-kee-banks-secret-recipe-stay-ahead-competitors,https://www.businesstimes.com.sg/rss/singapore
1_SCRAPER_DATE,REJECTED,SG-News,Parf rebate reduction not expected to change COE renewal behaviour: MOT,TOO_OLD: published before 72h cutoff,https://www.businesstimes.com.sg/singapore/parf-rebate-reduction-not-expected-change-coe-renewal-behaviour-mot,https://www.businesstimes.com.sg/rss/singapore
2_SCRAPER_JUNK,REJECTED,Auto-RSS,"What recent global industry events reveal about trust, autonomy & the reality of software-defined vehicles",JUNK: body too short after fetch,https://www.trustonic.com/opinion/what-recent-global-industry-events-reveal-about-trust-autonomy-the-reality-of-software-defined-vehicles/,https://www.trustonic.com/feed/
2_SCRAPER_JUNK,REJECTED,Auto-RSS,Register now for our March 2026 webinar: Operationalising the CRA and PSTI via embedded microservices’ and ‘Standards vs. security: A proactive compliance framework’,JUNK: URL matches junk pattern (login/tag/category etc),https://us06web.zoom.us/webinar/register/WN_yk2By_aoQbKk0iI0ENitxg#new_tab,https://www.iotsecurityfoundation.org/feed/
2_SCRAPER_JUNK,REJECTED,Auto-RSS,Ian Pearson (Microchip) to present ‘Leveraging Microchip Secure FPGAs’,JUNK: URL matches junk pattern (login/tag/category etc),https://desn.org.uk/event/fpga-frontrunner-2026/#new_tab,https://www.iotsecurityfoundation.org/feed/
2_SCRAPER_JUNK,REJECTED,Auto-RSS,"Now available to all: ‘How not to secure your embedded system, lessons from recent automotive testing’ with ZF’s Martin Thompson at the 2025 IoTSF conference",JUNK: URL matches junk pattern (login/tag/category etc),https://youtu.be/5eJXzBB4QT8?si=JEq8rfF7TgIlF3i7#new_tab,https://www.iotsecurityfoundation.org/feed/
2_SCRAPER_JUNK,REJECTED,Auto-RSS,Watch: A quantum safe MQTT pipeline demo,JUNK: URL matches junk pattern (login/tag/category etc),https://youtu.be/TRB4ltMKv2k?si=65K7xkNrU96P_M4y#new_tab,https://www.iotsecurityfoundation.org/feed/
2_SCRAPER_JUNK,REJECTED,Auto-RSS,Watch: The full 60-minute recording of our ‘Quantum Safety in IoT’ webinar,JUNK: URL matches junk pattern (login/tag/category etc),https://youtu.be/p19EkvMYFqM?si=JKwX6QprFS-rvDxO#new_tab,https://www.iotsecurityfoundation.org/feed/
2_SCRAPER_JUNK,REJECTED,Auto-RSS,Now available to all: ‘Critical infrastructure and IoT: How to harden what you can’t replace’ with Keysight’s Scott Register at the 2025 IoTSF conference,JUNK: URL matches junk pattern (login/tag/category etc),https://youtu.be/ZsFDwe0eXYg?si=3LXA31W0WepLWhVb#new_tab,https://www.iotsecurityfoundation.org/feed/
2_SCRAPER_JUNK,REJECTED,Auto-RSS,A fireside chat about the latest ‘State of Vulnerability Disclosure in Global Consumer IoT’ report,JUNK: body too short after fetch,https://iotsecurityfoundation.org/a-fireside-chat-about-the-latest-state-of-vulnerability-disclosure-in-global-consumer-iot-report/,https://www.iotsecurityfoundation.org/feed/
2_SCRAPER_JUNK,REJECTED,Auto-RSS,TechWorks-AI webinar with Bill Bauman (co-founder and CEO of Ntur AI),JUNK: URL matches junk pattern (login/tag/category etc),https://us06web.zoom.us/webinar/register/WN_cwGztU5uQPCmMYJ70N4e-A#new_tab,https://www.iotsecurityfoundation.org/feed/
2_SCRAPER_JUNK,REJECTED,Auto-RSS,AESIN workshop on in-cabin sensing: Accelerating NCAP compliance through simulation,JUNK: URL matches junk pattern (login/tag/category etc),https://aesin.org.uk/event/in-cabin-sensing-accelerating-ncap-compliance-through-simulation/#new_tab,https://www.iotsecurityfoundation.org/feed/
2_SCRAPER_JUNK,REJECTED,Cybersec,Bitwarden adds support for passkey login on Windows 11,JUNK: body too short after fetch,https://www.bleepingcomputer.com/news/security/bitwarden-adds-support-for-passkey-login-on-windows-11/,https://www.bleepingcomputer.com/feed/
2_SCRAPER_JUNK,REJECTED,Cybersec,Inside a fake Google security check that becomes a browser RAT,JUNK: URL matches junk pattern (login/tag/category etc),https://www.malwarebytes.com/blog/privacy/2026/02/inside-a-fake-google-security-check-that-becomes-a-browser-rat,https://www.malwarebytes.com/blog/feed
2_SCRAPER_JUNK,REJECTED,Cybersec,The multibillion-dollar AI security problem enterprises can’t ignore,JUNK: URL matches junk pattern (login/tag/category etc),https://techcrunch.com/podcast/the-multi-billion-ai-security-problem-enterprises-cant-ignore/,https://techcrunch.com/tag/security/feed/
2_SCRAPER_JUNK,REJECTED,Cybersec,"VMware Aria Operations Bug Exploited, Cloud Resources at Risk",JUNK: body too short after fetch,https://www.darkreading.com/cloud-security/vmware-aria-operations-bug-exploited-cloud-risk,https://www.darkreading.com/rss.xml
2_SCRAPER_JUNK,REJECTED,Cybersec,Optimize Your Sophos Firewall Security,JUNK: body too short after fetch,https://www.sophos.com/en-us/blog/optimize-your-sophos-firewall-security,https://news.sophos.com/en-us/feed
2_SCRAPER_JUNK,REJECTED,Cybersec,New Android Mirax Bot Advertised on Cybercriminal Forums Claiming Advanced Capabilities,JUNK: body too short after fetch,https://cybersecuritynews.com/new-android-mirax-bot-advertised-on-cybercriminal-forums/,https://cybersecuritynews.com/feed/
2_SCRAPER_JUNK,REJECTED,Cybersec,Phishing Emails Push Fake ChatGPT and Gemini iOS Apps To Steal Logins,JUNK: body too short after fetch,https://cybersecuritynews.com/phishing-emails-push-fake-chatgpt/,https://cybersecuritynews.com/feed/
2_SCRAPER_JUNK,REJECTED,SG-News,Over 40 S’porean students in Middle East opt not to come home despite escalating conflict,JUNK: body too short after fetch,https://www.straitstimes.com/singapore/over-40-sporean-students-in-mid-east-opt-not-to-come-home-despite-bomb-sirens-falling-debris,https://www.straitstimes.com/news/singapore/rss.xml
2_SCRAPER_JUNK,REJECTED,SG-News,Daily Debrief: What Happened Today (Mar 6),JUNK: body too short after fetch,https://www.businesstimes.com.sg/singapore/daily-debrief-what-happened-today-mar-62,https://www.businesstimes.com.sg/rss/singapore
2_SCRAPER_JUNK,REJECTED,SG-News,Daily Debrief: What Happened Today (Mar 5),JUNK: body too short after fetch,https://www.businesstimes.com.sg/singapore/daily-debrief-what-happened-today-mar-52,https://www.businesstimes.com.sg/rss/singapore
3_KEYWORD_FILTER,REJECTED,Cybersec,Ghanain man pleads guilty to role in $100 million fraud ring,KEYWORD_FILTER: no automotive+cybersec keyword overlap,https://www.bleepingcomputer.com/news/security/ghanain-man-pleads-guilty-to-role-in-100-million-fraud-ring/,https://www.bleepingcomputer.com/feed/
3_KEYWORD_FILTER,REJECTED,Cybersec,FBI investigates breach of surveillance and wiretap systems,KEYWORD_FILTER: no automotive+cybersec keyword overlap,https://www.bleepingcomputer.com/news/security/fbi-investigates-breach-of-surveillance-and-wiretap-systems/,https://www.bleepingcomputer.com/feed/
3_KEYWORD_FILTER,REJECTED,Cybersec,Chinese state hackers target telcos with new malware toolkit,KEYWORD_FILTER: no automotive+cybersec keyword overlap,https://www.bleepingcomputer.com/news/security/chinese-state-hackers-target-telcos-with-new-malware-toolkit/,https://www.bleepingcomputer.com/feed/
3_KEYWORD_FILTER,REJECTED,Cybersec,Bing AI promoted fake OpenClaw GitHub repo pushing info-stealing malware,KEYWORD_FILTER: no automotive+cybersec keyword overlap,https://www.bleepingcomputer.com/news/security/bing-ai-promoted-fake-openclaw-github-repo-pushing-info-stealing-malware/,https://www.bleepingcomputer.com/feed/
3_KEYWORD_FILTER,REJECTED,Cybersec,Wikipedia hit by self-propagating JavaScript worm that vandalized pages,KEYWORD_FILTER: no automotive+cybersec keyword overlap,https://www.bleepingcomputer.com/news/security/wikipedia-hit-by-self-propagating-javascript-worm-that-vandalized-pages/,https://www.bleepingcomputer.com/feed/
3_KEYWORD_FILTER,REJECTED,Cybersec,WordPress membership plugin bug exploited to create admin accounts,KEYWORD_FILTER: no automotive+cybersec keyword overlap,https://www.bleepingcomputer.com/news/security/wordpress-membership-plugin-bug-exploited-to-create-admin-accounts/,https://www.bleepingcomputer.com/feed/
3_KEYWORD_FILTER,REJECTED,Cybersec,FBI arrests suspect linked to $46M crypto theft from US Marshals,KEYWORD_FILTER: no automotive+cybersec keyword overlap,https://www.bleepingcomputer.com/news/security/fbi-arrests-suspect-linked-to-46m-crypto-theft-from-us-marshals/,https://www.bleepingcomputer.com/feed/
3_KEYWORD_FILTER,REJECTED,Cybersec,Google says 90 zero-days were exploited in attacks last year,KEYWORD_FILTER: no automotive+cybersec keyword overlap,https://www.bleepingcomputer.com/news/security/google-says-90-zero-days-were-exploited-in-attacks-last-year/,https://www.bleepingcomputer.com/feed/
3_KEYWORD_FILTER,REJECTED,Cybersec,2026 Browser Data Reveals Major Enterprise Security Blind Spots,KEYWORD_FILTER: no automotive+cybersec keyword overlap,https://www.bleepingcomputer.com/news/security/2026-browser-data-reveals-major-enterprise-security-blind-spots/,https://www.bleepingcomputer.com/feed/
3_KEYWORD_FILTER,REJECTED,Cybersec,Police dismantles online gambling ring exploiting Ukrainian women,KEYWORD_FILTER: no automotive+cybersec keyword overlap,https://www.bleepingcomputer.com/news/security/police-dismantles-online-gambling-ring-exploiting-ukrainian-women/,https://www.bleepingcomputer.com/feed/
3_KEYWORD_FILTER,REJECTED,Cybersec,Cisco flags more SD-WAN flaws as actively exploited in attacks,KEYWORD_FILTER: no automotive+cybersec keyword overlap,https://www.bleepingcomputer.com/news/security/cisco-flags-more-sd-wan-flaws-as-actively-exploited-in-attacks/,https://www.bleepingcomputer.com/feed/
3_KEYWORD_FILTER,REJECTED,Cybersec,Phobos ransomware admin pleads guilty to wire fraud conspiracy,KEYWORD_FILTER: no automotive+cybersec keyword overlap,https://www.bleepingcomputer.com/news/security/phobos-ransomware-admin-pleads-guilty-to-wire-fraud-conspiracy/,https://www.bleepingcomputer.com/feed/
3_KEYWORD_FILTER,REJECTED,Cybersec,Mail2Shell zero-click attack lets hackers hijack FreeScout mail servers,KEYWORD_FILTER: no automotive+cybersec keyword overlap,https://www.bleepingcomputer.com/news/security/mail2shell-zero-click-attack-lets-hackers-hijack-freescout-mail-servers/,https://www.bleepingcomputer.com/feed/
