stage,status,source,title,reason,url,feed_url,published_sgt
3_KEYWORD_FILTER,REJECTED,Cybersec,AI-Assisted Supply Chain Attack Targets GitHub,KEYWORD_FILTER: no automotive+cybersec keyword overlap,https://www.darkreading.com/application-security/ai-assisted-supply-chain-attack-targets-github,https://www.darkreading.com/rss.xml,
3_KEYWORD_FILTER,REJECTED,Cybersec,Axios Attack Shows Social Complex Engineering Is Industrialized,KEYWORD_FILTER: no automotive+cybersec keyword overlap,https://www.darkreading.com/threat-intelligence/axios-attack-complex-social-engineering-industrialized,https://www.darkreading.com/rss.xml,
3_KEYWORD_FILTER,REJECTED,Cybersec,Fortinet Issues Emergency Patch for FortiClient Zero-Day,KEYWORD_FILTER: no automotive+cybersec keyword overlap,https://www.darkreading.com/vulnerabilities-threats/fortinet-emergency-patch-forticlient-zero-day,https://www.darkreading.com/rss.xml,
3_KEYWORD_FILTER,REJECTED,Cybersec,Automated Credential Harvesting Campaign Exploits React2Shell Flaw,KEYWORD_FILTER: no automotive+cybersec keyword overlap,https://www.darkreading.com/cyberattacks-data-breaches/automated-credential-harvesting-campaign-react2shell,https://www.darkreading.com/rss.xml,
3_KEYWORD_FILTER,REJECTED,Cybersec,Shadow AI in Healthcare Is Here to Stay,KEYWORD_FILTER: no automotive+cybersec keyword overlap,https://www.darkreading.com/cyber-risk/shadow-ai-in-healthcare-is-here-to-stay,https://www.darkreading.com/rss.xml,
3_KEYWORD_FILTER,REJECTED,Cybersec,"OWASP GenAI Security Project Gets Update, New Tools Matrix",KEYWORD_FILTER: no automotive+cybersec keyword overlap,https://www.darkreading.com/application-security/owasp-genai-security-project-update-matrix,https://www.darkreading.com/rss.xml,
3_KEYWORD_FILTER,REJECTED,Cybersec,Border Patrol Agents Sold Challenge Coins With ‘Charlotte’s Web’ Characters in Riot Gear,KEYWORD_FILTER: no automotive+cybersec keyword overlap,https://www.wired.com/story/us-border-patrol-challenge-coins-nonprofits/,https://www.wired.com/feed/category/security/latest/rss,
3_KEYWORD_FILTER,REJECTED,Cybersec,The Hack That Exposed Syria’s Sweeping Security Failures,KEYWORD_FILTER: no automotive+cybersec keyword overlap,https://www.wired.com/story/inside-the-hack-that-exposed-syrias-security-failures/,https://www.wired.com/feed/category/security/latest/rss,
3_KEYWORD_FILTER,REJECTED,Cybersec,Hackers Are Posting the Claude Code Leak With Bonus Malware,KEYWORD_FILTER: no automotive+cybersec keyword overlap,https://www.wired.com/story/security-news-this-week-hackers-are-posting-the-claude-code-leak-with-bonus-malware/,https://www.wired.com/feed/category/security/latest/rss,
3_KEYWORD_FILTER,REJECTED,Cybersec,Hims & Hers says limited data stolen in social engineering attack,KEYWORD_FILTER: no automotive+cybersec keyword overlap,https://www.cybersecuritydive.com/news/hims-hers-data-stolen-social-engineering/816707/,https://www.cybersecuritydive.com/feeds/news/,
3_KEYWORD_FILTER,REJECTED,Cybersec,Critical flaw in FortiClient EMS under exploitation,KEYWORD_FILTER: no automotive+cybersec keyword overlap,https://www.cybersecuritydive.com/news/critical-flaw-forticlient-ems-exploitation/816699/,https://www.cybersecuritydive.com/feeds/news/,
3_KEYWORD_FILTER,REJECTED,Cybersec,"75% of Cyberattacks Start with Phishing Emails, UAE Cyber Council Says",KEYWORD_FILTER: no automotive+cybersec keyword overlap,https://thecyberexpress.com/uae-phishing-emails-cyberattacks/,https://thecyberexpress.com/feed,
3_KEYWORD_FILTER,REJECTED,Cybersec,North Korea Spent 6 Months Infiltrating Drift Protocol Only to Drain $285M in 12 Mins,KEYWORD_FILTER: no automotive+cybersec keyword overlap,https://thecyberexpress.com/drift-protocol-draining-285m-in-12-mins/,https://thecyberexpress.com/feed,
3_KEYWORD_FILTER,REJECTED,Cybersec,"Cyberattack Disrupts Massachusetts Emergency Dispatch, 911 Services Remain Active",KEYWORD_FILTER: no automotive+cybersec keyword overlap,https://thecyberexpress.com/massachusetts-emergency-cyberattack/,https://thecyberexpress.com/feed,
3_KEYWORD_FILTER,REJECTED,Cybersec,A Compromised Tool Opened the Door to a 91GB European Commission Data Leak,KEYWORD_FILTER: no automotive+cybersec keyword overlap,https://thecyberexpress.com/european-commission-cloud-breach/,https://thecyberexpress.com/feed,
3_KEYWORD_FILTER,REJECTED,Cybersec,Education Authority Cyberattack Disrupts Schools Across Northern Ireland,KEYWORD_FILTER: no automotive+cybersec keyword overlap,https://thecyberexpress.com/education-authority-cyberattack-ni-schools/,https://thecyberexpress.com/feed,
3_KEYWORD_FILTER,REJECTED,Cybersec,FCC Moves to Fine Voxbeam $4.5M in Robocall Case Linked to Foreign Traffic,KEYWORD_FILTER: no automotive+cybersec keyword overlap,https://thecyberexpress.com/voxbeam-robocall-case-fcc-fines-firm/,https://thecyberexpress.com/feed,
3_KEYWORD_FILTER,REJECTED,Cybersec,UK Businesses Are Being Targeted Through Their Middle East Supply Chains — What to Do Now,KEYWORD_FILTER: no automotive+cybersec keyword overlap,https://cyble.com/blog/middle-east-supply-chain-risk-uk-cyber-threats/,https://cyble.com/feed,
3_KEYWORD_FILTER,REJECTED,Cybersec,Cloudflare Targets WordPress With New AI-Powered EmDash CMS,KEYWORD_FILTER: no automotive+cybersec keyword overlap,https://hackread.com/cloudflare-wordpress-ai-powered-emdash-cms/,https://hackread.com/feed,
3_KEYWORD_FILTER,REJECTED,Cybersec,Why Security Researchers and Red Teams Are Turning to Workflow Automation,KEYWORD_FILTER: no automotive+cybersec keyword overlap,https://hackread.com/security-researchers-red-teams-workflow-automation/,https://hackread.com/feed,
3_KEYWORD_FILTER,REJECTED,Cybersec,North Korean Hackers Pose as Trading Firm to Steal $285M from Drift,KEYWORD_FILTER: no automotive+cybersec keyword overlap,https://hackread.com/north-korean-hackers-trading-firm-drift-protocol/,https://hackread.com/feed,
3_KEYWORD_FILTER,REJECTED,Cybersec,"BrowserGate: LinkedIn Tracks 6,000+ Browser Extensions on Users’ PCs",KEYWORD_FILTER: no automotive+cybersec keyword overlap,https://hackread.com/browsergate-linkedin-track-browser-extensions-user-pc/,https://hackread.com/feed,
3_KEYWORD_FILTER,REJECTED,Cybersec,"UNC1069 Targets Node.js Maintainers via Fake LinkedIn, Slack Profiles",KEYWORD_FILTER: no automotive+cybersec keyword overlap,https://hackread.com/unc1069-node-js-maintainer-fake-linkedin-slack-profile/,https://hackread.com/feed,
3_KEYWORD_FILTER,REJECTED,Cybersec,New Mexico’s Meta Ruling and Encryption,KEYWORD_FILTER: no automotive+cybersec keyword overlap,https://www.schneier.com/blog/archives/2026/04/new-mexicos-meta-ruling-and-encryption.html,https://www.schneier.com/feed/atom,
3_KEYWORD_FILTER,REJECTED,Cybersec,Google Wants to Transition to Post-Quantum Cryptography by 2029,KEYWORD_FILTER: no automotive+cybersec keyword overlap,https://www.schneier.com/blog/archives/2026/04/google-wants-to-transition-to-post-quantum-cryptography-by-2029.html,https://www.schneier.com/feed/atom,
3_KEYWORD_FILTER,REJECTED,Cybersec,"Germany Doxes “UNKN,” Head of RU Ransomware Gangs REvil, GandCrab",KEYWORD_FILTER: no automotive+cybersec keyword overlap,https://krebsonsecurity.com/2026/04/germany-doxes-unkn-head-of-ru-ransomware-gangs-revil-gandcrab/,https://krebsonsecurity.com/feed/,
3_KEYWORD_FILTER,REJECTED,Cybersec,"How often are redirects used in phishing in 2026&#x3f;, (Mon, Apr 6th)",KEYWORD_FILTER: no automotive+cybersec keyword overlap,https://isc.sans.edu/diary/rss/32870,https://isc.sans.edu/rssfeed_full.xml,
3_KEYWORD_FILTER,REJECTED,Cybersec,"ISC Stormcast For Monday, April 6th, 2026 https://isc.sans.edu/podcastdetail/9880, (Mon, Apr 6th)",KEYWORD_FILTER: no automotive+cybersec keyword overlap,https://isc.sans.edu/diary/rss/32868,https://isc.sans.edu/rssfeed_full.xml,
3_KEYWORD_FILTER,REJECTED,Cybersec,CISA Warns of Fortinet 0-Day Vulnerability Actively Exploited in Attacks,KEYWORD_FILTER: no automotive+cybersec keyword overlap,https://cybersecuritynews.com/cisa-warns-fortinet-vulnerability/,https://cybersecuritynews.com/feed/,
3_KEYWORD_FILTER,REJECTED,Cybersec,Trojanized PyPI AI Proxy Uses Stolen Claude Prompt to Exfiltrates Data,KEYWORD_FILTER: no automotive+cybersec keyword overlap,https://cybersecuritynews.com/trojanized-pypi-ai-proxy-uses-stolen-claude-prompt/,https://cybersecuritynews.com/feed/,
3_KEYWORD_FILTER,REJECTED,Cybersec,Hackers Drain $286 Million From Drift Protocol in Suspected North Korea-Linked Exploit,KEYWORD_FILTER: no automotive+cybersec keyword overlap,https://cybersecuritynews.com/hackers-drain-286-million-from-drift-protocol/,https://cybersecuritynews.com/feed/,
3_KEYWORD_FILTER,REJECTED,Cybersec,New GitHub Actions Attack Chain Uses Fake CI Updates to Exfiltrate Secrets and Tokens,KEYWORD_FILTER: no automotive+cybersec keyword overlap,https://cybersecuritynews.com/new-github-actions-attack-chain-uses-fake-ci-updates/,https://cybersecuritynews.com/feed/,
3_KEYWORD_FILTER,REJECTED,Cybersec,DPRK Cyber Program Uses Modular Malware Strategy to Evade Attribution and Survive Takedowns,KEYWORD_FILTER: no automotive+cybersec keyword overlap,https://cybersecuritynews.com/dprk-cyber-program-uses-modular-malware-strategy/,https://cybersecuritynews.com/feed/,
3_KEYWORD_FILTER,REJECTED,Cybersec,North Korean IT Worker Unmasked After Refusing to Insult Kim Jong Un in Job Interview,KEYWORD_FILTER: no automotive+cybersec keyword overlap,https://cybersecuritynews.com/north-korean-it-worker-unmasked/,https://cybersecuritynews.com/feed/,
3_KEYWORD_FILTER,REJECTED,Cybersec,Google’s Bug Bounty Program Hits All-Time High With $17 Million in 2025 Payouts,KEYWORD_FILTER: no automotive+cybersec keyword overlap,https://cybersecuritynews.com/googles-bug-bounty-program-high-reward/,https://cybersecuritynews.com/feed/,
3_KEYWORD_FILTER,REJECTED,Cybersec,Apache Traffic Server Vulnerabilities Let Attackers Trigger DoS Attack,KEYWORD_FILTER: no automotive+cybersec keyword overlap,https://cybersecuritynews.com/apache-traffic-server-dos-vulnerabilities/,https://cybersecuritynews.com/feed/,
3_KEYWORD_FILTER,REJECTED,Cybersec,Critical Dgraph Database Vulnerability Let Attackers Bypass Authentication,KEYWORD_FILTER: no automotive+cybersec keyword overlap,https://cybersecuritynews.com/dgraph-database-vulnerability/,https://cybersecuritynews.com/feed/,
3_KEYWORD_FILTER,REJECTED,Cybersec,Hackers Compromised ILSpy WordPress Domain to Deliver Malware,KEYWORD_FILTER: no automotive+cybersec keyword overlap,https://cybersecuritynews.com/ilspy-wordpress-domain-malware/,https://cybersecuritynews.com/feed/,
3_KEYWORD_FILTER,REJECTED,Cybersec,"Trojanized PyPI AI Proxy Steals Claude Prompt, Exfiltrates Data",KEYWORD_FILTER: no automotive+cybersec keyword overlap,https://gbhackers.com/trojanized-pypi-ai/,https://gbhackers.com/feed/,
3_KEYWORD_FILTER,REJECTED,Cybersec,Google Brings Lazy Loading to Media Files in New Chrome Release,KEYWORD_FILTER: no automotive+cybersec keyword overlap,https://gbhackers.com/google-brings-lazy-loading-to-media-files/,https://gbhackers.com/feed/,
3_KEYWORD_FILTER,REJECTED,Cybersec,Drift Protocol Hit in $286M Suspected North Korea-Linked Crypto Heist,KEYWORD_FILTER: no automotive+cybersec keyword overlap,https://gbhackers.com/north-korea-linked-crypto-heist/,https://gbhackers.com/feed/,
3_KEYWORD_FILTER,REJECTED,Cybersec,GitHub-Backed Malware Spread via LNK Files in South Korea,KEYWORD_FILTER: no automotive+cybersec keyword overlap,https://gbhackers.com/github-backed-malware/,https://gbhackers.com/feed/,
3_KEYWORD_FILTER,REJECTED,Cybersec,Fake GitHub CI Update Steals Secrets and Tokens,KEYWORD_FILTER: no automotive+cybersec keyword overlap,https://gbhackers.com/fake-github-ci/,https://gbhackers.com/feed/,
3_KEYWORD_FILTER,REJECTED,Cybersec,"North Korea’s Modular Malware Strategy Hides Attribution, Defies Takedowns",KEYWORD_FILTER: no automotive+cybersec keyword overlap,https://gbhackers.com/north-koreas-modular-malware/,https://gbhackers.com/feed/,
3_KEYWORD_FILTER,REJECTED,Cybersec,Critical Claude Code Flaw Silently Bypasses User-Configured Security Rules,KEYWORD_FILTER: no automotive+cybersec keyword overlap,https://gbhackers.com/critical-claude-code-flaw/,https://gbhackers.com/feed/,
3_KEYWORD_FILTER,REJECTED,Cybersec,Alleged REvil Leader ‘UNKN’ Identified by German Authorities in New Takedown Effort,KEYWORD_FILTER: no automotive+cybersec keyword overlap,https://gbhackers.com/alleged-revil-leader-unkn-identified-by-german-authorities/,https://gbhackers.com/feed/,
3_KEYWORD_FILTER,REJECTED,Cybersec,Google’s Bug Bounty Program Hits Record $17 Million in 2025 Payouts,KEYWORD_FILTER: no automotive+cybersec keyword overlap,https://gbhackers.com/googles-bug-bounty-program-hits-record-17-million/,https://gbhackers.com/feed/,
3_KEYWORD_FILTER,REJECTED,Cybersec,Apache Traffic Server Flaw Allowed Attackers to Trigger Denial-of-Service Attacks,KEYWORD_FILTER: no automotive+cybersec keyword overlap,https://gbhackers.com/apache-traffic-server-flaw-2/,https://gbhackers.com/feed/,
3_KEYWORD_FILTER,REJECTED,SG-News,Sumiko at 62: Four simple exercises from a physiotherapist for stronger knees,KEYWORD_FILTER: no automotive+cybersec keyword overlap,https://www.straitstimes.com/singapore/sumiko-at-62-four-simple-exercises-from-a-physiotherapist-for-stronger-knees,https://www.straitstimes.com/news/singapore/rss.xml,
3_KEYWORD_FILTER,REJECTED,SG-News,"Singapore taps digital payments everywhere, but cash still lingers",KEYWORD_FILTER: no automotive+cybersec keyword overlap,https://www.straitstimes.com/singapore/singapore-taps-digital-payments-everywhere-but-cash-still-lingers,https://www.straitstimes.com/news/singapore/rss.xml,
3_KEYWORD_FILTER,REJECTED,SG-News,Fire breaks out at Buona Vista building which houses Mindef’s digital tech agency,KEYWORD_FILTER: no automotive+cybersec keyword overlap,https://www.straitstimes.com/singapore/fire-breaks-out-at-buona-vista-building-which-houses-mindefs-digital-tech-agency,https://www.straitstimes.com/news/singapore/rss.xml,
3_KEYWORD_FILTER,REJECTED,SG-News,False ceiling in Lucky Plaza collapses; BCA says likely due to improper installation,KEYWORD_FILTER: no automotive+cybersec keyword overlap,https://www.straitstimes.com/singapore/false-ceiling-in-lucky-plaza-collapses-bca-says-likely-due-to-improper-installation,https://www.straitstimes.com/news/singapore/rss.xml,
3_KEYWORD_FILTER,REJECTED,SG-News,"Shophouse sales in Kampong Gelam have ‘declined sharply’ in recent years, most buyers local: URA",KEYWORD_FILTER: no automotive+cybersec keyword overlap,https://www.straitstimes.com/singapore/shophouse-sales-in-kampong-gelam-have-declined-sharply-in-recent-years-most-buyers-local-ura,https://www.straitstimes.com/news/singapore/rss.xml,
3_KEYWORD_FILTER,REJECTED,SG-News,"Singapore Red Cross plans to mobilise about 700 volunteers to aid the elderly amid heat, haze",KEYWORD_FILTER: no automotive+cybersec keyword overlap,https://www.straitstimes.com/singapore/src-plans-to-mobilise-about-700-volunteers-to-help-protect-the-elderly-amid-heat-haze,https://www.straitstimes.com/news/singapore/rss.xml,
3_KEYWORD_FILTER,REJECTED,SG-News,"NTU, Aumovio working on affordable AI systems to boost driver safety, data privacy",KEYWORD_FILTER: no automotive+cybersec keyword overlap,https://www.straitstimes.com/tech/ntu-aumovio-working-on-affordable-ai-systems-to-boost-driver-safety,https://www.straitstimes.com/news/singapore/rss.xml,
3_KEYWORD_FILTER,REJECTED,SG-News,"Energy efficiency, renewables can reduce vulnerability of oil, gas dependence: Ravi Menon",KEYWORD_FILTER: no automotive+cybersec keyword overlap,https://www.straitstimes.com/singapore/environment/energy-efficiency-renewables-can-reduce-vulnerability-of-oil-gas-dependence-ravi-menon,https://www.straitstimes.com/news/singapore/rss.xml,
3_KEYWORD_FILTER,REJECTED,SG-News,Man to be charged after allegedly slapping 4-year-old boy outside Woodlands pre-school,KEYWORD_FILTER: no automotive+cybersec keyword overlap,https://www.straitstimes.com/singapore/man-to-be-charged-after-allegedly-slapping-4-year-old-boy-outside-woodlands-pre-school,https://www.straitstimes.com/news/singapore/rss.xml,
3_KEYWORD_FILTER,REJECTED,SG-News,Church pastor repeatedly molested girl with severe specific language impairment,KEYWORD_FILTER: no automotive+cybersec keyword overlap,https://www.straitstimes.com/singapore/courts-crime/church-pastor-repeatedly-molested-girl-with-severe-specific-language-impairment,https://www.straitstimes.com/news/singapore/rss.xml,
3_KEYWORD_FILTER,REJECTED,SG-News,"Jail for driver who stepped on accelerator by mistake, hitting pedestrians at Nex taxi stand",KEYWORD_FILTER: no automotive+cybersec keyword overlap,https://www.straitstimes.com/singapore/courts-crime/jail-for-driver-who-stepped-on-accelerator-by-mistake-hit-pedestrians-at-nex-taxi-stand,https://www.straitstimes.com/news/singapore/rss.xml,
3_KEYWORD_FILTER,REJECTED,SG-News,2 weeks’ jail for ex-national canoeist who pocketed over $4k in purported fees for training camps,KEYWORD_FILTER: no automotive+cybersec keyword overlap,https://www.straitstimes.com/singapore/courts-crime/2-weeks-jail-for-former-national-canoeing-athlete-who-pocketed-over-4k-meant-for-training-camps,https://www.straitstimes.com/news/singapore/rss.xml,
3_KEYWORD_FILTER,REJECTED,SG-News,"Man nabbed after trying to smuggle over 2,000 heat sticks, 130 vapes into Singapore",KEYWORD_FILTER: no automotive+cybersec keyword overlap,https://www.straitstimes.com/singapore/s-korean-man-nabbed-after-trying-to-smuggle-over-130-vapes-heat-sticks-into-spore,https://www.straitstimes.com/news/singapore/rss.xml,
3_KEYWORD_FILTER,REJECTED,SG-News,Youth who used criminal force on public servant gets 6 weeks’ jail,KEYWORD_FILTER: no automotive+cybersec keyword overlap,https://www.straitstimes.com/singapore/courts-crime/foreigner-who-used-criminal-force-on-public-servant-gets-6-weeks-jail,https://www.straitstimes.com/news/singapore/rss.xml,
3_KEYWORD_FILTER,REJECTED,SG-News,"Workplace fairness law, support for families feature in Singapore’s report to UN",KEYWORD_FILTER: no automotive+cybersec keyword overlap,https://www.straitstimes.com/singapore/workplace-fairness-law-support-for-families-feature-in-spores-report-to-un,https://www.straitstimes.com/news/singapore/rss.xml,
3_KEYWORD_FILTER,REJECTED,SG-News,Jail for man caught naked in car with lover after he drove off with her husband on bonnet,KEYWORD_FILTER: no automotive+cybersec keyword overlap,https://www.straitstimes.com/singapore/courts-crime/jail-for-man-caught-naked-in-car-with-lover-after-he-drove-off-with-her-spouse-on-bonnet,https://www.straitstimes.com/news/singapore/rss.xml,
3_KEYWORD_FILTER,REJECTED,SG-News,Amos Yee case shows Singapore applies its laws fairly and evenly: Shanmugam,KEYWORD_FILTER: no automotive+cybersec keyword overlap,https://www.straitstimes.com/singapore/amos-yee-case-shows-spore-applies-its-laws-fairly-and-evenly-shanmugam,https://www.straitstimes.com/news/singapore/rss.xml,
3_KEYWORD_FILTER,REJECTED,SG-News,"Large families with young children to receive $1,000 in LifeSG credits on April 28",KEYWORD_FILTER: no automotive+cybersec keyword overlap,https://www.straitstimes.com/singapore/large-families-with-young-children-to-receive-1000-lifesg-credits-on-april-28,https://www.straitstimes.com/news/singapore/rss.xml,
3_KEYWORD_FILTER,REJECTED,SG-News,"Teen pleads guilty to raping sister, sexually assaulting her since she was 8",KEYWORD_FILTER: no automotive+cybersec keyword overlap,https://www.straitstimes.com/singapore/courts-crime/teen-pleads-guilty-to-raping-his-sister-sexually-assaulting-her-since-she-was-8,https://www.straitstimes.com/news/singapore/rss.xml,
3_KEYWORD_FILTER,REJECTED,SG-News,Parliament to discuss cushioning S’pore from Middle East conflict’s impact; three ministers to speak,KEYWORD_FILTER: no automotive+cybersec keyword overlap,https://www.straitstimes.com/singapore/politics/parliament-to-discuss-cushioning-spore-from-middle-east-conflicts-impact-three-ministers-to-speak,https://www.straitstimes.com/news/singapore/rss.xml,
3_KEYWORD_FILTER,REJECTED,SG-News,Man allegedly vandalised police car after being sentenced for offences including mischief,KEYWORD_FILTER: no automotive+cybersec keyword overlap,https://www.straitstimes.com/singapore/courts-crime/man-allegedly-vandalised-police-car-after-being-sentenced-for-offences-including-mischief,https://www.straitstimes.com/news/singapore/rss.xml,
3_KEYWORD_FILTER,REJECTED,SG-News,S’pore’s first 3D-printed pedestrian bridge set to be completed in Jurong West in 2028,KEYWORD_FILTER: no automotive+cybersec keyword overlap,https://www.straitstimes.com/singapore/transport/spores-first-3d-printed-pedestrian-bridge-set-to-be-completed-in-jurong-west-in-2028,https://www.straitstimes.com/news/singapore/rss.xml,
3_KEYWORD_FILTER,REJECTED,SG-News,"Man, 71, reported missing; last seen at Adam Road Food Centre",KEYWORD_FILTER: no automotive+cybersec keyword overlap,https://www.straitstimes.com/singapore/man-71-reported-missing-after-last-seen-at-adam-road-food-centre,https://www.straitstimes.com/news/singapore/rss.xml,
3_KEYWORD_FILTER,REJECTED,SG-News,Travellers flying out of Singapore allowed only 2 power banks from April 15; extras to be discarded,KEYWORD_FILTER: no automotive+cybersec keyword overlap,https://www.straitstimes.com/singapore/transport/travellers-flying-out-of-singapore-only-allowed-2-power-banks-from-april-15-extras-to-be-discarded,https://www.straitstimes.com/news/singapore/rss.xml,
3_KEYWORD_FILTER,REJECTED,SG-News,"Science Talk: There is climate value in S-E Asia’s protected areas, but we’re failing to use it",KEYWORD_FILTER: no automotive+cybersec keyword overlap,https://www.straitstimes.com/science-talk-there-is-climate-value-in-south-east-asias-protected-areas-but-were-failing-to-use-it,https://www.straitstimes.com/news/singapore/rss.xml,
3_KEYWORD_FILTER,REJECTED,SG-News,Parliament to discuss cushioning S’pore from impact of Middle East conflict; 3 ministers to speak,KEYWORD_FILTER: no automotive+cybersec keyword overlap,https://www.businesstimes.com.sg/singapore/parliament-discuss-cushioning-spore-impact-middle-east-conflict-3-ministers-speak,https://www.businesstimes.com.sg/rss/singapore,
3_KEYWORD_FILTER,REJECTED,SG-News,New senior counsel Danny Ong calls on lawyers to dare to be unconventional in modern legal landscape,KEYWORD_FILTER: no automotive+cybersec keyword overlap,https://www.businesstimes.com.sg/singapore/new-senior-counsel-danny-ong-calls-lawyers-dare-be-unconventional-modern-legal-landscape,https://www.businesstimes.com.sg/rss/singapore,
3_KEYWORD_FILTER,REJECTED,SG-News,"Singapore retail sales jump 8.3% in February, boosted by Chinese New Year",KEYWORD_FILTER: no automotive+cybersec keyword overlap,https://www.businesstimes.com.sg/singapore/singapore-retail-sales-jump-8-3-february-boosted-chinese-new-year,https://www.businesstimes.com.sg/rss/singapore,
3_KEYWORD_FILTER,REJECTED,SG-News,Travellers flying out of Singapore allowed only 2 power banks from Apr 15; extras to be discarded,KEYWORD_FILTER: no automotive+cybersec keyword overlap,https://www.businesstimes.com.sg/singapore/travellers-flying-out-singapore-allowed-only-2-power-banks-apr-15-extras-be-discarded,https://www.businesstimes.com.sg/rss/singapore,
3_KEYWORD_FILTER,REJECTED,SG-News,Why where you park your joint venture matters: Lessons from a US$689 million shareholder dispute,KEYWORD_FILTER: no automotive+cybersec keyword overlap,https://www.businesstimes.com.sg/singapore/why-where-you-park-your-joint-venture-matters-lessons-us689-million-shareholder-dispute,https://www.businesstimes.com.sg/rss/singapore,
3_KEYWORD_FILTER,REJECTED,SG-News,Iran war: Singapore likely to roll out targeted support in Parliament as energy costs rise,KEYWORD_FILTER: no automotive+cybersec keyword overlap,https://www.businesstimes.com.sg/singapore/iran-war-singapore-likely-roll-out-targeted-support-parliament-energy-costs-rise,https://www.businesstimes.com.sg/rss/singapore,
3_KEYWORD_FILTER,REJECTED,SG-News,Car dealers race to secure S$68m to renew lease for Singapore’s largest used-car hub,KEYWORD_FILTER: no automotive+cybersec keyword overlap,https://www.businesstimes.com.sg/singapore/car-dealers-race-secure-s68m-renew-lease-singapores-largest-used-car-hub,https://www.businesstimes.com.sg/rss/singapore,
3_KEYWORD_FILTER,REJECTED,SG-News,"After Yeo’s, Tiger Beer: Why some Singapore F&B firms leave – while others stay",KEYWORD_FILTER: no automotive+cybersec keyword overlap,https://www.businesstimes.com.sg/singapore/after-yeos-tiger-beer-why-some-singapore-fb-firms-leave-while-others-stay,https://www.businesstimes.com.sg/rss/singapore,
3_KEYWORD_FILTER,REJECTED,SG-News,S’pore has not yet curbed fuel and energy use in managing impact of Middle East conflict: Shanmugam,KEYWORD_FILTER: no automotive+cybersec keyword overlap,https://www.businesstimes.com.sg/singapore/spore-has-not-yet-curbed-fuel-and-energy-use-managing-impact-middle-east-conflict-shanmugam,https://www.businesstimes.com.sg/rss/singapore,
3_KEYWORD_FILTER,REJECTED,SG-News,Vietnam growth slows as rising energy costs feed uncertainty,KEYWORD_FILTER: no automotive+cybersec keyword overlap,https://www.businesstimes.com.sg/international/vietnam-growth-slows-rising-energy-costs-feed-uncertainty,https://www.businesstimes.com.sg/rss/singapore,
3_KEYWORD_FILTER,REJECTED,SG-News,WP disciplinary panel completes investigations into party chief Pritam Singh,KEYWORD_FILTER: no automotive+cybersec keyword overlap,https://www.businesstimes.com.sg/singapore/wp-disciplinary-panel-completes-investigations-party-chief-pritam-singh,https://www.businesstimes.com.sg/rss/singapore,
