stage,status,source,title,reason,url,feed_url,published_sgt
1_SCRAPER_DATE,REJECTED,Cybersec,"Geopolitics, AI, and Cybersecurity: Insights From RSAC 2026",TOO_OLD: published before 72h cutoff,https://www.darkreading.com/cybersecurity-operations/geopolitics-ai-cybersecurity-insights-rsac-2026,https://www.darkreading.com/rss.xml,03-04-2026 05:14:27
1_SCRAPER_DATE,REJECTED,Cybersec,Not Toying Around: Hasbro Attack May Take 'Weeks' to Remediate,TOO_OLD: published before 72h cutoff,https://www.darkreading.com/cyberattacks-data-breaches/toying-around-hasbro-attack-remediate,https://www.darkreading.com/rss.xml,03-04-2026 04:28:36
1_SCRAPER_DATE,REJECTED,Cybersec,Security Bosses Are All-In on AI. Here's Why,TOO_OLD: published before 72h cutoff,https://www.darkreading.com/cybersecurity-operations/security-bosses-all-in-ai,https://www.darkreading.com/rss.xml,03-04-2026 03:12:45
1_SCRAPER_DATE,REJECTED,Cybersec,"RSAC 2026: AI Dominates, But Community Remains Key to Security",TOO_OLD: published before 72h cutoff,https://www.darkreading.com/cybersecurity-operations/rsac-2026-ai-dominates-community,https://www.darkreading.com/rss.xml,02-04-2026 23:56:32
1_SCRAPER_DATE,REJECTED,Cybersec,Bank Trojan 'Casbaneiro' Worms Through Latin America,TOO_OLD: published before 72h cutoff,https://www.darkreading.com/cyberattacks-data-breaches/bank-trojan-casbaneiro-worms-latin-america,https://www.darkreading.com/rss.xml,02-04-2026 21:00:00
1_SCRAPER_DATE,REJECTED,Cybersec,Ransomware Will Hit Hospitals. Rehearsals Are Key to Defense,TOO_OLD: published before 72h cutoff,https://www.darkreading.com/cybersecurity-operations/ransomware-hospitals-preparation-key-defense,https://www.darkreading.com/rss.xml,02-04-2026 06:04:43
1_SCRAPER_DATE,REJECTED,Cybersec,LatAm's Self-Taught Cyber Talent Overlooked Amid Cyberattack Glut,TOO_OLD: published before 72h cutoff,https://www.darkreading.com/remote-workforce/latam-cyber-talent-overlooked-cyberattack-glut,https://www.darkreading.com/rss.xml,02-04-2026 03:00:00
1_SCRAPER_DATE,REJECTED,Cybersec,Cyberattacks Intensify Pressure on Latin American Governments,TOO_OLD: published before 72h cutoff,https://www.darkreading.com/cyber-risk/cyberattacks-latin-american-governments,https://www.darkreading.com/rss.xml,02-04-2026 00:52:54
1_SCRAPER_DATE,REJECTED,Cybersec,Venom Stealer MaaS Platform Commoditizes ClickFix Attacks,TOO_OLD: published before 72h cutoff,https://www.darkreading.com/endpoint-security/venom-stealer-maas-commoditizes-clickfix-attacks,https://www.darkreading.com/rss.xml,01-04-2026 22:54:23
1_SCRAPER_DATE,REJECTED,Cybersec,Are We Training AI Too Late?,TOO_OLD: published before 72h cutoff,https://www.darkreading.com/cybersecurity-analytics/are-we-training-ai-too-late,https://www.darkreading.com/rss.xml,01-04-2026 18:40:13
1_SCRAPER_DATE,REJECTED,Cybersec,The Forgotten Endpoint: Security Risks of Dormant Devices,TOO_OLD: published before 72h cutoff,https://www.darkreading.com/endpoint-security/forgotten-endpoint-security-risks-dormant-devices,https://www.darkreading.com/rss.xml,01-04-2026 06:13:34
1_SCRAPER_DATE,REJECTED,Cybersec,Axios NPM Package Compromised in Precision Attack,TOO_OLD: published before 72h cutoff,https://www.darkreading.com/application-security/axios-npm-package-compromised-precision-attack,https://www.darkreading.com/rss.xml,01-04-2026 04:55:13
1_SCRAPER_DATE,REJECTED,Cybersec,Meta Pauses Work With Mercor After Data Breach Puts AI Industry Secrets at Risk,TOO_OLD: published before 72h cutoff,https://www.wired.com/story/meta-pauses-work-with-mercor-after-data-breach-puts-ai-industry-secrets-at-risk/,https://www.wired.com/feed/category/security/latest/rss,04-04-2026 05:28:14
1_SCRAPER_DATE,REJECTED,Cybersec,CBP Facility Codes Sure Seem to Have Leaked Via Online Flashcards,TOO_OLD: published before 72h cutoff,https://www.wired.com/story/cbp-facility-codes-sure-seem-to-have-leaked-via-online-flashcards/,https://www.wired.com/feed/category/security/latest/rss,03-04-2026 17:00:00
1_SCRAPER_DATE,REJECTED,Cybersec,"‘Uncanny Valley’: Iran’s Threats on US Tech, Trump’s Plans for Midterms, and Polymarket’s Pop-up Flop",TOO_OLD: published before 72h cutoff,https://www.wired.com/story/uncanny-valley-podcast-iran-targets-us-tech-polymarket-pop-up-trump-midterms/,https://www.wired.com/feed/category/security/latest/rss,03-04-2026 05:04:22
1_SCRAPER_DATE,REJECTED,Cybersec,What Happens When a Nuclear Site Is Hit?,TOO_OLD: published before 72h cutoff,https://www.wired.com/story/heres-what-can-happen-when-the-us-bombs-irans-nuclear-sites/,https://www.wired.com/feed/category/security/latest/rss,03-04-2026 02:08:08
1_SCRAPER_DATE,REJECTED,Cybersec,Unmasking the Paramilitary Agents Behind Trump’s Violent Immigration Crackdown,TOO_OLD: published before 72h cutoff,https://www.wired.com/story/border-patrol-bortac-borstar-use-of-force-midway-blitz/,https://www.wired.com/feed/category/security/latest/rss,02-04-2026 18:00:00
1_SCRAPER_DATE,REJECTED,Cybersec,Apple Will Push Out Rare ‘Backported’ Patches to Protect iOS 18 Users From DarkSword Hacking Tool,TOO_OLD: published before 72h cutoff,https://www.wired.com/story/apple-will-push-out-rare-backported-patches-to-protect-ios-18-users-from-darksword-hacking-tool/,https://www.wired.com/feed/category/security/latest/rss,01-04-2026 08:49:08
1_SCRAPER_DATE,REJECTED,Cybersec,Iran Threatens to Start Attacking Major US Tech Firms on April 1,TOO_OLD: published before 72h cutoff,https://www.wired.com/story/iran-threatens-to-start-attacking-major-us-tech-firms-on-april-1/,https://www.wired.com/feed/category/security/latest/rss,01-04-2026 05:25:12
1_SCRAPER_DATE,REJECTED,Cybersec,The US Military’s GPS Software Is an $8 Billion Mess,TOO_OLD: published before 72h cutoff,https://www.wired.com/story/the-us-militarys-gps-software-is-an-8-billion-mess/,https://www.wired.com/feed/category/security/latest/rss,01-04-2026 01:34:46
1_SCRAPER_DATE,REJECTED,Cybersec,The Broken System That Keeps Shipping Crews Stranded in the Strait of Hormuz,TOO_OLD: published before 72h cutoff,https://www.wired.com/story/legal-loopholes-leave-shipping-crews-stranded-in-the-strait-of-hormuz/,https://www.wired.com/feed/category/security/latest/rss,31-03-2026 21:38:52
1_SCRAPER_DATE,REJECTED,Cybersec,Iranian Hackers Breached Kash Patel’s Email—but Not the FBI’s,TOO_OLD: published before 72h cutoff,https://www.wired.com/story/iranian-hackers-breached-the-fbi-directors-personal-email-but-not-the-fbi/,https://www.wired.com/feed/category/security/latest/rss,28-03-2026 03:45:21
1_SCRAPER_DATE,REJECTED,Cybersec,How Trump’s Plot to Grab Iran's Nuclear Fuel Would Actually Work,TOO_OLD: published before 72h cutoff,https://www.wired.com/story/us-iran-war-nuclear-extraction-ground-operation/,https://www.wired.com/feed/category/security/latest/rss,27-03-2026 05:42:52
1_SCRAPER_DATE,REJECTED,Cybersec,A $20 Billion Crypto Scam Market Faces a New Government Crackdown,TOO_OLD: published before 72h cutoff,https://www.wired.com/story/20-billion-xinbi-guarantee-uk-sanctions/,https://www.wired.com/feed/category/security/latest/rss,26-03-2026 23:15:53
1_SCRAPER_DATE,REJECTED,Cybersec,Using a VPN May Subject You to NSA Spying,TOO_OLD: published before 72h cutoff,https://www.wired.com/story/using-a-vpn-may-subject-you-to-nsa-spying/,https://www.wired.com/feed/category/security/latest/rss,26-03-2026 21:32:52
1_SCRAPER_DATE,REJECTED,Cybersec,"Anduril Wants to Own the Future of War Tech. Mishaps, Delays, and Challenges Abound",TOO_OLD: published before 72h cutoff,https://www.wired.com/story/andurils-real-war-is-with-itself/,https://www.wired.com/feed/category/security/latest/rss,26-03-2026 18:00:00
1_SCRAPER_DATE,REJECTED,Cybersec,When Satellite Data Becomes a Weapon,TOO_OLD: published before 72h cutoff,https://www.wired.com/story/when-satellite-data-becomes-a-weapon/,https://www.wired.com/feed/category/security/latest/rss,25-03-2026 21:00:42
1_SCRAPER_DATE,REJECTED,Cybersec,"Iranians Don’t Have a Missile Alert System, So Volunteers Built Their Own Warning Map",TOO_OLD: published before 72h cutoff,https://www.wired.com/story/iranians-dont-have-a-missile-alert-system-so-volunteers-built-their-own-warning-map/,https://www.wired.com/feed/category/security/latest/rss,25-03-2026 17:00:00
1_SCRAPER_DATE,REJECTED,Cybersec,Your Body Is Betraying Your Right to Privacy,TOO_OLD: published before 72h cutoff,https://www.wired.com/story/book-excerpt-your-data-will-be-used-against-you-andrew-guthrie-ferguson/,https://www.wired.com/feed/category/security/latest/rss,24-03-2026 18:00:00
1_SCRAPER_DATE,REJECTED,Cybersec,Trump’s FY2027 budget again targets CISA,TOO_OLD: published before 72h cutoff,https://www.cybersecuritydive.com/news/cisa-white-house-budget-fy27/816615/,https://www.cybersecuritydive.com/feeds/news/,04-04-2026 00:18:00
1_SCRAPER_DATE,REJECTED,Cybersec,Researchers warn of critical flaws in Progress ShareFile,TOO_OLD: published before 72h cutoff,https://www.cybersecuritydive.com/news/researchers-critical-flaws-progress-sharefile/816599/,https://www.cybersecuritydive.com/feeds/news/,04-04-2026 00:01:00
1_SCRAPER_DATE,REJECTED,Cybersec,Government agencies see cyber threats as major barrier to tech improvements,TOO_OLD: published before 72h cutoff,https://www.cybersecuritydive.com/news/cybersecurity-modernization-ai-ey-survey/816590/,https://www.cybersecuritydive.com/feeds/news/,03-04-2026 23:05:00
1_SCRAPER_DATE,REJECTED,Cybersec,Critical flaw in F5 BIG-IP faces wide exploitation risk,TOO_OLD: published before 72h cutoff,https://www.cybersecuritydive.com/news/critical-flaw-in-f5-big-ip-faces-wide-exploitation-risk/816475/,https://www.cybersecuritydive.com/feeds/news/,02-04-2026 23:01:58
1_SCRAPER_DATE,REJECTED,Cybersec,"Retail and hospitality CISOs expect budget growth, new AI headaches and opportunities",TOO_OLD: published before 72h cutoff,https://www.cybersecuritydive.com/news/retail-hospitality-ai-cybersecurity-cisos-survey/816460/,https://www.cybersecuritydive.com/feeds/news/,02-04-2026 22:16:42
1_SCRAPER_DATE,REJECTED,Cybersec,"Cyberattack hits Hasbro, impacting orders and shipping",TOO_OLD: published before 72h cutoff,https://www.cybersecuritydive.com/news/cyberattack-hasbro-impacting-orders-shipping/816375/,https://www.cybersecuritydive.com/feeds/news/,02-04-2026 02:09:37
1_SCRAPER_DATE,REJECTED,Cybersec,Axios open-source library targeted in sophisticated supply chain attack,TOO_OLD: published before 72h cutoff,https://www.cybersecuritydive.com/news/axios-open-source-library-targeted-in-sophisticated-supply-chain-attack/816343/,https://www.cybersecuritydive.com/feeds/news/,01-04-2026 23:27:11
1_SCRAPER_DATE,REJECTED,Cybersec,Iran-linked actors target Middle Eastern city governments to undermine missile-strike responses,TOO_OLD: published before 72h cutoff,https://www.cybersecuritydive.com/news/iran-cyberattack-missile-strikes-password-spraying/816333/,https://www.cybersecuritydive.com/feeds/news/,01-04-2026 23:00:08
1_SCRAPER_DATE,REJECTED,Cybersec,"The Cyber Express Weekly Roundup: Ransomware, and Supply Chain Breaches Surge",TOO_OLD: published before 72h cutoff,https://thecyberexpress.com/tce-weekly-roundup-ransomware-supply-chain/,https://thecyberexpress.com/feed,03-04-2026 15:33:00
1_SCRAPER_DATE,REJECTED,Cybersec,Vietnam-Linked PXA Stealer Campaign Exploits LinkedIn to Target Professionals Globally,TOO_OLD: published before 72h cutoff,https://thecyberexpress.com/pxa-stealer-vietnam-linked-actors-linkedin/,https://thecyberexpress.com/feed,02-04-2026 16:51:25
1_SCRAPER_DATE,REJECTED,Cybersec,FBI Warns of Data Security Risks in Foreign-Developed Mobile Apps,TOO_OLD: published before 72h cutoff,https://thecyberexpress.com/data-security-risks-in-foreign-mobile-apps/,https://thecyberexpress.com/feed,02-04-2026 16:48:13
1_SCRAPER_DATE,REJECTED,Cybersec,FBI Warns of AVrecon Malware Targeting Network Devices Across 163 Countries,TOO_OLD: published before 72h cutoff,https://thecyberexpress.com/fbi-warns-of-avrecon-malware/,https://thecyberexpress.com/feed,02-04-2026 16:43:00
1_SCRAPER_DATE,REJECTED,Cybersec,Sophos named a 2026 Gartner® Peer Insights™ Customers' Choice for Managed Detection and Response,TOO_OLD: published before 72h cutoff,https://www.sophos.com/en-us/blog/sophos-gartner-peer-insights-mdr,https://news.sophos.com/en-us/feed,03-04-2026 08:00:00
1_SCRAPER_DATE,REJECTED,Cybersec,Amazon GuardDuty enhances detection efficacy with Sophos threat intelligence,TOO_OLD: published before 72h cutoff,https://www.sophos.com/en-us/blog/sophos-amazon-guardduty,https://news.sophos.com/en-us/feed,02-04-2026 08:00:00
1_SCRAPER_DATE,REJECTED,Cybersec,The High Cost of Low Trust: Our Commitment to Radical Transparency,TOO_OLD: published before 72h cutoff,https://www.sophos.com/en-us/blog/the-high-cost-of-low-trust-our-commitment-to-radical-transparency,https://news.sophos.com/en-us/feed,31-03-2026 08:00:00
1_SCRAPER_DATE,REJECTED,Cybersec,The Cybersecurity Trust Reality in 2026,TOO_OLD: published before 72h cutoff,https://www.sophos.com/en-us/blog/the-cybersecurity-trust-reality-in-2026,https://news.sophos.com/en-us/feed,31-03-2026 08:00:00
1_SCRAPER_DATE,REJECTED,Cybersec,Axios npm package compromised to deploy malware,TOO_OLD: published before 72h cutoff,https://www.sophos.com/en-us/blog/axios-npm-package-compromised-to-deploy-malware,https://news.sophos.com/en-us/feed,31-03-2026 08:00:00
1_SCRAPER_DATE,REJECTED,Cybersec,"Incident responders, s'il vous plait: Invites lead to odd malware events",TOO_OLD: published before 72h cutoff,https://www.sophos.com/en-us/blog/incident-responders-s-il-vous-plait,https://news.sophos.com/en-us/feed,30-03-2026 08:00:00
1_SCRAPER_DATE,REJECTED,Cybersec,Where AI in the SOC is actually delivering — and where it isn’t,TOO_OLD: published before 72h cutoff,https://www.sophos.com/en-us/blog/where-ai-in-the-soc-is-actually-delivering,https://news.sophos.com/en-us/feed,30-03-2026 08:00:00
1_SCRAPER_DATE,REJECTED,Cybersec,Cybersecurity for Education – Sophos Protected Classroom,TOO_OLD: published before 72h cutoff,https://www.sophos.com/en-us/blog/cybersecurity-for-education-sophos-protected-classroom,https://news.sophos.com/en-us/feed,24-03-2026 08:00:00
1_SCRAPER_DATE,REJECTED,Cybersec,Sophos Firewall ranked the #1 overall firewall solution in G2’s Spring 2026 reports,TOO_OLD: published before 72h cutoff,https://www.sophos.com/en-us/blog/sophos-firewall-ranked-the-1-overall-firewall-solution-in-g2-s-spring-2026-reports,https://news.sophos.com/en-us/feed,24-03-2026 08:00:00
1_SCRAPER_DATE,REJECTED,Cybersec,Nigerian romance scammer jailed after being caught out by fellow fraudster,TOO_OLD: published before 72h cutoff,https://www.bitdefender.com/en-us/blog/hotforsecurity/nigerian-romance-scammer-jailed,https://www.grahamcluley.com/feed,03-04-2026 17:38:30
1_SCRAPER_DATE,REJECTED,Cybersec,Smashing Security podcast #461: This man hid $400 million in a fishing rod. Then it vanished,TOO_OLD: published before 72h cutoff,https://grahamcluley.com/smashing-security-podcast-461/,https://www.grahamcluley.com/feed,02-04-2026 07:26:02
1_SCRAPER_DATE,REJECTED,Cybersec,Alleged RedLine malware developer extradited to United States,TOO_OLD: published before 72h cutoff,https://www.bitdefender.com/en-us/blog/hotforsecurity/redline-malware-developer-extradited,https://www.grahamcluley.com/feed,01-04-2026 17:00:13
1_SCRAPER_DATE,REJECTED,Cybersec,"Iranian hackers breach FBI director’s personal email, and post his CV and photos online",TOO_OLD: published before 72h cutoff,https://www.bitdefender.com/en-us/blog/hotforsecurity/iranian-hackers-breach-fbi-directors-personal-email-post-cv-and-photos-online,https://www.grahamcluley.com/feed,31-03-2026 15:37:52
1_SCRAPER_DATE,REJECTED,Cybersec,World Leaks data extortion: What you need to know,TOO_OLD: published before 72h cutoff,https://www.fortra.com/blog/world-leaks-data-extortion-what-you-need-know,https://www.grahamcluley.com/feed,27-03-2026 02:57:03
1_SCRAPER_DATE,REJECTED,Cybersec,Smashing Security podcast #460: Never knock on the door of a nuclear submarine base and ask for a selfie,TOO_OLD: published before 72h cutoff,https://grahamcluley.com/smashing-security-podcast-460/,https://www.grahamcluley.com/feed,26-03-2026 19:27:56
1_SCRAPER_DATE,REJECTED,Cybersec,"How one man used 10,000 bots to steal $8,000,000 from music artists",TOO_OLD: published before 72h cutoff,https://www.bitdefender.com/en-us/blog/hotforsecurity/10k-bots-steal-8-million-from-music-artists,https://www.grahamcluley.com/feed,25-03-2026 18:22:04
1_SCRAPER_DATE,REJECTED,Cybersec,Denver’s crosswalks hacked to broadcast anti-Trump messages,TOO_OLD: published before 72h cutoff,https://www.bitdefender.com/en-us/blog/hotforsecurity/denvers-crosswalks-hacked-broadcast-anti-trump-messages,https://www.grahamcluley.com/feed,20-03-2026 23:24:45
1_SCRAPER_DATE,REJECTED,Cybersec,LeakNet ransomware: what you need to know,TOO_OLD: published before 72h cutoff,https://www.fortra.com/blog/leaknet-ransomware-what-you-need-know,https://www.grahamcluley.com/feed,20-03-2026 18:18:08
1_SCRAPER_DATE,REJECTED,Cybersec,Smashing Security podcast #459: This clever scam nearly hijacked a tech CEO’s Apple ID,TOO_OLD: published before 72h cutoff,https://grahamcluley.com/smashing-security-podcast-459/,https://www.grahamcluley.com/feed,19-03-2026 08:15:54
1_SCRAPER_DATE,REJECTED,Cybersec,Free parking in Russia after Distributed Denial-of-Service attack knocks city’s parking system offline,TOO_OLD: published before 72h cutoff,https://www.bitdefender.com/en-us/blog/hotforsecurity/free-parking-russia-distributed-denial-of-service-attack-parking-system,https://www.grahamcluley.com/feed,17-03-2026 01:27:34
1_SCRAPER_DATE,REJECTED,Cybersec,Fraudsters are using public planning records to target permit applicants,TOO_OLD: published before 72h cutoff,https://www.fortra.com/blog/fraudsters-are-using-public-planning-records-target-permit-applicants,https://www.grahamcluley.com/feed,13-03-2026 02:31:52
1_SCRAPER_DATE,REJECTED,Cybersec,Your Signal account is safe – unless you fall for this trick,TOO_OLD: published before 72h cutoff,https://www.bitdefender.com/en-us/blog/hotforsecurity/signal-account-safe-unless-fall-for-this-trick,https://www.grahamcluley.com/feed,12-03-2026 20:12:48
1_SCRAPER_DATE,REJECTED,Cybersec,Smashing Security podcast #458: How not to steal $46 million from the US government,TOO_OLD: published before 72h cutoff,https://grahamcluley.com/smashing-security-podcast-458/,https://www.grahamcluley.com/feed,12-03-2026 08:30:37
1_SCRAPER_DATE,REJECTED,Cybersec,Twitter suspended 800 million accounts last year – so why does manipulation remain so rampant?,TOO_OLD: published before 72h cutoff,https://www.bitdefender.com/en-us/blog/hotforsecurity/twitter-suspended-800-million-accounts-last-year-so-why-does-manipulation-remain-so-rampant,https://www.grahamcluley.com/feed,10-03-2026 23:54:37
1_SCRAPER_DATE,REJECTED,Cybersec,How hackers bypassed MFA with a $120 phishing kit – until a global takedown shut it down,TOO_OLD: published before 72h cutoff,https://www.bitdefender.com/en-us/blog/hotforsecurity/hackers-bypassed-mfa-120-phishing-kit-global-takedown-shut-down,https://www.grahamcluley.com/feed,07-03-2026 01:58:41
1_SCRAPER_DATE,REJECTED,Cybersec,Smashing Security podcast #457: How a cybersecurity boss framed his own employee,TOO_OLD: published before 72h cutoff,https://grahamcluley.com/smashing-security-podcast-457/,https://www.grahamcluley.com/feed,05-03-2026 08:33:23
1_SCRAPER_DATE,REJECTED,Cybersec,They seized $4.8m in crypto… then gave the master key to the internet,TOO_OLD: published before 72h cutoff,https://www.bitdefender.com/en-us/blog/hotforsecurity/they-seized-4-8m-in-crypto-then-gave-the-master-key-to-the-internet,https://www.grahamcluley.com/feed,04-03-2026 00:09:08
1_SCRAPER_DATE,REJECTED,Cybersec,Your staff are your biggest security risk: AI is making it worse,TOO_OLD: published before 72h cutoff,https://www.fortra.com/blog/your-staff-are-your-biggest-security-risk-ai-making-it-worse,https://www.grahamcluley.com/feed,27-02-2026 05:21:23
1_SCRAPER_DATE,REJECTED,Cybersec,Notorious ransomware gang allegedly blackmailed by fake FSB officer,TOO_OLD: published before 72h cutoff,https://www.bitdefender.com/en-us/blog/hotforsecurity/ransomware-gang-blackmailed-fake-fsb-officer,https://www.grahamcluley.com/feed,26-02-2026 21:40:32
1_SCRAPER_DATE,REJECTED,Cybersec,"The Week in Vulnerabilities: AI Frameworks, VMware, and Critical ICS Exposure",TOO_OLD: published before 72h cutoff,https://cyble.com/blog/cyble-weekly-vulnerabilities-report-apr-01/,https://cyble.com/feed,02-04-2026 17:52:21
1_SCRAPER_DATE,REJECTED,Cybersec,How Cyble Blaze AI Predicts Cyber Threats 6 Months in Advance Using Agentic Intelligence,TOO_OLD: published before 72h cutoff,https://cyble.com/blog/predictive-cybersecurity-cyble-blaze-ai/,https://cyble.com/feed,01-04-2026 23:23:51
1_SCRAPER_DATE,REJECTED,Cybersec,Professional Networks Under Attack: Vietnam-Linked Actors Deploy PXA Stealer in Global Infostealer Campaign,TOO_OLD: published before 72h cutoff,https://cyble.com/blog/professional-networks-under-attack-by-infostealer/,https://cyble.com/feed,30-03-2026 22:57:53
1_SCRAPER_DATE,REJECTED,Cybersec,Hybrid Warfare 2026: When Cyber Operations and Kinetic Attacks Converge,TOO_OLD: published before 72h cutoff,https://cyble.com/blog/hybrid-warfare-2026-cyber-kinetic-threats/,https://cyble.com/feed,30-03-2026 21:53:52
1_SCRAPER_DATE,REJECTED,Cybersec,China’s APT41 and the Expanding Enterprise Attack Surface: What Security Teams Must Prepare For,TOO_OLD: published before 72h cutoff,https://cyble.com/blog/apt41-enterprise-attack-surface-cyber-risk/,https://cyble.com/feed,27-03-2026 22:01:39
1_SCRAPER_DATE,REJECTED,Cybersec,The Energy Sector’s Ransomware Nightmare: Why Critical Infrastructure Can’t Catch a Break,TOO_OLD: published before 72h cutoff,https://cyble.com/blog/energy-sector-ransomware-attack-report/,https://cyble.com/feed,26-03-2026 15:09:36
1_SCRAPER_DATE,REJECTED,Cybersec,"The Agentic AI Attack Surface: Prompt Injection, Memory Poisoning, and How to Defend Against Them",TOO_OLD: published before 72h cutoff,https://cyble.com/blog/prompt-injection-attacks-agentic-ai-security/,https://cyble.com/feed,25-03-2026 21:41:52
1_SCRAPER_DATE,REJECTED,Cybersec,"India’s Evolving Cyber Threat Landscape: State-Sponsored Attacks, Hacktivism, and What’s Next in 2026",TOO_OLD: published before 72h cutoff,https://cyble.com/blog/india-cyber-threat-landscape-2026-attacks-trends/,https://cyble.com/feed,24-03-2026 12:50:51
1_SCRAPER_DATE,REJECTED,Cybersec,North Korea’s Crypto Theft Operations: The Role of Lazarus Group in State-Sponsored Financial Warfare,TOO_OLD: published before 72h cutoff,https://cyble.com/blog/lazarus-group-bitrefill-cyberattack/,https://cyble.com/feed,20-03-2026 20:27:47
1_SCRAPER_DATE,REJECTED,Cybersec,Fake ChatGPT Ad Blocker Chrome Extension Caught Spying on Users,TOO_OLD: published before 72h cutoff,https://hackread.com/fake-chatgpt-ad-blocker-chrome-extension-spy-users/,https://hackread.com/feed,04-04-2026 04:03:33
1_SCRAPER_DATE,REJECTED,Cybersec,North Korean Hackers Abuse GitHub to Spy on South Korean Firms,TOO_OLD: published before 72h cutoff,https://hackread.com/north-korean-hackers-github-spy-south-korean-firms/,https://hackread.com/feed,04-04-2026 01:05:23
1_SCRAPER_DATE,REJECTED,Cybersec,AI Firm Mercor Confirms Breach as Hackers Claim 4TB of Stolen Data,TOO_OLD: published before 72h cutoff,https://hackread.com/ai-firm-mercor-breach-hackers-4tb-data/,https://hackread.com/feed,03-04-2026 23:21:14
1_SCRAPER_DATE,REJECTED,Cybersec,AI Future: The Leading International AI and Web3 Forum to Take Place in April,TOO_OLD: published before 72h cutoff,https://hackread.com/ai-future-the-leading-international-ai-and-web3-forum-to-take-place-in-april/,https://hackread.com/feed,03-04-2026 21:33:35
1_SCRAPER_DATE,REJECTED,Cybersec,Friday Squid Blogging: Jurassic Fish Chokes on Squid,TOO_OLD: published before 72h cutoff,https://www.schneier.com/blog/archives/2026/04/friday-squid-blogging-jurassic-fish-chokes-on-squid.html,https://www.schneier.com/feed/atom,04-04-2026 05:07:06
1_SCRAPER_DATE,REJECTED,Cybersec,Company that Secretly Records and Publishes Zoom Meetings,TOO_OLD: published before 72h cutoff,https://www.schneier.com/blog/archives/2026/04/company-that-secretly-records-and-publishes-zoom-meetings.html,https://www.schneier.com/feed/atom,03-04-2026 19:08:17
1_SCRAPER_DATE,REJECTED,Cybersec,US Bans All Foreign-Made Consumer Routers,TOO_OLD: published before 72h cutoff,https://www.schneier.com/blog/archives/2026/04/us-bans-all-foreign-made-consumer-routers.html,https://www.schneier.com/feed/atom,03-04-2026 01:28:27
1_SCRAPER_DATE,REJECTED,Cybersec,Possible US Government iPhone Hacking Tool Leaked,TOO_OLD: published before 72h cutoff,https://www.schneier.com/blog/archives/2026/04/possible-us-government-iphone-hacking-tool-leaked.html,https://www.schneier.com/feed/atom,02-04-2026 18:05:43
1_SCRAPER_DATE,REJECTED,Cybersec,Is “Hackback” Official US Cybersecurity Strategy?,TOO_OLD: published before 72h cutoff,https://www.schneier.com/blog/archives/2026/04/is-hackback-official-us-cybersecurity-strategy.html,https://www.schneier.com/feed/atom,02-04-2026 00:57:35
1_SCRAPER_DATE,REJECTED,Cybersec,A Taxonomy of Cognitive Security,TOO_OLD: published before 72h cutoff,https://www.schneier.com/blog/archives/2026/04/a-taxonomy-of-cognitive-security.html,https://www.schneier.com/feed/atom,01-04-2026 17:59:07
1_SCRAPER_DATE,REJECTED,Cybersec,Inventors of Quantum Cryptography Win Turing Award,TOO_OLD: published before 72h cutoff,https://www.schneier.com/blog/archives/2026/03/inventors-of-quantum-cryptography-win-turing-award.html,https://www.schneier.com/feed/atom,31-03-2026 19:05:32
