stage,status,source,title,reason,url,feed_url,published_sgt
1_SCRAPER_DATE,REJECTED,Cybersec,"Cyberattack hits Hasbro, impacting orders and shipping",TOO_OLD: published before 72h cutoff,https://www.cybersecuritydive.com/news/cyberattack-hasbro-impacting-orders-shipping/816375/,https://www.cybersecuritydive.com/feeds/news/,02-04-2026 02:09:37
1_SCRAPER_DATE,REJECTED,Cybersec,Axios open-source library targeted in sophisticated supply chain attack,TOO_OLD: published before 72h cutoff,https://www.cybersecuritydive.com/news/axios-open-source-library-targeted-in-sophisticated-supply-chain-attack/816343/,https://www.cybersecuritydive.com/feeds/news/,01-04-2026 23:27:11
1_SCRAPER_DATE,REJECTED,Cybersec,Iran-linked actors target Middle Eastern city governments to undermine missile-strike responses,TOO_OLD: published before 72h cutoff,https://www.cybersecuritydive.com/news/iran-cyberattack-missile-strikes-password-spraying/816333/,https://www.cybersecuritydive.com/feeds/news/,01-04-2026 23:00:08
1_SCRAPER_DATE,REJECTED,Cybersec,"Cybersecurity risks shape AI adoption, but investment accelerates nonetheless",TOO_OLD: published before 72h cutoff,https://www.cybersecuritydive.com/news/ai-cybersecurity-concerns-adoption-agentic-investment/816262/,https://www.cybersecuritydive.com/feeds/news/,01-04-2026 03:15:05
1_SCRAPER_DATE,REJECTED,Cybersec,"Iran actors’ claims raise questions about larger cyber threat to US, allies",TOO_OLD: published before 72h cutoff,https://www.cybersecuritydive.com/news/iran-actors-claims-cyber-threat-us-allies/816228/,https://www.cybersecuritydive.com/feeds/news/,31-03-2026 23:24:35
1_SCRAPER_DATE,REJECTED,Cybersec,"Google Chrome Update Fixes 21 Flaws, Warns of Actively Exploited Vulnerability",TOO_OLD: published before 72h cutoff,https://thecyberexpress.com/chrome-stable-channel-update-security/,https://thecyberexpress.com/feed,01-04-2026 19:25:06
1_SCRAPER_DATE,REJECTED,Cybersec,AI Startup Mercor Hit by Supply Chain Attack Linked to LiteLLM,TOO_OLD: published before 72h cutoff,https://thecyberexpress.com/mercor-cyberattack/,https://thecyberexpress.com/feed,01-04-2026 16:39:03
1_SCRAPER_DATE,REJECTED,Cybersec,North Korea’s Lazarus Group Behind the Axios npm Supply Chain Attack,TOO_OLD: published before 72h cutoff,https://thecyberexpress.com/lazarus-behind-axios-npm-supply-chain-attack/,https://thecyberexpress.com/feed,01-04-2026 14:23:58
1_SCRAPER_DATE,REJECTED,Cybersec,"Hacked, Leaked, Public—What the Kash Patel Email Hack Is Really About",TOO_OLD: published before 72h cutoff,https://thecyberexpress.com/what-kash-patel-email-hack-is-really-about/,https://thecyberexpress.com/feed,01-04-2026 13:44:30
1_SCRAPER_DATE,REJECTED,Cybersec,The High Cost of Low Trust: Our Commitment to Radical Transparency,TOO_OLD: published before 72h cutoff,https://www.sophos.com/en-us/blog/the-high-cost-of-low-trust-our-commitment-to-radical-transparency,https://news.sophos.com/en-us/feed,31-03-2026 08:00:00
1_SCRAPER_DATE,REJECTED,Cybersec,The Cybersecurity Trust Reality in 2026,TOO_OLD: published before 72h cutoff,https://www.sophos.com/en-us/blog/the-cybersecurity-trust-reality-in-2026,https://news.sophos.com/en-us/feed,31-03-2026 08:00:00
1_SCRAPER_DATE,REJECTED,Cybersec,Axios npm package compromised to deploy malware,TOO_OLD: published before 72h cutoff,https://www.sophos.com/en-us/blog/axios-npm-package-compromised-to-deploy-malware,https://news.sophos.com/en-us/feed,31-03-2026 08:00:00
1_SCRAPER_DATE,REJECTED,Cybersec,"Incident responders, s'il vous plait: Invites lead to odd malware events",TOO_OLD: published before 72h cutoff,https://www.sophos.com/en-us/blog/incident-responders-s-il-vous-plait,https://news.sophos.com/en-us/feed,30-03-2026 08:00:00
1_SCRAPER_DATE,REJECTED,Cybersec,Where AI in the SOC is actually delivering — and where it isn’t,TOO_OLD: published before 72h cutoff,https://www.sophos.com/en-us/blog/where-ai-in-the-soc-is-actually-delivering,https://news.sophos.com/en-us/feed,30-03-2026 08:00:00
1_SCRAPER_DATE,REJECTED,Cybersec,Cybersecurity for Education – Sophos Protected Classroom,TOO_OLD: published before 72h cutoff,https://www.sophos.com/en-us/blog/cybersecurity-for-education-sophos-protected-classroom,https://news.sophos.com/en-us/feed,24-03-2026 08:00:00
1_SCRAPER_DATE,REJECTED,Cybersec,Sophos Firewall ranked the #1 overall firewall solution in G2’s Spring 2026 reports,TOO_OLD: published before 72h cutoff,https://www.sophos.com/en-us/blog/sophos-firewall-ranked-the-1-overall-firewall-solution-in-g2-s-spring-2026-reports,https://news.sophos.com/en-us/feed,24-03-2026 08:00:00
1_SCRAPER_DATE,REJECTED,Cybersec,Smashing Security podcast #461: This man hid $400 million in a fishing rod. Then it vanished,TOO_OLD: published before 72h cutoff,https://grahamcluley.com/smashing-security-podcast-461/,https://www.grahamcluley.com/feed,02-04-2026 07:26:02
1_SCRAPER_DATE,REJECTED,Cybersec,Alleged RedLine malware developer extradited to United States,TOO_OLD: published before 72h cutoff,https://www.bitdefender.com/en-us/blog/hotforsecurity/redline-malware-developer-extradited,https://www.grahamcluley.com/feed,01-04-2026 17:00:13
1_SCRAPER_DATE,REJECTED,Cybersec,"Iranian hackers breach FBI director’s personal email, and post his CV and photos online",TOO_OLD: published before 72h cutoff,https://www.bitdefender.com/en-us/blog/hotforsecurity/iranian-hackers-breach-fbi-directors-personal-email-post-cv-and-photos-online,https://www.grahamcluley.com/feed,31-03-2026 15:37:52
1_SCRAPER_DATE,REJECTED,Cybersec,World Leaks data extortion: What you need to know,TOO_OLD: published before 72h cutoff,https://www.fortra.com/blog/world-leaks-data-extortion-what-you-need-know,https://www.grahamcluley.com/feed,27-03-2026 02:57:03
1_SCRAPER_DATE,REJECTED,Cybersec,Smashing Security podcast #460: Never knock on the door of a nuclear submarine base and ask for a selfie,TOO_OLD: published before 72h cutoff,https://grahamcluley.com/smashing-security-podcast-460/,https://www.grahamcluley.com/feed,26-03-2026 19:27:56
1_SCRAPER_DATE,REJECTED,Cybersec,"How one man used 10,000 bots to steal $8,000,000 from music artists",TOO_OLD: published before 72h cutoff,https://www.bitdefender.com/en-us/blog/hotforsecurity/10k-bots-steal-8-million-from-music-artists,https://www.grahamcluley.com/feed,25-03-2026 18:22:04
1_SCRAPER_DATE,REJECTED,Cybersec,Denver’s crosswalks hacked to broadcast anti-Trump messages,TOO_OLD: published before 72h cutoff,https://www.bitdefender.com/en-us/blog/hotforsecurity/denvers-crosswalks-hacked-broadcast-anti-trump-messages,https://www.grahamcluley.com/feed,20-03-2026 23:24:45
1_SCRAPER_DATE,REJECTED,Cybersec,LeakNet ransomware: what you need to know,TOO_OLD: published before 72h cutoff,https://www.fortra.com/blog/leaknet-ransomware-what-you-need-know,https://www.grahamcluley.com/feed,20-03-2026 18:18:08
1_SCRAPER_DATE,REJECTED,Cybersec,Smashing Security podcast #459: This clever scam nearly hijacked a tech CEO’s Apple ID,TOO_OLD: published before 72h cutoff,https://grahamcluley.com/smashing-security-podcast-459/,https://www.grahamcluley.com/feed,19-03-2026 08:15:54
1_SCRAPER_DATE,REJECTED,Cybersec,Free parking in Russia after Distributed Denial-of-Service attack knocks city’s parking system offline,TOO_OLD: published before 72h cutoff,https://www.bitdefender.com/en-us/blog/hotforsecurity/free-parking-russia-distributed-denial-of-service-attack-parking-system,https://www.grahamcluley.com/feed,17-03-2026 01:27:34
1_SCRAPER_DATE,REJECTED,Cybersec,Fraudsters are using public planning records to target permit applicants,TOO_OLD: published before 72h cutoff,https://www.fortra.com/blog/fraudsters-are-using-public-planning-records-target-permit-applicants,https://www.grahamcluley.com/feed,13-03-2026 02:31:52
1_SCRAPER_DATE,REJECTED,Cybersec,Your Signal account is safe – unless you fall for this trick,TOO_OLD: published before 72h cutoff,https://www.bitdefender.com/en-us/blog/hotforsecurity/signal-account-safe-unless-fall-for-this-trick,https://www.grahamcluley.com/feed,12-03-2026 20:12:48
1_SCRAPER_DATE,REJECTED,Cybersec,Smashing Security podcast #458: How not to steal $46 million from the US government,TOO_OLD: published before 72h cutoff,https://grahamcluley.com/smashing-security-podcast-458/,https://www.grahamcluley.com/feed,12-03-2026 08:30:37
1_SCRAPER_DATE,REJECTED,Cybersec,Twitter suspended 800 million accounts last year – so why does manipulation remain so rampant?,TOO_OLD: published before 72h cutoff,https://www.bitdefender.com/en-us/blog/hotforsecurity/twitter-suspended-800-million-accounts-last-year-so-why-does-manipulation-remain-so-rampant,https://www.grahamcluley.com/feed,10-03-2026 23:54:37
1_SCRAPER_DATE,REJECTED,Cybersec,How hackers bypassed MFA with a $120 phishing kit – until a global takedown shut it down,TOO_OLD: published before 72h cutoff,https://www.bitdefender.com/en-us/blog/hotforsecurity/hackers-bypassed-mfa-120-phishing-kit-global-takedown-shut-down,https://www.grahamcluley.com/feed,07-03-2026 01:58:41
1_SCRAPER_DATE,REJECTED,Cybersec,Smashing Security podcast #457: How a cybersecurity boss framed his own employee,TOO_OLD: published before 72h cutoff,https://grahamcluley.com/smashing-security-podcast-457/,https://www.grahamcluley.com/feed,05-03-2026 08:33:23
1_SCRAPER_DATE,REJECTED,Cybersec,They seized $4.8m in crypto… then gave the master key to the internet,TOO_OLD: published before 72h cutoff,https://www.bitdefender.com/en-us/blog/hotforsecurity/they-seized-4-8m-in-crypto-then-gave-the-master-key-to-the-internet,https://www.grahamcluley.com/feed,04-03-2026 00:09:08
1_SCRAPER_DATE,REJECTED,Cybersec,Your staff are your biggest security risk: AI is making it worse,TOO_OLD: published before 72h cutoff,https://www.fortra.com/blog/your-staff-are-your-biggest-security-risk-ai-making-it-worse,https://www.grahamcluley.com/feed,27-02-2026 05:21:23
1_SCRAPER_DATE,REJECTED,Cybersec,Notorious ransomware gang allegedly blackmailed by fake FSB officer,TOO_OLD: published before 72h cutoff,https://www.bitdefender.com/en-us/blog/hotforsecurity/ransomware-gang-blackmailed-fake-fsb-officer,https://www.grahamcluley.com/feed,26-02-2026 21:40:32
1_SCRAPER_DATE,REJECTED,Cybersec,How Cyble Blaze AI Predicts Cyber Threats 6 Months in Advance Using Agentic Intelligence,TOO_OLD: published before 72h cutoff,https://cyble.com/blog/predictive-cybersecurity-cyble-blaze-ai/,https://cyble.com/feed,01-04-2026 23:23:51
1_SCRAPER_DATE,REJECTED,Cybersec,Professional Networks Under Attack: Vietnam-Linked Actors Deploy PXA Stealer in Global Infostealer Campaign,TOO_OLD: published before 72h cutoff,https://cyble.com/blog/professional-networks-under-attack-by-infostealer/,https://cyble.com/feed,30-03-2026 22:57:53
1_SCRAPER_DATE,REJECTED,Cybersec,Hybrid Warfare 2026: When Cyber Operations and Kinetic Attacks Converge,TOO_OLD: published before 72h cutoff,https://cyble.com/blog/hybrid-warfare-2026-cyber-kinetic-threats/,https://cyble.com/feed,30-03-2026 21:53:52
1_SCRAPER_DATE,REJECTED,Cybersec,China’s APT41 and the Expanding Enterprise Attack Surface: What Security Teams Must Prepare For,TOO_OLD: published before 72h cutoff,https://cyble.com/blog/apt41-enterprise-attack-surface-cyber-risk/,https://cyble.com/feed,27-03-2026 22:01:39
1_SCRAPER_DATE,REJECTED,Cybersec,The Energy Sector’s Ransomware Nightmare: Why Critical Infrastructure Can’t Catch a Break,TOO_OLD: published before 72h cutoff,https://cyble.com/blog/energy-sector-ransomware-attack-report/,https://cyble.com/feed,26-03-2026 15:09:36
1_SCRAPER_DATE,REJECTED,Cybersec,"The Agentic AI Attack Surface: Prompt Injection, Memory Poisoning, and How to Defend Against Them",TOO_OLD: published before 72h cutoff,https://cyble.com/blog/prompt-injection-attacks-agentic-ai-security/,https://cyble.com/feed,25-03-2026 21:41:52
1_SCRAPER_DATE,REJECTED,Cybersec,"India’s Evolving Cyber Threat Landscape: State-Sponsored Attacks, Hacktivism, and What’s Next in 2026",TOO_OLD: published before 72h cutoff,https://cyble.com/blog/india-cyber-threat-landscape-2026-attacks-trends/,https://cyble.com/feed,24-03-2026 12:50:51
1_SCRAPER_DATE,REJECTED,Cybersec,North Korea’s Crypto Theft Operations: The Role of Lazarus Group in State-Sponsored Financial Warfare,TOO_OLD: published before 72h cutoff,https://cyble.com/blog/lazarus-group-bitrefill-cyberattack/,https://cyble.com/feed,20-03-2026 20:27:47
1_SCRAPER_DATE,REJECTED,Cybersec,"The Week in Vulnerabilities: Juniper, Cisco SD-WAN, and Critical ICS Exposure",TOO_OLD: published before 72h cutoff,https://cyble.com/blog/cyble-weekly-vulnerabilities-report-mar-19/,https://cyble.com/feed,20-03-2026 16:50:30
1_SCRAPER_DATE,REJECTED,Cybersec,Is “Hackback” Official US Cybersecurity Strategy?,TOO_OLD: published before 72h cutoff,https://www.schneier.com/blog/archives/2026/04/is-hackback-official-us-cybersecurity-strategy.html,https://www.schneier.com/feed/atom,02-04-2026 00:57:35
1_SCRAPER_DATE,REJECTED,Cybersec,A Taxonomy of Cognitive Security,TOO_OLD: published before 72h cutoff,https://www.schneier.com/blog/archives/2026/04/a-taxonomy-of-cognitive-security.html,https://www.schneier.com/feed/atom,01-04-2026 17:59:07
1_SCRAPER_DATE,REJECTED,Cybersec,Inventors of Quantum Cryptography Win Turing Award,TOO_OLD: published before 72h cutoff,https://www.schneier.com/blog/archives/2026/03/inventors-of-quantum-cryptography-win-turing-award.html,https://www.schneier.com/feed/atom,31-03-2026 19:05:32
1_SCRAPER_DATE,REJECTED,Cybersec,Apple’s Camera Indicator Lights,TOO_OLD: published before 72h cutoff,https://www.schneier.com/blog/archives/2026/03/apples-camera-indicator-lights.html,https://www.schneier.com/feed/atom,30-03-2026 19:08:24
1_SCRAPER_DATE,REJECTED,Cybersec,Friday Squid Blogging: Bioluminescent Bacteria in Squid,TOO_OLD: published before 72h cutoff,https://www.schneier.com/blog/archives/2026/03/friday-squid-blogging-bioluminescent-bacteria-in-squid.html,https://www.schneier.com/feed/atom,28-03-2026 04:18:54
1_SCRAPER_DATE,REJECTED,Cybersec,"As the US Midterms Approach, AI Is Going to Emerge as a Key Issue Concerning Voters",TOO_OLD: published before 72h cutoff,https://www.schneier.com/blog/archives/2026/03/as-the-us-midterms-approach-ai-is-going-to-emerge-as-a-key-issue-concerning-voters.html,https://www.schneier.com/feed/atom,26-03-2026 19:06:39
1_SCRAPER_DATE,REJECTED,Cybersec,‘CanisterWorm’ Springs Wiper Attack Targeting Iran,TOO_OLD: published before 72h cutoff,https://krebsonsecurity.com/2026/03/canisterworm-springs-wiper-attack-targeting-iran/,https://krebsonsecurity.com/feed/,23-03-2026 23:43:04
1_SCRAPER_DATE,REJECTED,Cybersec,Feds Disrupt IoT Botnets Behind Huge DDoS Attacks,TOO_OLD: published before 72h cutoff,https://krebsonsecurity.com/2026/03/feds-disrupt-iot-botnets-behind-huge-ddos-attacks/,https://krebsonsecurity.com/feed/,20-03-2026 08:49:19
1_SCRAPER_DATE,REJECTED,Cybersec,Iran-Backed Hackers Claim Wiper Attack on Medtech Firm Stryker,TOO_OLD: published before 72h cutoff,https://krebsonsecurity.com/2026/03/iran-backed-hackers-claim-wiper-attack-on-medtech-firm-stryker/,https://krebsonsecurity.com/feed/,12-03-2026 00:20:13
1_SCRAPER_DATE,REJECTED,Cybersec,"Microsoft Patch Tuesday, March 2026 Edition",TOO_OLD: published before 72h cutoff,https://krebsonsecurity.com/2026/03/microsoft-patch-tuesday-march-2026-edition/,https://krebsonsecurity.com/feed/,11-03-2026 08:32:51
1_SCRAPER_DATE,REJECTED,Cybersec,How AI Assistants are Moving the Security Goalposts,TOO_OLD: published before 72h cutoff,https://krebsonsecurity.com/2026/03/how-ai-assistants-are-moving-the-security-goalposts/,https://krebsonsecurity.com/feed/,09-03-2026 07:35:42
1_SCRAPER_DATE,REJECTED,Cybersec,Who is the Kimwolf Botmaster “Dort”?,TOO_OLD: published before 72h cutoff,https://krebsonsecurity.com/2026/02/who-is-the-kimwolf-botmaster-dort/,https://krebsonsecurity.com/feed/,28-02-2026 20:01:57
1_SCRAPER_DATE,REJECTED,Cybersec,"‘Starkiller’ Phishing Service Proxies Real Login Pages, MFA",TOO_OLD: published before 72h cutoff,https://krebsonsecurity.com/2026/02/starkiller-phishing-service-proxies-real-login-pages-mfa/,https://krebsonsecurity.com/feed/,21-02-2026 04:00:30
1_SCRAPER_DATE,REJECTED,Cybersec,Kimwolf Botnet Swamps Anonymity Network I2P,TOO_OLD: published before 72h cutoff,https://krebsonsecurity.com/2026/02/kimwolf-botnet-swamps-anonymity-network-i2p/,https://krebsonsecurity.com/feed/,12-02-2026 00:08:11
1_SCRAPER_DATE,REJECTED,Cybersec,"Patch Tuesday, February 2026 Edition",TOO_OLD: published before 72h cutoff,https://krebsonsecurity.com/2026/02/patch-tuesday-february-2026-edition/,https://krebsonsecurity.com/feed/,11-02-2026 05:49:53
1_SCRAPER_DATE,REJECTED,Cybersec,Please Don’t Feed the Scattered Lapsus ShinyHunters,TOO_OLD: published before 72h cutoff,https://krebsonsecurity.com/2026/02/please-dont-feed-the-scattered-lapsus-shiny-hunters/,https://krebsonsecurity.com/feed/,03-02-2026 00:15:16
1_SCRAPER_DATE,REJECTED,Cybersec,"Malicious Script That Gets Rid of ADS, (Wed, Apr 1st)",TOO_OLD: published before 72h cutoff,https://isc.sans.edu/diary/rss/32854,https://isc.sans.edu/rssfeed_full.xml,02-04-2026 04:09:43
1_SCRAPER_DATE,REJECTED,Cybersec,"TeamPCP Supply Chain Campaign: Update 005 - First Confirmed Victim Disclosure, Post-Compromise Cloud Enumeration Documented, and Axios Attribution Narrows, (Wed, Apr 1st)",TOO_OLD: published before 72h cutoff,https://isc.sans.edu/diary/rss/32856,https://isc.sans.edu/rssfeed_full.xml,01-04-2026 21:08:26
1_SCRAPER_DATE,REJECTED,Cybersec,"ISC Stormcast For Wednesday, April 1st, 2026 https://isc.sans.edu/podcastdetail/9874, (Wed, Apr 1st)",TOO_OLD: published before 72h cutoff,https://isc.sans.edu/diary/rss/32852,https://isc.sans.edu/rssfeed_full.xml,01-04-2026 10:05:11
1_SCRAPER_DATE,REJECTED,Cybersec,"Application Control Bypass for Data Exfiltration, (Tue, Mar 31st)",TOO_OLD: published before 72h cutoff,https://isc.sans.edu/diary/rss/32850,https://isc.sans.edu/rssfeed_full.xml,31-03-2026 15:31:45
1_SCRAPER_DATE,REJECTED,Cybersec,"ISC Stormcast For Tuesday, March 31st, 2026 https://isc.sans.edu/podcastdetail/9872, (Tue, Mar 31st)",TOO_OLD: published before 72h cutoff,https://isc.sans.edu/diary/rss/32848,https://isc.sans.edu/rssfeed_full.xml,31-03-2026 10:00:02
1_SCRAPER_DATE,REJECTED,Cybersec,"TeamPCP Supply Chain Campaign: Update 004 - Databricks Investigating Alleged Compromise, TeamPCP Runs Dual Ransomware Operations, and AstraZeneca Data Released, (Mon, Mar 30th)",TOO_OLD: published before 72h cutoff,https://isc.sans.edu/diary/rss/32846,https://isc.sans.edu/rssfeed_full.xml,31-03-2026 08:52:44
1_SCRAPER_DATE,REJECTED,Cybersec,Pro-Russia Hacktivists Conduct Opportunistic Attacks Against US and Global Critical Infrastructure,TOO_OLD: published before 72h cutoff,https://www.cisa.gov/news-events/cybersecurity-advisories/aa25-343a,https://www.cisa.gov/uscert/ncas/alerts.xml,06-12-2025 03:35:38
1_SCRAPER_DATE,REJECTED,Cybersec,CISA Shares Lessons Learned from an Incident Response Engagement,TOO_OLD: published before 72h cutoff,https://www.cisa.gov/news-events/cybersecurity-advisories/aa25-266a,https://www.cisa.gov/uscert/ncas/alerts.xml,22-09-2025 23:12:49
1_SCRAPER_DATE,REJECTED,Cybersec,Countering Chinese State-Sponsored Actors Compromise of Networks Worldwide to Feed Global Espionage System,TOO_OLD: published before 72h cutoff,https://www.cisa.gov/news-events/cybersecurity-advisories/aa25-239a,https://www.cisa.gov/uscert/ncas/alerts.xml,25-08-2025 21:36:40
1_SCRAPER_DATE,REJECTED,Cybersec,CISA and USCG Identify Areas for Cyber Hygiene Improvement After Conducting Proactive Threat Hunt at US Critical Infrastructure Organization,TOO_OLD: published before 72h cutoff,https://www.cisa.gov/news-events/cybersecurity-advisories/aa25-212a,https://www.cisa.gov/uscert/ncas/alerts.xml,30-07-2025 01:53:52
1_SCRAPER_DATE,REJECTED,Cybersec,#StopRansomware: Interlock,TOO_OLD: published before 72h cutoff,https://www.cisa.gov/news-events/cybersecurity-advisories/aa25-203a,https://www.cisa.gov/uscert/ncas/alerts.xml,21-07-2025 22:11:24
1_SCRAPER_DATE,REJECTED,Cybersec,Ransomware Actors Exploit Unpatched SimpleHelp Remote Monitoring and Management to Compromise Utility Billing Software Provider,TOO_OLD: published before 72h cutoff,https://www.cisa.gov/news-events/cybersecurity-advisories/aa25-163a,https://www.cisa.gov/uscert/ncas/alerts.xml,12-06-2025 22:29:54
1_SCRAPER_DATE,REJECTED,Cybersec,Threat Actors Deploy LummaC2 Malware to Exfiltrate Sensitive Data from Organizations,TOO_OLD: published before 72h cutoff,https://www.cisa.gov/news-events/cybersecurity-advisories/aa25-141b,https://www.cisa.gov/uscert/ncas/alerts.xml,21-05-2025 03:20:23
1_SCRAPER_DATE,REJECTED,Cybersec,Russian GRU Targeting Western Logistics Entities and Technology Companies,TOO_OLD: published before 72h cutoff,https://www.cisa.gov/news-events/cybersecurity-advisories/aa25-141a,https://www.cisa.gov/uscert/ncas/alerts.xml,13-05-2025 00:49:12
1_SCRAPER_DATE,REJECTED,Cybersec,Fast Flux: A National Security Threat,TOO_OLD: published before 72h cutoff,https://www.cisa.gov/news-events/cybersecurity-advisories/aa25-093a,https://www.cisa.gov/uscert/ncas/alerts.xml,02-04-2025 03:00:21
1_SCRAPER_DATE,REJECTED,Cybersec,#StopRansomware: Medusa Ransomware,TOO_OLD: published before 72h cutoff,https://www.cisa.gov/news-events/cybersecurity-advisories/aa25-071a,https://www.cisa.gov/uscert/ncas/alerts.xml,11-03-2025 22:52:42
1_SCRAPER_DATE,REJECTED,SG-News,‘No definitive decision’ made for YZJ Maritime to pursue capital market activities in Hong Kong: CEO,TOO_OLD: published before 72h cutoff,https://www.businesstimes.com.sg/companies-markets/no-definitive-decision-made-yzj-maritime-pursue-capital-market-activities-hong-kong-ceo,https://www.businesstimes.com.sg/rss/singapore,01-04-2026 22:05:49
1_SCRAPER_DATE,REJECTED,SG-News,Daily Debrief: What Happened Today (Apr 1),TOO_OLD: published before 72h cutoff,https://www.businesstimes.com.sg/singapore/daily-debrief-what-happened-today-apr-110,https://www.businesstimes.com.sg/rss/singapore,01-04-2026 18:30:00
1_SCRAPER_DATE,REJECTED,SG-News,"Hin Leong founder O.K. Lim, who was to start prison sentence on April 1, has bail extended by a day",TOO_OLD: published before 72h cutoff,https://www.businesstimes.com.sg/singapore/hin-leong-founder-o-k-lim-who-was-start-prison-sentence-april-1-has-bail-extended-day,https://www.businesstimes.com.sg/rss/singapore,01-04-2026 18:10:22
1_SCRAPER_DATE,REJECTED,SG-News,"3 crypto employees arrested in S’pore, extradited to US to face charges over fraud schemes",TOO_OLD: published before 72h cutoff,https://www.businesstimes.com.sg/singapore/3-crypto-employees-arrested-spore-extradited-us-face-charges-over-fraud-schemes,https://www.businesstimes.com.sg/rss/singapore,01-04-2026 18:00:59
1_SCRAPER_DATE,REJECTED,SG-News,AI and gender inequality: DBS’ Tan Su Shan and former Singapore president Halimah Yacob look at rising risks,TOO_OLD: published before 72h cutoff,https://www.businesstimes.com.sg/companies-markets/ai-and-gender-inequality-dbs-tan-su-shan-and-former-singapore-president-halimah-yacob-look-rising,https://www.businesstimes.com.sg/rss/singapore,01-04-2026 16:48:12
1_SCRAPER_DATE,REJECTED,SG-News,National standard for EV charging upgraded to include new tech such as wireless systems,TOO_OLD: published before 72h cutoff,https://www.businesstimes.com.sg/singapore/national-standard-ev-charging-upgraded-include-new-tech-such-wireless-systems,https://www.businesstimes.com.sg/rss/singapore,01-04-2026 14:11:32
1_SCRAPER_DATE,REJECTED,SG-News,"Interactive: Singapore rolls out driverless vehicles, one route at a time",TOO_OLD: published before 72h cutoff,https://www.businesstimes.com.sg/lifestyle/motoring/interactive-singapore-rolls-out-driverless-vehicles-one-route-time,https://www.businesstimes.com.sg/rss/singapore,01-04-2026 14:00:00
1_SCRAPER_DATE,REJECTED,SG-News,OCBC breaches S$100 billion market cap as shares hit record high,TOO_OLD: published before 72h cutoff,https://www.businesstimes.com.sg/companies-markets/banking-finance/ocbc-breaches-s100-billion-market-cap-shares-hit-record-high,https://www.businesstimes.com.sg/rss/singapore,01-04-2026 13:49:28
1_SCRAPER_DATE,REJECTED,SG-News,GIC appoints two investment heads to group executive committee,TOO_OLD: published before 72h cutoff,https://www.businesstimes.com.sg/singapore/gic-appoints-two-investment-heads-group-executive-committee,https://www.businesstimes.com.sg/rss/singapore,01-04-2026 12:43:05
1_SCRAPER_DATE,REJECTED,SG-News,"New IP riders kick in with lower premiums, but higher out-of-pocket costs",TOO_OLD: published before 72h cutoff,https://www.businesstimes.com.sg/singapore/new-ip-riders-kick-lower-premiums-higher-out-pocket-costs,https://www.businesstimes.com.sg/rss/singapore,01-04-2026 10:56:46
1_SCRAPER_DATE,REJECTED,SG-News,Singapore chemical logistics growth still promising despite Middle East war: Katoen Natie execs,TOO_OLD: published before 72h cutoff,https://www.businesstimes.com.sg/companies-markets/energy-commodities/singapore-chemical-logistics-growth-still-promising-despite-middle-east-war-katoen-natie-execs,https://www.businesstimes.com.sg/rss/singapore,01-04-2026 07:00:00
1_SCRAPER_DATE,REJECTED,SG-News,Twelve Cupcakes staff to recover part of unpaid salaries from end-March: F&B union,TOO_OLD: published before 72h cutoff,https://www.businesstimes.com.sg/singapore/twelve-cupcakes-staff-recover-part-unpaid-salaries-end-march-fb-union,https://www.businesstimes.com.sg/rss/singapore,31-03-2026 23:39:42
1_SCRAPER_DATE,REJECTED,SG-News,"Shanmugam, Tan See Leng each awarded S$210,000 in defamation suits against TOC’s Terry Xu",TOO_OLD: published before 72h cutoff,https://www.businesstimes.com.sg/singapore/shanmugam-tan-see-leng-each-awarded-s210000-defamation-suits-against-tocs-terry-xu,https://www.businesstimes.com.sg/rss/singapore,31-03-2026 19:47:04
