stage,status,source,title,reason,url,feed_url
1_SCRAPER_DATE,REJECTED,Auto-RSS,Rule 791D Is in Effect: Turning Compliance into a Competitive Advantage for Connected Vehicle Programs,TOO_OLD: published before 72h cutoff,https://c2a-sec.com/rule-791d-is-in-effect-turning-compliance-into-a-competitive-advantage-for-connected-vehicle-programs/,https://c2a-sec.com/category/connected-vehicles/feed/
1_SCRAPER_DATE,REJECTED,Auto-RSS,New US DoC 791D Rule Finalizes Ban on Chinese and Russian Connected Vehicles,TOO_OLD: published before 72h cutoff,https://c2a-sec.com/new-us-rule-finalizes-ban-on-chinese-and-russian-connected-vehicles/,https://c2a-sec.com/category/connected-vehicles/feed/
1_SCRAPER_DATE,REJECTED,Auto-RSS,Auto-ISAC Software Bill of Materials (SBOM) Information Report – Key Takeaways,TOO_OLD: published before 72h cutoff,https://c2a-sec.com/auto-isac-software-bill-of-materials-sbom-information-report-key-takeaways/,https://c2a-sec.com/category/connected-vehicles/feed/
1_SCRAPER_DATE,REJECTED,Auto-RSS,Regulation Spotlight Q&A with Dave Thomas: Securing Connected Vehicles Supply Chain,TOO_OLD: published before 72h cutoff,https://c2a-sec.com/regulation-spotlight-qa-with-dave-thomas-securing-connected-vehicles-supply-chain/,https://c2a-sec.com/category/connected-vehicles/feed/
1_SCRAPER_DATE,REJECTED,Auto-RSS,A Complete Guide to CRA: How the Cyber Resilience Act Strengthens Automotive Supply Chain Security,TOO_OLD: published before 72h cutoff,https://c2a-sec.com/a-complete-guide-to-cra-how-the-cyber-resilience-act-strengthens-automotive-supply-chain-security/,https://c2a-sec.com/category/connected-vehicles/feed/
1_SCRAPER_DATE,REJECTED,Auto-RSS,The Hidden Risks in Remote Keyless Entry Systems: A Supply Chain Perspective,TOO_OLD: published before 72h cutoff,https://c2a-sec.com/the-hidden-risks-in-remote-keyless-entry-systems-a-supply-chain-perspective/,https://c2a-sec.com/category/connected-vehicles/feed/
1_SCRAPER_DATE,REJECTED,Auto-RSS,Regulation Spotlight: Biden Administration’s Proposed Ban on Chinese and Russian Vehicle Software,TOO_OLD: published before 72h cutoff,https://c2a-sec.com/regulation-spotlight-biden-administrations-proposed-ban-on-chinese-and-russian-vehicle-software/,https://c2a-sec.com/category/connected-vehicles/feed/
1_SCRAPER_DATE,REJECTED,Auto-RSS,CVSS and the Prioritization of Vulnerabilities,TOO_OLD: published before 72h cutoff,https://c2a-sec.com/cvss-and-the-prioritization-of-vulnerabilities/,https://c2a-sec.com/category/connected-vehicles/feed/
1_SCRAPER_DATE,REJECTED,Auto-RSS,Ansys’ Ghita Zouiten Joins C2A Security as Solutions & Account Manager in Munich,TOO_OLD: published before 72h cutoff,https://c2a-sec.com/ansys-ghita-zouiten-joins-c2a-security-as-solutions-account-manager-in-germany/,https://c2a-sec.com/category/connected-vehicles/feed/
1_SCRAPER_DATE,REJECTED,Auto-RSS,C2A Security and Drivesec Collaborate to Elevate Automotive Product Security Testing,TOO_OLD: published before 72h cutoff,https://c2a-sec.com/c2a-security-and-drivesec-collaborate-to-elevate-automotive-product-security-testing/,https://c2a-sec.com/category/connected-vehicles/feed/
1_SCRAPER_DATE,REJECTED,Auto-RSS,CertX and MicroEJ Join Forces to Bring Trustworthy Intelligence to Embedded Devices at Scale,TOO_OLD: published before 72h cutoff,https://certx.com/press-release/certx-and-microej-join-forces-to-bring-trustworthy-intelligence-to-embedded-devices-at-scale/,https://certx.com/feed
1_SCRAPER_DATE,REJECTED,Auto-RSS,Mila and CertX partner to promote AI safety and cybersecurity,TOO_OLD: published before 72h cutoff,https://certx.com/press-release/mila-and-certx-partner-to-promote-ai-safety-and-cybersecurity/,https://certx.com/feed
1_SCRAPER_DATE,REJECTED,Auto-RSS,CertX Joins NVIDIA Halos Inspection Lab Ecosystem for Autonomous and AI-Powered Systems,TOO_OLD: published before 72h cutoff,https://certx.com/press-release/certx-joins-nvidia-halos-inspection-lab-ecosystem-for-autonomous-and-ai-powered-systems/,https://certx.com/feed
1_SCRAPER_DATE,REJECTED,Auto-RSS,Functional Safety Assessment Process according to ISO 26262,TOO_OLD: published before 72h cutoff,https://certx.com/automotive/functional-safety-assessment-process-according-to-iso-26262/,https://certx.com/feed
1_SCRAPER_DATE,REJECTED,Auto-RSS,EU AI Act: Where Standards Meet Regulations?,TOO_OLD: published before 72h cutoff,https://certx.com/ai/eu-ai-act-where-standards-meet-regulations/,https://certx.com/feed
1_SCRAPER_DATE,REJECTED,Auto-RSS,How Human Oversight and Transparency Can Ensure Trustworthy AI in the EU,TOO_OLD: published before 72h cutoff,https://certx.com/ai/how-human-oversight-and-transparency-can-ensure-trustworthy-ai-in-the-eu/,https://certx.com/feed
1_SCRAPER_DATE,REJECTED,Auto-RSS,On the Highway to Compliance: Decoding Cybersecurity Standards in the Automotive Industry,TOO_OLD: published before 72h cutoff,https://certx.com/automotive/on-the-highway-to-compliance-decoding-cybersecurity-standards-in-the-automotive-industry/,https://certx.com/feed
1_SCRAPER_DATE,REJECTED,Auto-RSS,How to calculate hardware reliability in cross-domain applications,TOO_OLD: published before 72h cutoff,https://certx.com/automotive/how-to-calculate-hardware-reliability-in-cross-domain-applications/,https://certx.com/feed
1_SCRAPER_DATE,REJECTED,Auto-RSS,High-Risk AI Systems and Safety Measures: An Overview of The EU AI Act,TOO_OLD: published before 72h cutoff,https://certx.com/ai/high-risk-ai-systems-and-safety-measures-an-overview-of-the-eu-ai-act/,https://certx.com/feed
1_SCRAPER_DATE,REJECTED,Auto-RSS,Software Update for Road Vehicles – Ep.3 – Focus on vehicle requirements (RXsWIN & VTA),TOO_OLD: published before 72h cutoff,https://certx.com/automotive/software-update-for-road-vehicles-ep-3-focus-on-vehicle-requirements-rxswin-vta/,https://certx.com/feed
1_SCRAPER_DATE,REJECTED,Auto-RSS,Do ADAS systems need stronger cybersecurity as vehicles evolve?,TOO_OLD: published before 72h cutoff,https://www.trustonic.com/opinion/do-adas-systems-need-stronger-cybersecurity-as-vehicles-evolve/,https://www.trustonic.com/feed/
1_SCRAPER_DATE,REJECTED,Auto-RSS,Why Google’s enforcement of stricter controls over non-compliant device locking practices is a win-win for consumers & businesses,TOO_OLD: published before 72h cutoff,https://www.trustonic.com/opinion/why-googles-enforcement-of-stricter-controls-over-non-compliant-device-locking-practices-is-a-win-win-for-consumers-businesses/,https://www.trustonic.com/feed/
1_SCRAPER_DATE,REJECTED,Auto-RSS,How Trusted Execution Environment [TEE] are providing cost effective solutions for vehicle safety,TOO_OLD: published before 72h cutoff,https://www.trustonic.com/opinion/how-trusted-execution-environment-tee-are-providing-cost-effective-solutions-for-vehicle-safety/,https://www.trustonic.com/feed/
1_SCRAPER_DATE,REJECTED,Auto-RSS,Guiding principles in connected device security,TOO_OLD: published before 72h cutoff,https://www.trustonic.com/opinion/guiding-principles-in-connected-device-security/,https://www.trustonic.com/feed/
1_SCRAPER_DATE,REJECTED,Auto-RSS,How Secure Device Financing is the Key to Universal Connectivity,TOO_OLD: published before 72h cutoff,https://www.trustonic.com/opinion/how-secure-device-financing-is-the-key-to-universal-connectivity/,https://www.trustonic.com/feed/
1_SCRAPER_DATE,REJECTED,Auto-RSS,Kinibi-700a Commercial Release,TOO_OLD: published before 72h cutoff,https://www.trustonic.com/technical-articles/kinibi-700a-commercial-release/,https://www.trustonic.com/feed/
1_SCRAPER_DATE,REJECTED,Auto-RSS,Cybersecurity regulations are tightening – what businesses should know,TOO_OLD: published before 72h cutoff,https://www.trustonic.com/opinion/cybersecurity-regulations-are-tightening-what-businesses-should-know/,https://www.trustonic.com/feed/
1_SCRAPER_DATE,REJECTED,Auto-RSS,Can security regulations turn the tide on IoT data breaches?,TOO_OLD: published before 72h cutoff,https://www.trustonic.com/opinion/can-security-regulations-turn-the-tide-on-iot-data-breaches/,https://www.trustonic.com/feed/
1_SCRAPER_DATE,REJECTED,Auto-RSS,Trustonic appoints Intralink to increase Japanese market share,TOO_OLD: published before 72h cutoff,https://www.trustonic.com/news/trustonic-appoints-intralink-to-increase-japanese-market-share/,https://www.trustonic.com/feed/
1_SCRAPER_DATE,REJECTED,Auto-RSS,Trustonic unveils launch of Kinibi 700a,TOO_OLD: published before 72h cutoff,https://www.trustonic.com/news/trustonic-unveils-launch-of-kinibi-700a/,https://www.trustonic.com/feed/
1_SCRAPER_DATE,REJECTED,Auto-RSS,How the Kinibi Trusted OS supports the EU Cybersecurity Strategy,TOO_OLD: published before 72h cutoff,https://www.trustonic.com/opinion/how-the-kinibi-trusted-os-supports-the-eu-cybersecurity-strategy/,https://www.trustonic.com/feed/
1_SCRAPER_DATE,REJECTED,Auto-RSS,Google Selects Trustonic as a Global Smartphone Locking Partner,TOO_OLD: published before 72h cutoff,https://www.trustonic.com/news/google-selects-trustonic-as-a-global-smartphone-locking-partner/,https://www.trustonic.com/feed/
1_SCRAPER_DATE,REJECTED,Auto-RSS,From Doorstep Theft to Fake Returns: How to Fight Back Against Smartphone Ecommerce Fraud,TOO_OLD: published before 72h cutoff,https://www.trustonic.com/opinion/from-doorstep-theft-to-fake-returns-how-to-fight-back-against-smartphone-ecommerce-fraud/,https://www.trustonic.com/feed/
1_SCRAPER_DATE,REJECTED,Auto-RSS,The Best SBOM Tools for C/C++ Development,TOO_OLD: published before 72h cutoff,https://runsafesecurity.com/blog/best-sbom-tools-cpp/,https://runsafesecurity.com/feed/
1_SCRAPER_DATE,REJECTED,Auto-RSS,"Why Connected Cars Need “Less Data,” Not More: Cybersecurity, Autonomy, and the Future of Connected Cars",TOO_OLD: published before 72h cutoff,https://runsafesecurity.com/blog/automotive-cybersecurity-connected-vehicles/,https://runsafesecurity.com/feed/
1_SCRAPER_DATE,REJECTED,Auto-RSS,What Is a SBOM? Software Bill of Materials Explained,TOO_OLD: published before 72h cutoff,https://runsafesecurity.com/blog/what-is-sbom/,https://runsafesecurity.com/feed/
1_SCRAPER_DATE,REJECTED,Auto-RSS,Breaking Down the Top 15 Software Supply Chain Attacks,TOO_OLD: published before 72h cutoff,https://runsafesecurity.com/blog/top-software-supply-chain-attacks/,https://runsafesecurity.com/feed/
1_SCRAPER_DATE,REJECTED,Auto-RSS,"The BIS Connected Vehicle Rule, Automakers, and Software Provenance",TOO_OLD: published before 72h cutoff,https://runsafesecurity.com/blog/bis-connected-vehicle-rule/,https://runsafesecurity.com/feed/
1_SCRAPER_DATE,REJECTED,Auto-RSS,Smarter Vulnerability Management in OT: Beyond CVEs and Toward Real Resilience,TOO_OLD: published before 72h cutoff,https://runsafesecurity.com/blog/ot-vulnerability-management/,https://runsafesecurity.com/feed/
1_SCRAPER_DATE,REJECTED,Auto-RSS,Collaboration in Cyberspace: Why Securing Critical Infrastructure Is a Shared Mission,TOO_OLD: published before 72h cutoff,https://runsafesecurity.com/blog/collaboration-critical-infrastructure-cybersecurity/,https://runsafesecurity.com/feed/
1_SCRAPER_DATE,REJECTED,Auto-RSS,The Top 6 Risks of AI-Generated Code in Embedded Systems,TOO_OLD: published before 72h cutoff,https://runsafesecurity.com/blog/6-risks-ai-code-embedded-systems/,https://runsafesecurity.com/feed/
1_SCRAPER_DATE,REJECTED,Auto-RSS,Beyond the Battlefield: How Generative AI Is Transforming Defense Readiness,TOO_OLD: published before 72h cutoff,https://runsafesecurity.com/blog/generative-ai-defense-readiness/,https://runsafesecurity.com/feed/
1_SCRAPER_DATE,REJECTED,Auto-RSS,Meeting ICS Cybersecurity Standards With RunSafe,TOO_OLD: published before 72h cutoff,https://runsafesecurity.com/blog/ics-cybersecurity-standards/,https://runsafesecurity.com/feed/
1_SCRAPER_DATE,REJECTED,Auto-RSS,Safety Meets Security: Building Cyber-Resilient Systems for Aerospace and Defense,TOO_OLD: published before 72h cutoff,https://runsafesecurity.com/blog/resilient-safety-critical-systems/,https://runsafesecurity.com/feed/
1_SCRAPER_DATE,REJECTED,Auto-RSS,The RunSafe Security Platform Is Now Available on Iron Bank: Making DoD Embedded Software Compliant and Resilient,TOO_OLD: published before 72h cutoff,https://runsafesecurity.com/blog/runsafe-security-platform-iron-bank/,https://runsafesecurity.com/feed/
1_SCRAPER_DATE,REJECTED,Auto-RSS,From Black Basta to Mirth Connect: Why Legacy Software Is Healthcare’s Hidden Risk,TOO_OLD: published before 72h cutoff,https://runsafesecurity.com/blog/legacy-software-healthcare/,https://runsafesecurity.com/feed/
1_SCRAPER_DATE,REJECTED,Auto-RSS,Stopping Copyleft: Integrating Software License Compliance & SBOMs,TOO_OLD: published before 72h cutoff,https://runsafesecurity.com/blog/software-license-compliance/,https://runsafesecurity.com/feed/
1_SCRAPER_DATE,REJECTED,Auto-RSS,"The Decade Ahead in Aerospace Cybersecurity: AI, Resilience, and Disposable Weapons Systems",TOO_OLD: published before 72h cutoff,https://runsafesecurity.com/blog/aerospace-cybersecurity-trends/,https://runsafesecurity.com/feed/
1_SCRAPER_DATE,REJECTED,Auto-RSS,Defending the Factory Floor: How to Outsmart Attackers in Smart Manufacturing,TOO_OLD: published before 72h cutoff,https://runsafesecurity.com/blog/smart-factory-cybersecurity/,https://runsafesecurity.com/feed/
1_SCRAPER_DATE,REJECTED,Auto-RSS,"Auto finance fraud is costing dealers up to $20,000 per incident",TOO_OLD: published before 72h cutoff,https://www.helpnetsecurity.com/2026/02/04/auto-dealers-finance-fraud-losses/,https://www.helpnetsecurity.com/tag/automotive-security/feed/
1_SCRAPER_DATE,REJECTED,Auto-RSS,Building a mature automotive cybersecurity program beyond checklists,TOO_OLD: published before 72h cutoff,https://www.helpnetsecurity.com/2025/10/02/robert-sullivan-agero-automotive-cybersecurity-strategies/,https://www.helpnetsecurity.com/tag/automotive-security/feed/
1_SCRAPER_DATE,REJECTED,Auto-RSS,Cybersecurity and the development of software-defined vehicles,TOO_OLD: published before 72h cutoff,https://www.helpnetsecurity.com/2025/08/06/cybersecurity-and-the-development-of-software-defined-vehicles/,https://www.helpnetsecurity.com/tag/automotive-security/feed/
1_SCRAPER_DATE,REJECTED,Auto-RSS,Securing vehicles as they become platforms for code and data,TOO_OLD: published before 72h cutoff,https://www.helpnetsecurity.com/2025/07/15/robert-knoblauch-element-fleet-management-operations-security/,https://www.helpnetsecurity.com/tag/automotive-security/feed/
1_SCRAPER_DATE,REJECTED,Auto-RSS,"Thieves don’t need your car keys, just a wireless signal",TOO_OLD: published before 72h cutoff,https://www.helpnetsecurity.com/2025/06/19/keyless-car-theft-research/,https://www.helpnetsecurity.com/tag/automotive-security/feed/
1_SCRAPER_DATE,REJECTED,Auto-RSS,"SinoTrack GPS vulnerabilities may allow attackers to track, control vehicles",TOO_OLD: published before 72h cutoff,https://www.helpnetsecurity.com/2025/06/16/sinotrack-gps-vulnerabilities-may-allow-attackers-to-track-control-vehicles/,https://www.helpnetsecurity.com/tag/automotive-security/feed/
1_SCRAPER_DATE,REJECTED,Auto-RSS,Connected cars drive into a cybersecurity crisis,TOO_OLD: published before 72h cutoff,https://www.helpnetsecurity.com/2025/04/04/cybersecurity-risks-cars/,https://www.helpnetsecurity.com/tag/automotive-security/feed/
1_SCRAPER_DATE,REJECTED,Auto-RSS,The future of automotive cybersecurity: Treating vehicles as endpoints,TOO_OLD: published before 72h cutoff,https://www.helpnetsecurity.com/2024/09/05/automotive-cybersecurity-future/,https://www.helpnetsecurity.com/tag/automotive-security/feed/
1_SCRAPER_DATE,REJECTED,Auto-RSS,Why the automotive sector is a target for email-based cyber attacks,TOO_OLD: published before 72h cutoff,https://www.helpnetsecurity.com/2024/04/30/automotive-email-compromise-attacks-video/,https://www.helpnetsecurity.com/tag/automotive-security/feed/
1_SCRAPER_DATE,REJECTED,Auto-RSS,Integrating cybersecurity into vehicle design and manufacturing,TOO_OLD: published before 72h cutoff,https://www.helpnetsecurity.com/2024/02/12/yaron-edan-ree-automotive-electric-vehicles-cybersecurity/,https://www.helpnetsecurity.com/tag/automotive-security/feed/
1_SCRAPER_DATE,REJECTED,Cybersec,Israel: RedAlert Spyware Campaign Exploits Wartime Panic With Trojanized App,TOO_OLD: published before 72h cutoff,https://www.infosecurity-magazine.com/news/redalert-israel-spyware-campaign/,https://www.infosecurity-magazine.com/rss/news/
1_SCRAPER_DATE,REJECTED,Cybersec,"AI and Deepfakes Supercharge Sophisticated Cyber-Attacks, Says Cloudflare",TOO_OLD: published before 72h cutoff,https://www.infosecurity-magazine.com/news/ai-deepfakes-supercharge/,https://www.infosecurity-magazine.com/rss/news/
1_SCRAPER_DATE,REJECTED,Cybersec,Leaked Database Sheds Light on Iranian Crypto Sanctions Evasion,TOO_OLD: published before 72h cutoff,https://www.infosecurity-magazine.com/news/iranian-crypto-leaked-database/,https://www.infosecurity-magazine.com/rss/news/
1_SCRAPER_DATE,REJECTED,Cybersec,Half of US CISOs Work the Equivalent of a Six-Day Week,TOO_OLD: published before 72h cutoff,https://www.infosecurity-magazine.com/news/half-us-cisos-work-equivalent/,https://www.infosecurity-magazine.com/rss/news/
1_SCRAPER_DATE,REJECTED,Cybersec,Huge “Shadow Layer” of Organizations Hit by Supply Chain Attacks,TOO_OLD: published before 72h cutoff,https://www.infosecurity-magazine.com/news/shadow-layer-organizations-supply/,https://www.infosecurity-magazine.com/rss/news/
1_SCRAPER_DATE,REJECTED,Cybersec,Iranian Cyber Threat Actor Targets Iraqi Government Officials in AI-Powered Campaign,TOO_OLD: published before 72h cutoff,https://www.infosecurity-magazine.com/news/iran-cyber-threat-actor-iraq/,https://www.infosecurity-magazine.com/rss/news/
1_SCRAPER_DATE,REJECTED,Cybersec,Chrome Unveils Plan For Quantum-Safe HTTPS Certificates,TOO_OLD: published before 72h cutoff,https://www.infosecurity-magazine.com/news/chrome-quantum-safe-https/,https://www.infosecurity-magazine.com/rss/news/
1_SCRAPER_DATE,REJECTED,Cybersec,"Expect Iran to Launch Cyber-Attacks Globally, Warns Google Head of Threat Intel",TOO_OLD: published before 72h cutoff,https://www.infosecurity-magazine.com/news/iran-cyber-attacks-global-google/,https://www.infosecurity-magazine.com/rss/news/
1_SCRAPER_DATE,REJECTED,Cybersec,Hybrid Middle East Conflict Triggers Surge in Global Cyber Activity,TOO_OLD: published before 72h cutoff,https://www.infosecurity-magazine.com/news/middle-east-conflict-surge-global/,https://www.infosecurity-magazine.com/rss/news/
1_SCRAPER_DATE,REJECTED,Cybersec,ClawJacked Bug Enables Covert AI Agent Hijacking,TOO_OLD: published before 72h cutoff,https://www.infosecurity-magazine.com/news/clawjacked-bug-covert-ai-agent/,https://www.infosecurity-magazine.com/rss/news/
1_SCRAPER_DATE,REJECTED,Cybersec,Ransomware Payments Decline 8% as Attacks Surge 50%,TOO_OLD: published before 72h cutoff,https://www.infosecurity-magazine.com/news/ransomware-payments-decline-1/,https://www.infosecurity-magazine.com/rss/news/
1_SCRAPER_DATE,REJECTED,Cybersec,North Korea's APT37 Expands Toolkit to Breach Air-Gapped Networks,TOO_OLD: published before 72h cutoff,https://www.infosecurity-magazine.com/news/north-korea-apt37-expands-toolkit/,https://www.infosecurity-magazine.com/rss/news/
1_SCRAPER_DATE,REJECTED,Cybersec,UK Vulnerability Monitoring Service Cuts Unresolved Security Flaws by 75%,TOO_OLD: published before 72h cutoff,https://www.infosecurity-magazine.com/news/uk-vuln-monitoring-service-cuts/,https://www.infosecurity-magazine.com/rss/news/
1_SCRAPER_DATE,REJECTED,Cybersec,‘Project Compass’ Cracks Down on ‘The Com’: 30 Members of Notorious Cybercrime Gang Arrested,TOO_OLD: published before 72h cutoff,https://www.infosecurity-magazine.com/news/project-compass-com-arrests/,https://www.infosecurity-magazine.com/rss/news/
1_SCRAPER_DATE,REJECTED,Cybersec,Aeternum Botnet Shifts Command Control to Polygon Blockchain,TOO_OLD: published before 72h cutoff,https://www.infosecurity-magazine.com/news/aeternum-botnet-c2-polygon/,https://www.infosecurity-magazine.com/rss/news/
1_SCRAPER_DATE,REJECTED,Cybersec,Darktrace Flags 32 Million Phishing Emails in 2025 as Identity Attacks Intensify,TOO_OLD: published before 72h cutoff,https://www.infosecurity-magazine.com/news/32m-phishing-emails-detected-2025/,https://www.infosecurity-magazine.com/rss/news/
1_SCRAPER_DATE,REJECTED,Cybersec,Exploitable Vulnerabilities Present in 87% of Organizations,TOO_OLD: published before 72h cutoff,https://www.infosecurity-magazine.com/news/exploitable-vulnerabilities-in-87/,https://www.infosecurity-magazine.com/rss/news/
1_SCRAPER_DATE,REJECTED,Cybersec,UK's Data Watchdog Gets a Makeover to Match Growing Demands,TOO_OLD: published before 72h cutoff,https://www.infosecurity-magazine.com/news/uk-data-watchdog-ico-makeover/,https://www.infosecurity-magazine.com/rss/news/
1_SCRAPER_DATE,REJECTED,Cybersec,Google Disrupts ‘Prolific’ and ‘Elusive’ China-Linked Global Hacking Campaign,TOO_OLD: published before 72h cutoff,https://www.infosecurity-magazine.com/news/google-prolific-china-hacking/,https://www.infosecurity-magazine.com/rss/news/
1_SCRAPER_DATE,REJECTED,Cybersec,Global Cyber Agencies Urge Immediate Patching of Cisco SD-WAN Zero Day,TOO_OLD: published before 72h cutoff,https://www.infosecurity-magazine.com/news/immediate-patch-cisco-catalyst/,https://www.infosecurity-magazine.com/rss/news/
1_SCRAPER_DATE,REJECTED,Cybersec,"44% Surge in App Exploits as AI Speeds Up Cyber-Attacks, IBM Finds",TOO_OLD: published before 72h cutoff,https://www.infosecurity-magazine.com/news/app-exploits-surge-ai-speeds/,https://www.infosecurity-magazine.com/rss/news/
1_SCRAPER_DATE,REJECTED,Cybersec,Malicious NuGet Package Targets Stripe Developers,TOO_OLD: published before 72h cutoff,https://www.infosecurity-magazine.com/news/malicious-nuget-package-stripe-devs/,https://www.infosecurity-magazine.com/rss/news/
1_SCRAPER_DATE,REJECTED,Cybersec,Former Defense Contractor Boss Gets 7+ Years for Selling Zero Days,TOO_OLD: published before 72h cutoff,https://www.infosecurity-magazine.com/news/defense-contractor-boss-7-years/,https://www.infosecurity-magazine.com/rss/news/
1_SCRAPER_DATE,REJECTED,Cybersec,ICO’s £14m Reddit Fine Highlights Age Check Privacy Concerns,TOO_OLD: published before 72h cutoff,https://www.infosecurity-magazine.com/news/icos-14m-reddit-fine-age-check/,https://www.infosecurity-magazine.com/rss/news/
1_SCRAPER_DATE,REJECTED,Cybersec,Cost of Insider Incidents Surges 20% to Nearly $20m,TOO_OLD: published before 72h cutoff,https://www.infosecurity-magazine.com/news/cost-of-insider-incidents-surges/,https://www.infosecurity-magazine.com/rss/news/
1_SCRAPER_DATE,REJECTED,Cybersec,Multifaceted Phishing Scheme Deceives Bitpanda Customers,TOO_OLD: published before 72h cutoff,https://www.infosecurity-magazine.com/news/bitpanda-mfa-phishing-scheme/,https://www.infosecurity-magazine.com/rss/news/
1_SCRAPER_DATE,REJECTED,Cybersec,North Korean Lazarus Group Expands Ransomware Activity With Medusa,TOO_OLD: published before 72h cutoff,https://www.infosecurity-magazine.com/news/north-korean-lazarus-group-medusa/,https://www.infosecurity-magazine.com/rss/news/
1_SCRAPER_DATE,REJECTED,Cybersec,AI Accelerates Attacker Breakout Time to Just Four Minutes,TOO_OLD: published before 72h cutoff,https://www.infosecurity-magazine.com/news/ai-accelerates-attack-breakout/,https://www.infosecurity-magazine.com/rss/news/
1_SCRAPER_DATE,REJECTED,Cybersec,"Chinese AI Firms Hit Claude with Distillation Attacks, Anthropic Warns",TOO_OLD: published before 72h cutoff,https://www.infosecurity-magazine.com/news/chinese-ai-claude-distillation/,https://www.infosecurity-magazine.com/rss/news/
1_SCRAPER_DATE,REJECTED,Cybersec,"AI-powered Cyber-Attacks Up Significantly in the Last Year, Warns CrowdStrike",TOO_OLD: published before 72h cutoff,https://www.infosecurity-magazine.com/news/ai-powered-cyberattacks-up/,https://www.infosecurity-magazine.com/rss/news/
1_SCRAPER_DATE,REJECTED,Cybersec,Shai-Hulud-Like Worm Targets Developers via npm and AI Tools,TOO_OLD: published before 72h cutoff,https://www.infosecurity-magazine.com/news/shai-hulud-like-worm-devs-npm-ai/,https://www.infosecurity-magazine.com/rss/news/
1_SCRAPER_DATE,REJECTED,Cybersec,Fraud Investigation Reveals Sophisticated Python Malware,TOO_OLD: published before 72h cutoff,https://www.infosecurity-magazine.com/news/fraud-investigation-python-malware/,https://www.infosecurity-magazine.com/rss/news/
1_SCRAPER_DATE,REJECTED,Cybersec,Russian Cyber Threat Actor Uses GenAI to Compromise Fortinet Firewalls,TOO_OLD: published before 72h cutoff,https://www.infosecurity-magazine.com/news/russian-threat-actor-genai/,https://www.infosecurity-magazine.com/rss/news/
1_SCRAPER_DATE,REJECTED,Cybersec,Leading Semiconductor Supplier Advantest Hit by Ransomware Attack,TOO_OLD: published before 72h cutoff,https://www.infosecurity-magazine.com/news/advantest-ransomware-attack/,https://www.infosecurity-magazine.com/rss/news/
1_SCRAPER_DATE,REJECTED,Cybersec,"Jackpotting Surge Costs Banks Over $20m, Warns FBI",TOO_OLD: published before 72h cutoff,https://www.infosecurity-magazine.com/news/jackpotting-surge-costs-banks-20m/,https://www.infosecurity-magazine.com/rss/news/
1_SCRAPER_DATE,REJECTED,Cybersec,University of Mississippi Medical Center Still Offline After Ransomware Attack,TOO_OLD: published before 72h cutoff,https://www.infosecurity-magazine.com/news/university-mississippi-medical/,https://www.infosecurity-magazine.com/rss/news/
1_SCRAPER_DATE,REJECTED,Cybersec,Dramatic Escalation in Frequency and Power of DDoS Attacks,TOO_OLD: published before 72h cutoff,https://www.infosecurity-magazine.com/news/ddos-escalation-frequency-power/,https://www.infosecurity-magazine.com/rss/news/
