stage,status,source,title,reason,url,feed_url
3_KEYWORD_FILTER,REJECTED,Cybersec,Windows 10 KB5075039 update fixes broken Recovery Environment,KEYWORD_FILTER: no automotive+cybersec keyword overlap,https://www.bleepingcomputer.com/news/microsoft/windows-10-kb5075039-update-fixes-broken-recovery-environment/,https://www.bleepingcomputer.com/feed/
3_KEYWORD_FILTER,REJECTED,Cybersec,"Zero‑Day Attacks on Enterprise Software Reach Record High, Google Warns",KEYWORD_FILTER: no automotive+cybersec keyword overlap,https://www.infosecurity-magazine.com/news/zero-day-enterprise-record-high/,https://www.infosecurity-magazine.com/rss/news/
3_KEYWORD_FILTER,REJECTED,Cybersec,"AI-Driven Insider Risk Now a “Critical Business Threat,” Report Warns",KEYWORD_FILTER: no automotive+cybersec keyword overlap,https://www.infosecurity-magazine.com/news/ai-insider-risk-critical-business/,https://www.infosecurity-magazine.com/rss/news/
3_KEYWORD_FILTER,REJECTED,Cybersec,ContextCrush Flaw Exposes AI Development Tools to Attacks,KEYWORD_FILTER: no automotive+cybersec keyword overlap,https://www.infosecurity-magazine.com/news/contextcrush-ai-development-tools/,https://www.infosecurity-magazine.com/rss/news/
3_KEYWORD_FILTER,REJECTED,Cybersec,Coruna Exploit Kit Targets Older iPhones in Multi-Stage Campaigns,KEYWORD_FILTER: no automotive+cybersec keyword overlap,https://www.infosecurity-magazine.com/news/coruna-exploit-older-iphones/,https://www.infosecurity-magazine.com/rss/news/
3_KEYWORD_FILTER,REJECTED,Cybersec,Zero-Click FreeScout Bug Enables Remote Code Execution,KEYWORD_FILTER: no automotive+cybersec keyword overlap,https://www.infosecurity-magazine.com/news/zeroclick-freescout-bug-remote/,https://www.infosecurity-magazine.com/rss/news/
3_KEYWORD_FILTER,REJECTED,Cybersec,Cisco Issues Patches for 48 Vulnerabilities in Enterprise Networking Products,KEYWORD_FILTER: no automotive+cybersec keyword overlap,https://www.infosecurity-magazine.com/news/cisco-issues-patches-48/,https://www.infosecurity-magazine.com/rss/news/
3_KEYWORD_FILTER,REJECTED,Cybersec,Europol Operation Seizes LeakBase Data Breach Site,KEYWORD_FILTER: no automotive+cybersec keyword overlap,https://www.infosecurity-magazine.com/news/europol-seizes-leakbase-data/,https://www.infosecurity-magazine.com/rss/news/
3_KEYWORD_FILTER,REJECTED,Cybersec,Coalition of Western Countries Launches 6G Cybersecurity Guidelines,KEYWORD_FILTER: no automotive+cybersec keyword overlap,https://www.infosecurity-magazine.com/news/gcot-6g-cybersecurity-guidelines/,https://www.infosecurity-magazine.com/rss/news/
3_KEYWORD_FILTER,REJECTED,Cybersec,Global Takedown Neutralizes Tycoon2FA Phishing Service,KEYWORD_FILTER: no automotive+cybersec keyword overlap,https://www.infosecurity-magazine.com/news/global-takedown-tycoon2fa-phishing/,https://www.infosecurity-magazine.com/rss/news/
3_KEYWORD_FILTER,REJECTED,Cybersec,Surge in Attacks on Surveillance Cameras Linked to Iranian Hackers,KEYWORD_FILTER: no automotive+cybersec keyword overlap,https://www.infosecurity-magazine.com/news/iran-attacks-surveillance-cameras/,https://www.infosecurity-magazine.com/rss/news/
3_KEYWORD_FILTER,REJECTED,Cybersec,"Multi-Stage ""BadPaw"" Malware Campaign Targets Ukraine",KEYWORD_FILTER: no automotive+cybersec keyword overlap,https://www.infosecurity-magazine.com/news/badpaw-malware-targets-ukraine/,https://www.infosecurity-magazine.com/rss/news/
3_KEYWORD_FILTER,REJECTED,Cybersec,The MSP Guide to Using AI-Powered Risk Management to Scale Cybersecurity,KEYWORD_FILTER: no automotive+cybersec keyword overlap,https://thehackernews.com/2026/03/the-msp-guide-to-using-ai-powered-risk.html,https://thehackernews.com/feeds/posts/default
3_KEYWORD_FILTER,REJECTED,Cybersec,Iran-Linked MuddyWater Hackers Target U.S. Networks With New Dindoor Backdoor,KEYWORD_FILTER: no automotive+cybersec keyword overlap,https://thehackernews.com/2026/03/iran-linked-muddywater-hackers-target.html,https://thehackernews.com/feeds/posts/default
3_KEYWORD_FILTER,REJECTED,Cybersec,"China-Linked Hackers Use TernDoor, PeerTime, BruteEntry in South American Telecom Attacks",KEYWORD_FILTER: no automotive+cybersec keyword overlap,https://thehackernews.com/2026/03/china-linked-hackers-use-terndoor.html,https://thehackernews.com/feeds/posts/default
3_KEYWORD_FILTER,REJECTED,Cybersec,Microsoft Reveals ClickFix Campaign Using Windows Terminal to Deploy Lumma Stealer,KEYWORD_FILTER: no automotive+cybersec keyword overlap,https://thehackernews.com/2026/03/microsoft-reveals-clickfix-campaign.html,https://thehackernews.com/feeds/posts/default
3_KEYWORD_FILTER,REJECTED,Cybersec,Hikvision and Rockwell Automation CVSS 9.8 Flaws Added to CISA KEV Catalog,KEYWORD_FILTER: no automotive+cybersec keyword overlap,https://thehackernews.com/2026/03/hikvision-and-rockwell-automation-cvss.html,https://thehackernews.com/feeds/posts/default
3_KEYWORD_FILTER,REJECTED,Cybersec,Cisco Confirms Active Exploitation of Two Catalyst SD-WAN Manager Vulnerabilities,KEYWORD_FILTER: no automotive+cybersec keyword overlap,https://thehackernews.com/2026/03/cisco-confirms-active-exploitation-of.html,https://thehackernews.com/feeds/posts/default
3_KEYWORD_FILTER,REJECTED,Cybersec,Preparing for the Quantum Era: Post-Quantum Cryptography Webinar for Security Leaders,KEYWORD_FILTER: no automotive+cybersec keyword overlap,https://thehackernews.com/2026/03/preparing-for-quantum-era-post-quantum.html,https://thehackernews.com/feeds/posts/default
3_KEYWORD_FILTER,REJECTED,Cybersec,"ThreatsDay Bulletin: DDR5 Bot Scalping, Samsung TV Tracking, Reddit Privacy Fine & More",KEYWORD_FILTER: no automotive+cybersec keyword overlap,https://thehackernews.com/2026/03/threatsday-bulletin-redis-rce-ddr5-bot.html,https://thehackernews.com/feeds/posts/default
3_KEYWORD_FILTER,REJECTED,Cybersec,Dust Specter Targets Iraqi Officials with New SPLITDROP and GHOSTFORM Malware,KEYWORD_FILTER: no automotive+cybersec keyword overlap,https://thehackernews.com/2026/03/dust-specter-targets-iraqi-officials.html,https://thehackernews.com/feeds/posts/default
3_KEYWORD_FILTER,REJECTED,Cybersec,Where Multi-Factor Authentication Stops and Credential Abuse Starts,KEYWORD_FILTER: no automotive+cybersec keyword overlap,https://thehackernews.com/2026/03/where-multi-factor-authentication-stops.html,https://thehackernews.com/feeds/posts/default
3_KEYWORD_FILTER,REJECTED,Cybersec,APT28-Linked Campaign Deploys BadPaw Loader and MeowMeow Backdoor in Ukraine,KEYWORD_FILTER: no automotive+cybersec keyword overlap,https://thehackernews.com/2026/03/apt28-linked-campaign-deploys-badpaw.html,https://thehackernews.com/feeds/posts/default
3_KEYWORD_FILTER,REJECTED,Cybersec,"Europol-Led Operation Takes Down Tycoon 2FA Phishing-as-a-Service Linked to 64,000 Attacks",KEYWORD_FILTER: no automotive+cybersec keyword overlap,https://thehackernews.com/2026/03/europol-led-operation-takes-down-tycoon.html,https://thehackernews.com/feeds/posts/default
3_KEYWORD_FILTER,REJECTED,Cybersec,FBI and Europol Seize LeakBase Forum Used to Trade Stolen Credentials,KEYWORD_FILTER: no automotive+cybersec keyword overlap,https://thehackernews.com/2026/03/fbi-and-europol-seize-leakbase-forum.html,https://thehackernews.com/feeds/posts/default
3_KEYWORD_FILTER,REJECTED,Cybersec,149 Hacktivist DDoS Attacks Hit 110 Organizations in 16 Countries After Middle East Conflict,KEYWORD_FILTER: no automotive+cybersec keyword overlap,https://thehackernews.com/2026/03/149-hacktivist-ddos-attacks-hit-110.html,https://thehackernews.com/feeds/posts/default
3_KEYWORD_FILTER,REJECTED,Cybersec,"Beware of fake OpenClaw installers, even if Bing points you to GitHub",KEYWORD_FILTER: no automotive+cybersec keyword overlap,https://www.malwarebytes.com/blog/news/2026/03/beware-of-fake-openclaw-installers-even-if-bing-points-you-to-github,https://www.malwarebytes.com/blog/feed
3_KEYWORD_FILTER,REJECTED,Cybersec,Fake CleanMyMac site installs SHub Stealer and backdoors crypto wallets,KEYWORD_FILTER: no automotive+cybersec keyword overlap,https://www.malwarebytes.com/blog/threat-intel/2026/03/fake-cleanmymac-site-installs-shub-stealer-and-backdoors-crypto-wallets,https://www.malwarebytes.com/blog/feed
3_KEYWORD_FILTER,REJECTED,Cybersec,Windows File Shredder: When deleting a file isn’t enough,KEYWORD_FILTER: no automotive+cybersec keyword overlap,https://www.malwarebytes.com/blog/product/2026/03/windows-file-shredder-when-deleting-a-file-isnt-enough,https://www.malwarebytes.com/blog/feed
3_KEYWORD_FILTER,REJECTED,Cybersec,Supreme Court to decide whether geofence warrants are constitutional,KEYWORD_FILTER: no automotive+cybersec keyword overlap,https://www.malwarebytes.com/blog/news/2026/03/supreme-court-to-decide-whether-geofence-warrants-are-constitutional,https://www.malwarebytes.com/blog/feed
3_KEYWORD_FILTER,REJECTED,Cybersec,Microsoft spots ClickFix campaign getting users to self-pwn on Windows Terminal,KEYWORD_FILTER: no automotive+cybersec keyword overlap,https://go.theregister.com/feed/www.theregister.com/2026/03/06/microsoft_spots_clickfix_campaign_abusing/,https://www.theregister.com/security/headlines.atom
3_KEYWORD_FILTER,REJECTED,Cybersec,Son of government contractor arrested after alleged $46M crypto heist from US Marshals,KEYWORD_FILTER: no automotive+cybersec keyword overlap,https://go.theregister.com/feed/www.theregister.com/2026/03/06/contractor_son_crypto_arrest/,https://www.theregister.com/security/headlines.atom
3_KEYWORD_FILTER,REJECTED,Cybersec,Microsoft finally gets around to fixing Windows 10 Recovery Environment after breaking it in October,KEYWORD_FILTER: no automotive+cybersec keyword overlap,https://go.theregister.com/feed/www.theregister.com/2026/03/06/microsoft_finally_gets_around_to/,https://www.theregister.com/security/headlines.atom
3_KEYWORD_FILTER,REJECTED,Cybersec,"Transport for London says 2024 breach affected 7M customers, not 5,000",KEYWORD_FILTER: no automotive+cybersec keyword overlap,https://go.theregister.com/feed/www.theregister.com/2026/03/06/tfl_2024_breach_numbers/,https://www.theregister.com/security/headlines.atom
3_KEYWORD_FILTER,REJECTED,Cybersec,Google says spyware makers and China-linked groups dominated zero-day attacks last year,KEYWORD_FILTER: no automotive+cybersec keyword overlap,https://go.theregister.com/feed/www.theregister.com/2026/03/05/zero_day_attacks_enterprise_tech_record/,https://www.theregister.com/security/headlines.atom
3_KEYWORD_FILTER,REJECTED,Cybersec,"Iran intelligence backdoored US bank, airport, software outfit networks",KEYWORD_FILTER: no automotive+cybersec keyword overlap,https://go.theregister.com/feed/www.theregister.com/2026/03/05/mudywater_backdoor_us_networks/,https://www.theregister.com/security/headlines.atom
3_KEYWORD_FILTER,REJECTED,Cybersec,UK watchdog eyes Meta's smart glasses after workers say they 'see everything',KEYWORD_FILTER: no automotive+cybersec keyword overlap,https://go.theregister.com/feed/www.theregister.com/2026/03/05/ico_meta_glasses/,https://www.theregister.com/security/headlines.atom
3_KEYWORD_FILTER,REJECTED,Cybersec,'Hundreds' of Iranian hacking attempts have hit surveillance cameras since the missile strikes,KEYWORD_FILTER: no automotive+cybersec keyword overlap,https://go.theregister.com/feed/www.theregister.com/2026/03/04/iranian_hacking_attempts_ip_cameras/,https://www.theregister.com/security/headlines.atom
3_KEYWORD_FILTER,REJECTED,Cybersec,Malware-laced OpenClaw installers get Bing AI search boost,KEYWORD_FILTER: no automotive+cybersec keyword overlap,https://go.theregister.com/feed/www.theregister.com/2026/03/04/fake_openclaw_installers_malware/,https://www.theregister.com/security/headlines.atom
3_KEYWORD_FILTER,REJECTED,Cybersec,"LexisNexis confirms data breach at Legal &amp; Professional arm, some customer records affected",KEYWORD_FILTER: no automotive+cybersec keyword overlap,https://go.theregister.com/feed/www.theregister.com/2026/03/04/lexisnexis_legal_professional_confirms_data/,https://www.theregister.com/security/headlines.atom
3_KEYWORD_FILTER,REJECTED,Cybersec,Kaspersky dismisses claims Coruna iPhone exploit kit is connected to NSA-linked operation,KEYWORD_FILTER: no automotive+cybersec keyword overlap,https://go.theregister.com/feed/www.theregister.com/2026/03/04/kaspersky_dismisses_claims_that_coruna/,https://www.theregister.com/security/headlines.atom
3_KEYWORD_FILTER,REJECTED,Cybersec,Microsoft warns of ClickFix campaign exploiting Windows Terminal to deliver Lumma Stealer,KEYWORD_FILTER: no automotive+cybersec keyword overlap,https://securityaffairs.com/189046/malware/microsoft-warns-of-clickfix-campaign-exploiting-windows-terminal-for-lumma-stealer.html,https://securityaffairs.com/feed
3_KEYWORD_FILTER,REJECTED,Cybersec,Iran-nexus APT Dust Specter targets Iraq officials with new malware,KEYWORD_FILTER: no automotive+cybersec keyword overlap,https://securityaffairs.com/189033/apt/iran-nexus-apt-dust-specter-targets-iraq-officials-with-new-malware.html,https://securityaffairs.com/feed
3_KEYWORD_FILTER,REJECTED,Cybersec,"U.S. CISA adds Apple, Rockwell, and Hikvision  flaws to its Known Exploited Vulnerabilities catalog",KEYWORD_FILTER: no automotive+cybersec keyword overlap,https://securityaffairs.com/189005/security/u-s-cisa-adds-apple-rockwell-and-hikvision-flaws-to-its-known-exploited-vulnerabilities-catalog.html,https://securityaffairs.com/feed
3_KEYWORD_FILTER,REJECTED,Cybersec,Google GTIG: 90 zero-day flaws exploited in 2025 as enterprise targets grow,KEYWORD_FILTER: no automotive+cybersec keyword overlap,https://securityaffairs.com/188993/security/google-gtig-90-zero-day-flaws-exploited-in-2025-as-enterprise-targets-grow.html,https://securityaffairs.com/feed
3_KEYWORD_FILTER,REJECTED,Cybersec,Phobos Ransomware admin faces up to 20 years after guilty plea,KEYWORD_FILTER: no automotive+cybersec keyword overlap,https://securityaffairs.com/188984/security/phobos-ransomware-admin-faces-up-to-20-years-after-guilty-plea.html,https://securityaffairs.com/feed
3_KEYWORD_FILTER,REJECTED,Cybersec,Russian APT targets Ukraine with BadPaw and MeowMeow malware,KEYWORD_FILTER: no automotive+cybersec keyword overlap,https://securityaffairs.com/188974/apt/russian-apt-targets-ukraine-with-badpaw-and-meowmeow-malware.html,https://securityaffairs.com/feed
3_KEYWORD_FILTER,REJECTED,Cybersec,Operation Leak: FBI and Europol dismantle LeakBase Cybercrime forum,KEYWORD_FILTER: no automotive+cybersec keyword overlap,https://securityaffairs.com/188958/cyber-crime/operation-leak-fbi-and-europol-dismantle-leakbase-cybercrime-forum.html,https://securityaffairs.com/feed
3_KEYWORD_FILTER,REJECTED,Cybersec,Google uncovers Coruna iOS Exploit Kit targeting iOS 13–17.2.1,KEYWORD_FILTER: no automotive+cybersec keyword overlap,https://securityaffairs.com/188928/security/google-uncovers-coruna-ios-exploit-kit-targeting-ios-13-17-2-1.html,https://securityaffairs.com/feed
3_KEYWORD_FILTER,REJECTED,Cybersec,Cisco fixes maximum-severity Secure FMC bugs threatening firewall security,KEYWORD_FILTER: no automotive+cybersec keyword overlap,https://securityaffairs.com/188921/security/cisco-fixes-maximum-severity-secure-fmc-bugs-threatening-firewall-security.html,https://securityaffairs.com/feed
3_KEYWORD_FILTER,REJECTED,Cybersec,Automate or orchestrate? Implementing a streamlined remediation program to shorten MTTR,KEYWORD_FILTER: no automotive+cybersec keyword overlap,https://securityaffairs.com/188917/security/automate-or-orchestrate-implementing-a-streamlined-remediation-program-to-shorten-mttr.html,https://securityaffairs.com/feed
3_KEYWORD_FILTER,REJECTED,Cybersec,CISA Adds iOS Flaws From Coruna Exploit Kit to KEV List,KEYWORD_FILTER: no automotive+cybersec keyword overlap,https://www.securityweek.com/cisa-adds-ios-flaws-from-coruna-exploit-kit-to-kev/,https://www.securityweek.com/feed/
3_KEYWORD_FILTER,REJECTED,Cybersec,Rockwell Vulnerability Allowing Remote ICS Hacking Exploited in Attacks,KEYWORD_FILTER: no automotive+cybersec keyword overlap,https://www.securityweek.com/rockwell-vulnerability-allowing-remote-ics-hacking-exploited-in-attacks/,https://www.securityweek.com/feed/
3_KEYWORD_FILTER,REJECTED,Cybersec,James ‘Aaron’ Bishop Tapped to Serve as New Pentagon CISO,KEYWORD_FILTER: no automotive+cybersec keyword overlap,https://www.securityweek.com/james-aaron-bishop-tapped-to-serve-as-new-pentagon-ciso/,https://www.securityweek.com/feed/
3_KEYWORD_FILTER,REJECTED,Cybersec,"Iranian APT Hacked US Airport, Bank, Software Company",KEYWORD_FILTER: no automotive+cybersec keyword overlap,https://www.securityweek.com/iranian-apt-hacks-us-airport-bank-software-company/,https://www.securityweek.com/feed/
3_KEYWORD_FILTER,REJECTED,Cybersec,Data Security Firm Evervault Raises $25 Million in Series B Funding,KEYWORD_FILTER: no automotive+cybersec keyword overlap,https://www.securityweek.com/data-security-firm-evervault-raises-25-million-in-series-b-funding/,https://www.securityweek.com/feed/
3_KEYWORD_FILTER,REJECTED,Cybersec,Google: Half of 2025’s 90 Exploited Zero-Days Aimed at Enterprises,KEYWORD_FILTER: no automotive+cybersec keyword overlap,https://www.securityweek.com/google-half-of-2025s-90-exploited-zero-days-aimed-at-enterprises/,https://www.securityweek.com/feed/
3_KEYWORD_FILTER,REJECTED,Cybersec,Russian Ransomware Operator Pleads Guilty in US,KEYWORD_FILTER: no automotive+cybersec keyword overlap,https://www.securityweek.com/russian-ransomware-operator-pleads-guilty-in-us/,https://www.securityweek.com/feed/
3_KEYWORD_FILTER,REJECTED,Cybersec,Cisco Warns of More Catalyst SD-WAN Flaws Exploited in the Wild,KEYWORD_FILTER: no automotive+cybersec keyword overlap,https://www.securityweek.com/cisco-warns-of-more-catalyst-sd-wan-flaws-exploited-in-the-wild/,https://www.securityweek.com/feed/
3_KEYWORD_FILTER,REJECTED,Cybersec,Reclaim Security Raises $20 Million to Accelerate Remediation,KEYWORD_FILTER: no automotive+cybersec keyword overlap,https://www.securityweek.com/reclaim-security-raises-20-million-to-accelerate-remediation/,https://www.securityweek.com/feed/
3_KEYWORD_FILTER,REJECTED,Cybersec,"LeakBase Cybercrime Forum Shut Down, Suspects Arrested",KEYWORD_FILTER: no automotive+cybersec keyword overlap,https://www.securityweek.com/leakbase-cybercrime-forum-shut-down-suspects-arrested/,https://www.securityweek.com/feed/
3_KEYWORD_FILTER,REJECTED,Cybersec,Cyberattack on Mexico's Gov't Agencies Highlight AI Threat,KEYWORD_FILTER: no automotive+cybersec keyword overlap,https://www.darkreading.com/application-security/cyberattack-mexico-government-ai-threat,https://www.darkreading.com/rss.xml
3_KEYWORD_FILTER,REJECTED,Cybersec,Nation-State Actor Embraces AI Malware Assembly Line,KEYWORD_FILTER: no automotive+cybersec keyword overlap,https://www.darkreading.com/cyberattacks-data-breaches/nation-state-actor-ai-malware-assembly-line,https://www.darkreading.com/rss.xml
3_KEYWORD_FILTER,REJECTED,Cybersec,"Tycoon 2FA Goes Boom as Europol, Vendors Bust Phishing Platform",KEYWORD_FILTER: no automotive+cybersec keyword overlap,https://www.darkreading.com/threat-intelligence/tycoon-2fa-europol-vendors-bust-phishing-platform,https://www.darkreading.com/rss.xml
3_KEYWORD_FILTER,REJECTED,Cybersec,"Cisco Drops 48 New Firewall Vulnerabilities, 2 Critical",KEYWORD_FILTER: no automotive+cybersec keyword overlap,https://www.darkreading.com/vulnerabilities-threats/cisco-48-firewall-vulnerabilities-2-critical,https://www.darkreading.com/rss.xml
3_KEYWORD_FILTER,REJECTED,Cybersec,Software Development Practices Help Enterprises Tackle Real-Life Risks,KEYWORD_FILTER: no automotive+cybersec keyword overlap,https://www.darkreading.com/cybersecurity-operations/software-development-practices-help-enterprises-tackle-real-life-risks,https://www.darkreading.com/rss.xml
3_KEYWORD_FILTER,REJECTED,Cybersec,LatAm Now Faces 2x More Cyberattacks Than US,KEYWORD_FILTER: no automotive+cybersec keyword overlap,https://www.darkreading.com/threat-intelligence/latam-2x-more-cyberattacks-us,https://www.darkreading.com/rss.xml
3_KEYWORD_FILTER,REJECTED,Cybersec,Stranger Things Meets Cybersecurity: Lessons from the Hive Mind,KEYWORD_FILTER: no automotive+cybersec keyword overlap,https://www.darkreading.com/cybersecurity-operations/stranger-things-meets-cybersecurity-lessons-hive-mind,https://www.darkreading.com/rss.xml
3_KEYWORD_FILTER,REJECTED,Cybersec,Dark Reading Confidential: This Threat Hunter Helped Cops Bust Up An African Cybercrime Syndicate,KEYWORD_FILTER: no automotive+cybersec keyword overlap,https://www.darkreading.com/threat-intelligence/threat-hunter-helped-cops-crack-african-cybercrime-syndicate,https://www.darkreading.com/rss.xml
3_KEYWORD_FILTER,REJECTED,Cybersec,"From Ukraine to Iran, Hacking Security Cameras Is Now Part of War’s ‘Playbook’",KEYWORD_FILTER: no automotive+cybersec keyword overlap,https://www.wired.com/story/from-ukraine-to-iran-hacking-security-cameras-is-now-part-of-wars-playbook/,https://www.wired.com/feed/category/security/latest/rss
3_KEYWORD_FILTER,REJECTED,Cybersec,Here’s Every Country Directly Impacted by the War on Iran,KEYWORD_FILTER: no automotive+cybersec keyword overlap,https://www.wired.com/story/every-country-directly-impacted-by-the-war-on-iran/,https://www.wired.com/feed/category/security/latest/rss
3_KEYWORD_FILTER,REJECTED,Cybersec,The Controversies Finally Caught Up to Kristi Noem,KEYWORD_FILTER: no automotive+cybersec keyword overlap,https://www.wired.com/story/the-controversies-finally-caught-up-to-kristi-noem/,https://www.wired.com/feed/category/security/latest/rss
3_KEYWORD_FILTER,REJECTED,Cybersec,How a Music Streaming CEO Built an Open-Source Global Threat Map in His Spare Time,KEYWORD_FILTER: no automotive+cybersec keyword overlap,https://www.wired.com/story/world-monitor-elie-habib/,https://www.wired.com/feed/category/security/latest/rss
3_KEYWORD_FILTER,REJECTED,Cybersec,How Vulnerable Are Computers to an 80-Year-Old Spy Technique? Congress Wants Answers,KEYWORD_FILTER: no automotive+cybersec keyword overlap,https://www.wired.com/story/how-vulnerable-are-computers-to-an-80-year-old-spy-technique-congress-wants-answers/,https://www.wired.com/feed/category/security/latest/rss
3_KEYWORD_FILTER,REJECTED,Cybersec,"Microsoft, Europol disrupt global phishing platform Tycoon 2FA",KEYWORD_FILTER: no automotive+cybersec keyword overlap,https://www.cybersecuritydive.com/news/microsoft-europol-disrupt-phishing-tycoon-2fa/813904/,https://www.cybersecuritydive.com/feeds/news/
3_KEYWORD_FILTER,REJECTED,Cybersec,Plankey’s nomination as CISA director now in jeopardy,KEYWORD_FILTER: no automotive+cybersec keyword overlap,https://www.cybersecuritydive.com/news/sean-plankey-cisa-dhs-controversy/813898/,https://www.cybersecuritydive.com/feeds/news/
3_KEYWORD_FILTER,REJECTED,Cybersec,Iran-nexus hackers target flaws in surveillance cameras,KEYWORD_FILTER: no automotive+cybersec keyword overlap,https://www.cybersecuritydive.com/news/iran-hackers-target-flaws-ip-cameras/813795/,https://www.cybersecuritydive.com/feeds/news/
3_KEYWORD_FILTER,REJECTED,Cybersec,CrowdStrike reports record quarter amid investor concerns about AI impact,KEYWORD_FILTER: no automotive+cybersec keyword overlap,https://www.cybersecuritydive.com/news/crowdstrike-record-quarter-investor-concerns-ai/813791/,https://www.cybersecuritydive.com/feeds/news/
3_KEYWORD_FILTER,REJECTED,Cybersec,"A Satellite Receiver Trusted by Pentagon, ESA Has More Than 20 Security Flaws — and the Maker Never Responded",KEYWORD_FILTER: no automotive+cybersec keyword overlap,https://thecyberexpress.com/satellite-receiver-vulnerabilities-unpatched/,https://thecyberexpress.com/feed
3_KEYWORD_FILTER,REJECTED,Cybersec,INC Ransom’s Franchise Model Is Putting Critical Infrastructure on the Chopping Block,KEYWORD_FILTER: no automotive+cybersec keyword overlap,https://thecyberexpress.com/inc-ransom-franchise-model/,https://thecyberexpress.com/feed
3_KEYWORD_FILTER,REJECTED,Cybersec,Israel Claims it ‘Struck’ Iran’s Cyber Warfare Headquarters,KEYWORD_FILTER: no automotive+cybersec keyword overlap,https://thecyberexpress.com/israel-hit-iran-cyber-warfare-headquarters/,https://thecyberexpress.com/feed
3_KEYWORD_FILTER,REJECTED,Cybersec,Florida Software Distributor Sentenced for Illicit Microsoft COA Trafficking,KEYWORD_FILTER: no automotive+cybersec keyword overlap,https://thecyberexpress.com/microsoft-certificate-case/,https://thecyberexpress.com/feed
3_KEYWORD_FILTER,REJECTED,Cybersec,"FBI and Europol Dismantle LeakBase Cybercrime Forum With 142,000 Users",KEYWORD_FILTER: no automotive+cybersec keyword overlap,https://thecyberexpress.com/leakbase-cybercrime-forum-taken-down/,https://thecyberexpress.com/feed
3_KEYWORD_FILTER,REJECTED,Cybersec,Smashing Security podcast #457: How a cybersecurity boss framed his own employee,KEYWORD_FILTER: no automotive+cybersec keyword overlap,https://grahamcluley.com/smashing-security-podcast-457/,https://www.grahamcluley.com/feed
3_KEYWORD_FILTER,REJECTED,Cybersec,ClipXDaemon: Autonomous X11 Clipboard Hijacker Delivered via Bincrypter-Based Loader,KEYWORD_FILTER: no automotive+cybersec keyword overlap,https://cyble.com/blog/clipxdaemon-autonomous-x11-clipboard-hijacker/,https://cyble.com/feed
3_KEYWORD_FILTER,REJECTED,Cybersec,Cisco Patches 48 Firewall Vulnerabilities with Two CVSS 10 Flaws,KEYWORD_FILTER: no automotive+cybersec keyword overlap,https://hackread.com/cisco-patches-firewall-vulnerabilities-cvss-10-flaws/,https://hackread.com/feed
3_KEYWORD_FILTER,REJECTED,Cybersec,The Hidden Cyber Risks of Remote Work Infrastructure,KEYWORD_FILTER: no automotive+cybersec keyword overlap,https://hackread.com/hidden-cyber-risks-remote-work-infrastructure/,https://hackread.com/feed
